title,abstract,year
Research Track - Detecting Erroneous Identity Links on the Web Using Network Metrics,"In the absence of a central naming authority on the Semantic Web, it is common for different datasets to refer to the same thing by different IRIs. Whenever multiple names are used to denote the same thing, owl:sameAs statements are needed in order to link the data and foster reuse. Studies that date back as far as 2009, have observed that the owl:sameAs property is sometimes used incorrectly. In this paper, we show how network metrics such as the community structure of the owl:sameAs graph can be used in order to detect such possibly erroneous statements. One benefit of the here presented approach is that it can be applied to the network of owl:sameAs links itself, and does not rely on any additional knowledge. In order to illustrate its ability to scale, the approach is evaluated on the largest collection of identity links to date, containing over 558M owl:sameAs links scraped from the LOD Cloud.",2018
"Research Track - Specifying, Monitoring, and Executing Workflows in Linked Data Environments","We present an ontology for representing workflows over components with Read-Write Linked Data interfaces and give an operational semantics to the ontology via a rule language. Workflow languages have been successfully applied for modelling behaviour in enterprise information systems, in which the data is often managed in a relational database. Linked Data interfaces have been widely deployed on the web to support data integration in very diverse domains, increasingly also in scenarios involving the Internet of Things, in which application behaviour is often specified using imperative programming languages. With our work we aim to combine workflow languages, which allow for the high-level specification of application behaviour by non-expert users, with Linked Data, which allows for decentralised data publication and integrated data access. We show that our ontology is expressive enough to cover the basic workflow patterns and demonstrate the applicability of our approach with a prototype system that observes pilots carrying out tasks in a virtual reality aircraft cockpit. On a synthetic benchmark from the building automation domain, the runtime scales linearly with the size of the number of Internet of Things devices.",2018
Research Track - SPgen : A Benchmark Generator for Spatial Link Discovery Tools,"A number of real and synthetic benchmarks have been proposed for evaluating the performance of link discovery systems. So far, only a limited number of link discovery benchmarks target the problem of linking geo-spatial entities. However, some of the largest knowledge bases of the Linked Open Data Web, such as LinkedGeoData contain vast amounts of spatial information. Several systems that manage spatial data and consider the topology of the spatial resources and the topological relations between them have been developed. In order to assess the ability of these systems to handle the vast amount of spatial data and perform the much needed data integration in the Linked Geo Data Cloud, it is imperative to develop benchmarks for geo-spatial link discovery. In this paper we propose the Spatial Benchmark Generator \(SPgen \) that can be used to test the performance of link discovery systems which deal with topological relations as proposed in the state of the art DE-9IM (Dimensionally Extended nine-Intersection Model). \(SPgen \) implements all topological relations of DE-9IM between LineStrings and Polygons in the two-dimensional space. A comparative analysis with benchmarks produced using \(SPgen \) to assess and identify the capabilities of AML, OntoIdea, RADON and Silk spatial link discovery systems is provided.",2018
Research Track - A Novel Approach and Practical Algorithms for Ontology Integration,"Today a wealth of knowledge and data are distributed using Semantic Web standards. Especially in the (bio)medical domain several sources like SNOMED, NCI, FMA, and more are distributed in the form of OWL ontologies. These can be matched and integrated in order to create one large medical Knowledge Base. However, an important issue is that the structure of these ontologies may be profoundly different hence using the mappings as initially computed can lead to incoherences or changes in their original structure which may affect applications. In this paper we present a framework and novel approach for integrating independently developed ontologies. Starting from an initial seed ontology which may already be in use by an application, new sources are used to iteratively enrich and extend the seed one. To deal with structural incompatibilities we present a novel fine-grained approach which is based on mapping repair and alignment conservativity, formalise it and provide an exact as well as approximate but practical algorithms. Our framework has already been used to integrate a number of medical ontologies and support real-world healthcare services provided by Babylon Health. Finally, we also perform an experimental evaluation and compare with state-of-the-art ontology integration systems that take into account the structure and coherency of the integrated ontologies obtaining encouraging results.",2018
Research Track - Pragmatic Ontology Evolution: Reconciling User Requirements and Application Performance,"Increasingly, organizations are adopting ontologies to describe their large catalogues of items. These ontologies need to evolve regularly in response to changes in the domain and the emergence of new requirements. An important step of this process is the selection of candidate concepts to include in the new version of the ontology. This operation needs to take into account a variety of factors and in particular reconcile user requirements and application performance. Current ontology evolution methods focus either on ranking concepts according to their relevance or on preserving compatibility with existing applications. However, they do not take in consideration the impact of the ontology evolution process on the performance of computational tasks – e.g., in this work we focus on instance tagging, similarity computation, generation of recommendations, and data clustering. In this paper, we propose the Pragmatic Ontology Evolution (POE) framework, a novel approach for selecting from a group of candidates a set of concepts able to produce a new version of a given ontology that (i) is consistent with the a set of user requirements (e.g., max number of concepts in the ontology), (ii) is parametrised with respect to a number of dimensions (e.g., topological considerations), and (iii) effectively supports relevant computational tasks. Our approach also supports users in navigating the space of possible solutions by showing how certain choices, such as limiting the number of concepts or privileging trendy concepts rather than historical ones, would reflect on the application performance. An evaluation of POE on the real-world scenario of the evolving Springer Nature taxonomy for editorial classification yielded excellent results, demonstrating a significant improvement over alternative approaches.",2018
"Research Track - Practical Ontology Pattern Instantiation, Discovery, and Maintenance with Reasonable Ontology Templates","Reasonable Ontology Templates ( Open image in new window ) is a language for representing ontology modelling patterns in the form of parameterised ontologies. Ontology templates are simple and powerful abstractions useful for constructing, interacting with, and maintaining ontologies. With ontology templates, modelling patterns can be uniquely identified and encapsulated, broken down into convenient and manageable pieces, instantiated, and used as queries. Formal relations defined over templates support sophisticated maintenance tasks for sets of templates, such as revealing redundancies and suggesting new templates for representing implicit patterns. Ontology templates are designed for practical use; an  Open image in new window  vocabulary, convenient serialisation formats for the semantic web and for terse specification of template definitions and bulk instances are available, including an open source implementation for using templates. Our approach is successfully tested on a real-world large-scale ontology in the engineering domain.",2018
Research Track - Answering Provenance-Aware Queries on RDF Data Cubes Under Memory Budgets,"The steadily-growing popularity of semantic data on the Web and the support for aggregation queries in SPARQL 1.1 have propelled the interest in Online Analytical Processing (OLAP) and data cubes in RDF. Query processing in such settings is challenging because SPARQL OLAP queries usually contain many triple patterns with grouping and aggregation. Moreover, one important factor of query answering on Web data is its provenance, i.e., metadata about its origin. Some applications in data analytics and access control require to augment the data with provenance metadata and run queries that impose constraints on this provenance. This task is called provenance-aware query answering. In this paper, we investigate the benefit of caching some parts of an RDF cube augmented with provenance information when answering provenance-aware SPARQL queries. We propose provenance-aware caching (PAC), a caching approach based on a provenance-aware partitioning of RDF graphs, and a benefit model for RDF cubes and SPARQL queries with aggregation. Our results on real and synthetic data show that PAC outperforms significantly the LRU strategy (least recently used) and the Jena TDB native caching in terms of hit-rate and response time.",2018
Research Track - WORQ: Workload-Driven RDF Query Processing,"Cloud-based systems provide a rich platform for managing large-scale RDF data. However, the distributed nature of these systems introduces several performance challenges, e.g., disk I/O and network shuffling overhead, especially for RDF queries that involve multiple join operations. To alleviate these challenges, this paper studies the effect of several optimization techniques that enhance the performance of RDF queries. Based on the query workload, reduced sets of intermediate results (or reductions, for short) that are common for certain join pattern(s) are computed. Furthermore, these reductions are not computed beforehand, but are rather computed only for the frequent join patterns in an online fashion using Bloom filters. Rather than caching the final results of each query, we show that caching the reductions allows reusing intermediate results across multiple queries that share the same join patterns. In addition, we introduce an efficient solution for RDF queries with unbound properties. Based on a realization of the proposed optimizations on top of Spark, extensive experimentation using two synthetic benchmarks and a real dataset demonstrates how these optimizations lead to an order of magnitude enhancement in terms of preprocessing, storage, and query performance compared to the state-of-the-art solutions.",2018
Research Track - Query-Based Linked Data Anonymization,We introduce and develop a declarative framework for privacy-preserving Linked Data publishing in which privacy and utility policies are specified as SPARQL queries. Our approach is data-independent and leads to inspect only the privacy and utility policies in order to determine the sequence of anonymization operations applicable to any graph instance for satisfying the policies. We prove the soundness of our algorithms and gauge their performance through experiments.,2018
Research Track - Bash Datalog: Answering Datalog Queries with Unix Shell Commands,"Dealing with large tabular datasets often requires extensive preprocessing. This preprocessing happens only once, so that loading and indexing the data in a database or triple store may be an overkill. In this paper, we present an approach that allows preprocessing large tabular data in Datalog – without indexing the data. The Datalog query is translated to Unix Bash and can be executed in a shell. Our experiments show that, for the use case of data preprocessing, our approach is competitive with state-of-the-art systems in terms of scalability and speed, while at the same time requiring only a Bash shell on a Unix system.",2018
Research Track - Towards Empty Answers in SPARQL: Approximating Querying with RDF Embedding,"The LOD cloud offers a plethora of RDF data sources where users discover items of interest by issuing SPARQL queries. A common query problem for users is to face with empty answers: given a SPARQL query that returns nothing, how to refine the query to obtain a non-empty set? In this paper, we propose an RDF graph embedding based framework to solve the SPARQL empty-answer problem in terms of a continuous vector space. We first project the RDF graph into a continuous vector space by an entity context preserving translational embedding model which is specially designed for SPARQL queries. Then, given a SPARQL query that returns an empty set, we partition it into several parts and compute approximate answers by leveraging RDF embeddings and the translation mechanism. We also generate alternative queries for returned answers, which helps users recognize their expectations and refine the original query finally. To validate the effectiveness and efficiency of our framework, we conduct extensive experiments on the real-world RDF dataset. The results show that our framework can significantly improve the quality of approximate answers and speed up the generation of alternative queries.",2018
Research Track - Cross-Lingual Classification of Crisis Data,"Many citizens nowadays flock to social media during crises to share or acquire the latest information about the event. Due to the sheer volume of data typically circulated during such events, it is necessary to be able to efficiently filter out irrelevant posts, thus focusing attention on the posts that are truly relevant to the crisis. Current methods for classifying the relevance of posts to a crisis or set of crises typically struggle to deal with posts in different languages, and it is not viable during rapidly evolving crisis situations to train new models for each language. In this paper we test statistical and semantic classification approaches on cross-lingual datasets from 30 crisis events, consisting of posts written mainly in English, Spanish, and Italian. We experiment with scenarios where the model is trained on one language and tested on another, and where the data is translated to a single language. We show that the addition of semantic features extracted from external knowledge bases improve accuracy over a purely statistical model.",2018
Research Track - Canonicalisation of Monotone SPARQL Queries,"Caching in the context of expressive query languages such as SPARQL is complicated by the difficulty of detecting equivalent queries: deciding if two conjunctive queries are equivalent is NP-complete, where adding further query features makes the problem undecidable. Despite this complexity, in this paper we propose an algorithm that performs syntactic canonicalisation of SPARQL queries such that the answers for the canonicalised query will not change versus the original. We can guarantee that the canonicalisation of two queries within a core fragment of SPARQL (monotone queries with select, project, join and union) is equal if and only if the two queries are equivalent; we also support other SPARQL features but with a weaker soundness guarantee: that the (partially) canonicalised query is equivalent to the input query. Despite the fact that canonicalisation must be harder than the equivalence problem, we show the algorithm to be practical for real-world queries taken from SPARQL endpoint logs, and further show that it detects more equivalent queries than when compared with purely syntactic methods. We also present the results of experiments over synthetic queries designed to stress-test the canonicalisation method, highlighting difficult cases.",2018
Research Track - Combining Truth Discovery and RDF Knowledge Bases to Their Mutual Advantage,"This study exploits knowledge expressed in RDF Knowledge Bases (KBs) to enhance Truth Discovery (TD) performances. TD aims to identify facts (true claims) when conflicting claims are made by several sources. Based on the assumption that true claims are provided by reliable sources and reliable sources provide true claims, TD models iteratively compute value confidence and source trustworthiness in order to determine which claims are true. We propose a model that exploits the knowledge extracted from an existing RDF KB in the form of rules. These rules are used to quantify the evidence given by the RDF KB to support a claim. This evidence is then integrated into the computation of the confidence value to improve its estimation. Enhancing TD models efficiently obtains a larger set of reliable facts that vice versa can populate RDF KBs. Empirical experiments on real-world datasets showed the potential of the proposed approach, which led to an improvement of up to 18% compared to the model we modified.",2018
Research Track - Measuring Semantic Coherence of a Conversation,"Conversational systems have become increasingly popular as a way for humans to interact with computers. To be able to provide intelligent responses, conversational systems must correctly model the structure and semantics of a conversation. We introduce the task of measuring semantic (in)coherence in a conversation with respect to background knowledge, which relies on the identification of semantic relations between concepts introduced during a conversation. We propose and evaluate graph-based and machine learning-based approaches for measuring semantic coherence using knowledge graphs, their vector space embeddings and word embedding models, as sources of background knowledge. We demonstrate how these approaches are able to uncover different coherence patterns in conversations on the Ubuntu Dialogue Corpus.",2018
Research Track - Content Based Fake News Detection Using Knowledge Graphs,"This paper addresses the problem of fake news detection. There are many works already in this space; however, most of them are for social media and not using news content for the decision making. In this paper, we propose some novel approaches, including the B-TransE model, to detecting fake news based on news content using knowledge graphs. In our solutions, we need to address a few technical challenges. Firstly, computational-oriented fact checking is not comprehensive enough to cover all the relations needed for fake news detection. Secondly, it is challenging to validate the correctness of the extracted triples from news articles. Our approaches are evaluated with the Kaggle’s ‘Getting Real about Fake News’ dataset and some true articles from main stream media. The evaluations show that some of our approaches have over 0.80 F1-scores.",2018
Resources Track - DOREMUS: A Graph of Linked Musical Works,"Three major French cultural institutions—the French National Library (BnF), Radio France and the Philharmonie de Paris—have come together in order to develop shared methods to describe semantically their catalogs of music works and events. This process comprises the construction of knowledge graphs representing the data contained in these catalogs following a novel agreed upon ontology that extends CIDOC-CRM and FRBRoo, the linking of these graphs and their open publication on the web. A number of specialized tools that allow for the reproduction of this process are developed, as well as web applications for easy access and navigation through the data. The paper presents one of the main outcomes of this project—the DOREMUS knowledge graph, consisting of three linked datasets describing classical music works and their associated events (e.g., performances in concerts). This resource fills an important gap between library content description and music metadata. We present the DOREMUS pipeline for lifting and linking the data, the tools developed for these purposes, as well as a search application allowing to explore the data.",2018
Resources Track - Audio Commons Ontology: A Data Model for an Audio Content Ecosystem,"Multiple online services host repositories of audio clips of different kinds, ranging from music tracks, albums, playlists, to instrument samples and loops, to a variety of recorded or synthesized sounds. Programmatic access to these resources maybe used by client applications for tasks ranging from customized musical listening and exploration, to music/sounds creation from existing sounds and samples, to audio-based user interaction in apps and games. We designed an ontology to facilitate interoperability between repositories and clients in this domain. There was no previous comprehensive data model for our domain, however the new ontology relates to existing ontologies, such as the Functional Requirements for Bibliographic Records for the authoring and publication process of creative works, the Music Ontology for the authoring and publication of music, the EBU Core ontology to describe media files and formats and the Creative Commons Licensing ontology to describe licences. This paper documents the design of the ontology and its evaluation with respect to specific requirements gathered from stakeholders.",2018
Resources Track - Wiki-MID: A Very Large Multi-domain Interests Dataset of Twitter Users with Mappings to Wikipedia,"This paper presents Wiki-MID, a LOD compliant multi-domain interests dataset to train and test Recommender Systems, and the methodology to create the dataset from Twitter messages in English and Italian. Our English dataset includes an average of 90 multi-domain preferences per user on music, books, movies, celebrities, sport, politics and much more, for about half million users traced during six months in 2017. Preferences are either extracted from messages of users who use Spotify, Goodreads and other similar content sharing platforms, or induced from their “topical” friends, i.e., followees representing an interest rather than a social relation between peers. In addition, preferred items are matched with Wikipedia articles describing them. This unique feature of our dataset provides a mean to categorize preferred items, exploiting available semantic resources linked to Wikipedia such as the Wikipedia Category Graph, DBpedia, BabelNet and others.",2018
Resources Track - HeLiS: An Ontology for Supporting Healthy Lifestyles,"The use of knowledge resources in the digital health domain is a trending activity significantly grown in the last decade. In this paper, we present HeLiS: an ontology aiming to provide in tandem a representation of both the food and physical activity domains and the definition of concepts enabling the monitoring of users’ actions and of their unhealthy behaviors. We describe the construction process, the plan for its maintenance, and how this ontology has been used into a real-world system with a focus on “Key to Health”: a project for promoting healthy lifestyles on workplaces.",2018
Resources Track - Querying Large Knowledge Graphs over Triple Pattern Fragments: An Empirical Study,"Triple Pattern Fragments (TPFs) are a novel interface for accessing data in knowledge graphs on the web. So far, work on performance evaluation and optimization has focused mainly on SPARQL query execution over TPF servers. However, in order to devise querying techniques that efficiently access large knowledge graphs via TPFs, we need to identify and understand the variables that influence the performance of TPF servers on a fine-grained level. In this work, we assess the performance of TPFs by measuring the response time for different requests and analyze how the requests’ properties, as well as the TPF server configuration, may impact the performance. For this purpose, we developed the Triple Pattern Fragment Profiler to determine the performance of TPF server. The resource is openly available at https://doi.org/10.5281/zenodo.1211621. To this end, we conduct an empirical study over four large knowledge graphs in different server environments and configurations. As part of our analysis, we provide an extensive evaluation of the results and focus on the impact of the variables: triple pattern type, answer cardinality, page size, backend and the environment type on the response time. The results suggest that all variables impact on the measured response time and allow for deriving suggestions for TPF server configurations and query optimization.",2018
Resources Track - SABINE: A Multi-purpose Dataset of Semantically-Annotated Social Content,"Social Business Intelligence (SBI) is the discipline that combines corporate data with social content to let decision makers analyze the trends perceived from the environment. SBI poses research challenges in several areas, such as IR, data mining, and NLP; unfortunately, SBI research is often restrained by the lack of publicly-available, real-world data for experimenting approaches, and by the difficulties in determining a ground truth. To fill this gap we present SABINE, a modular dataset in the domain of European politics. SABINE includes 6 millions bilingual clips crawled from 50 000 web sources, each associated with metadata and sentiment scores; an ontology with 400 topics, their occurrences in the clips, and their mapping to DBpedia; two multidimensional cubes for analyzing and aggregating sentiment and semantic occurrences. We also propose a set of research challenges that can be addressed using SABINE; remarkably, the presence of an expert-validated ground truth ensures the possibility of testing approaches to the whole SBI process as well as to each single task.",2018
