title,abstract,year
Research Track - Fine-Grained Evaluation of Rule- and Embedding-Based Systems for Knowledge Graph Completion,"Over the recent years, embedding methods have attracted increasing focus as a means for knowledge graph completion. Similarly, rule-based systems have been studied for this task in the past. What is missing so far is a common evaluation that includes more than one type of method. We close this gap by comparing representatives of both types of systems in a frequently used evaluation protocol. Leveraging the explanatory qualities of rule-based systems, we present a fine-grained evaluation that gives insight into characteristics of the most popular datasets and points out the different strengths and shortcomings of the examined approaches. Our results show that models such as TransE, RESCAL or HolE have problems in solving certain types of completion tasks that can be solved by a rule-based approach with high precision. At the same time, there are other completion tasks that are difficult for rule-based systems. Motivated by these insights, we combine both families of approaches via ensemble learning. The results support our assumption that the two methods complement each other in a beneficial way.",2018
Research Track - Aligning Knowledge Base and Document Embedding Models Using Regularized Multi-Task Learning,"Knowledge Bases (KBs) and textual documents contain rich and complementary information about real-world objects, as well as relations among them. While text documents describe entities in freeform, KBs organizes such information in a structured way. This makes these two information representation forms hard to compare and integrate, limiting the possibility to use them jointly to improve predictive and analytical tasks. In this article, we study this problem, and we propose KADE, a solution based on a regularized multi-task learning of KB and document embeddings. KADE can potentially incorporate any KB and document embedding learning method. Our experiments on multiple datasets and methods show that KADE effectively aligns document and entities embeddings, while maintaining the characteristics of the embedding models.",2018
Research Track - Towards Encoding Time in Text-Based Entity Embeddings,"Knowledge Graphs (KG) are widely used abstractions to represent entity-centric knowledge. Approaches to embed entities, entity types and relations represented in the graph into vector spaces - often referred to as KG embeddings - have become increasingly popular for their ability to capture the similarity between entities and support other reasoning tasks. However, representation of time has received little attention in these approaches. In this work, we make a first step to encode time into vector-based entity representations using a text-based KG embedding model named Typed Entity Embeddings (TEEs). In TEEs, each entity is represented by a vector that represents the entity and its type, which is learned from entity mentions found in a text corpus. Inspired by evidence from cognitive sciences and application-oriented concerns, we propose an approach to encode representations of years into TEEs by aggregating the representations of the entities that occur in event-based descriptions of the years. These representations are used to define two time-aware similarity measures to control the implicit effect of time on entity similarity. Experimental results show that the linear order of years obtained using our model is highly correlated with natural time flow and the effectiveness of the time-aware similarity measure proposed to flatten the time effect on entity similarity.",2018
Research Track - A Novel Ensemble Method for Named Entity Recognition and Disambiguation Based on Neural Network,"Named entity recognition (NER) and disambiguation (NED) are subtasks of information extraction that aim to recognize named entities mentioned in text, to assign them pre-defined types, and to link them with their matching entities in a knowledge base. Many approaches, often exposed as web APIs, have been proposed to solve these tasks during the last years. These APIs classify entities using different taxonomies and disambiguate them with different knowledge bases. In this paper, we describe Ensemble Nerd, a framework that collects numerous extractors responses, normalizes them and combines them in order to produce a final entity list according to the pattern (surface form, type, link). The presented approach is based on representing the extractors responses as real-value vectors and on using them as input samples for two Deep Learning networks: ENNTR (Ensemble Neural Network for Type Recognition) and ENND (Ensemble Neural Network for Disambiguation). We train these networks using specific gold standards. We show that the models produced outperform each single extractor responses in terms of micro and macro F1 measures computed by the GERBIL framework.",2018
Research Track - Inducing Implicit Relations from Text Using Distantly Supervised Deep Nets,"Knowledge Base Population (KBP) is an important problem in Semantic Web research and a key requirement for successful adoption of semantic technologies in many applications. In this paper we present Socrates, a deep learning based solution for Automated Knowledge Base Population from Text. Socrates does not require manual annotations which would make the solution hard to adapt to a new domain. Instead, it exploits a partially populated knowledge base and a large corpus of text documents to train a set of deep neural network models. As a result of the training process, the system learns how to identify implicit relations between entities across a highly heterogeneous set of documents from various sources, making it suitable for large-scale knowledge extraction from Web documents. Main contributions of this paper include (a) a novel approach based on composite contexts to acquire implicit relations from Title Oriented Documents, and (b) an architecture for unifying relation extraction using binary, unary, and composite contexts. We provide an extensive evaluation of the system across three different benchmarks with different characteristics, showing that our unified framework can consistently outperform state of the art solutions. Remarkably, Socrates ranked first in both the knowledge base population and attribute validation track at the Semantic Web Challenge at ISWC 2017.",2018
Research Track - Rule Learning from Knowledge Graphs Guided by Embedding Models,"Rules over a Knowledge Graph (KG) capture interpretable patterns in data and various methods for rule learning have been proposed. Since KGs are inherently incomplete, rules can be used to deduce missing facts. Statistical measures for learned rules such as confidence reflect rule quality well when the KG is reasonably complete; however, these measures might be misleading otherwise. So it is difficult to learn high-quality rules from the KG alone, and scalability dictates that only a small set of candidate rules could be generated. Therefore, the ranking and pruning of candidate rules are major problems. To address this issue, we propose a rule learning method that utilizes probabilistic representations of missing facts. In particular, we iteratively extend rules induced from a KG by relying on feedback from a precomputed embedding model over the KG and external information sources including text corpora. Experiments on real-world KGs demonstrate the effectiveness of our novel approach both with respect to the quality of the learned rules and fact predictions that they produce.",2018
Research Track - Enriching Knowledge Bases with Counting Quantifiers,"Information extraction traditionally focuses on extracting relations between identifiable entities, such as \(\langle \)Monterey, locatedIn, California\(\rangle \). Yet, texts often also contain Counting information, stating that a subject is in a specific relation with a number of objects, without mentioning the objects themselves, for example, “California is divided into 58 counties”. Such counting quantifiers can help in a variety of tasks such as query answering or knowledge base curation, but are neglected by prior work.",2018
Research Track - EARL: Joint Entity and Relation Linking for Question Answering over Knowledge Graphs,"Many question answering systems over knowledge graphs rely on entity and relation linking components in order to connect the natural language input to the underlying knowledge graph. Traditionally, entity linking and relation linking have been performed either as dependent sequential tasks or as independent parallel tasks. In this paper, we propose a framework called EARL, which performs entity linking and relation linking as a joint task. EARL implements two different solution strategies for which we provide a comparative analysis in this paper: The first strategy is a formalisation of the joint entity and relation linking tasks as an instance of the Generalised Travelling Salesman Problem (GTSP). In order to be computationally feasible, we employ approximate GTSP solvers. The second strategy uses machine learning in order to exploit the connection density between nodes in the knowledge graph. It relies on three base features and re-ranking steps in order to predict entities and relations. We compare the strategies and evaluate them on a dataset with 5000 questions. Both strategies significantly outperform the current state-of-the-art approaches for entity and relation linking.",2018
Research Track - Structured Event Entity Resolution in Humanitarian Domains,"In domains such as humanitarian assistance and disaster relief (HADR), events, rather than named entities, are the primary focus of analysts and aid officials. An important problem that must be solved to provide situational awareness to aid providers is automatic clustering of sub-events that refer to the same underlying event. An effective solution to the problem requires judicious use of both domain-specific and semantic information, as well as statistical methods like deep neural embeddings. In this paper, we present an approach, AugSEER (Augmented feature sets for Structured Event Entity Resolution), that combines advances in deep neural embeddings both on text and graph data with minimally supervised inputs from domain experts. AugSEER can operate in both online and batch scenarios. On five real-world HADR datasets, AugSEER is found, on average, to outperform the next best baseline result by almost 15% on the cluster purity metric and by 3% on the F1-Measure metric. In contrast, text-based approaches are found to perform poorly, demonstrating the importance of semantic information in devising a good solution. We also use sub-event clustering visualizations to illustrate the qualitative potential of AugSEER.",2018
Research Track - Ontology Driven Extraction of Research Processes,"We address the automatic extraction from publications of two key concepts for representing research processes: the concept of research activity and the sequence relation between successive activities. These representations are driven by the Scholarly Ontology, specifically conceived for documenting research processes. Unlike usual named entity recognition and relation extraction tasks, we are facing textual descriptions of activities of widely variable length, while pairs of successive activities often span multiple sentences. We developed and experimented with several sliding window classifiers using Logistic Regression, SVMs, and Random Forests, as well as a two-stage pipeline classifier. Our classifiers employ task-specific features, as well as word, part-of-speech and dependency embeddings, engineered to exploit distinctive traits of research publications written in English. The extracted activities and sequences are associated with other relevant information from publication metadata and stored as RDF triples in a knowledge base. Evaluation on datasets from three disciplines, Digital Humanities, Bioinformatics, and Medicine, shows very promising performance.",2018
Research Track - TSE-NER: An Iterative Approach for Long-Tail Entity Extraction in Scientific Publications,"Named Entity Recognition and Typing (NER/NET) is a challenging task, especially with long-tail entities such as the ones found in scientific publications. These entities (e.g. “WebKB”,“StatSnowball”) are rare, often relevant only in specific knowledge domains, yet important for retrieval and exploration purposes. State-of-the-art NER approaches employ supervised machine learning models, trained on expensive type-labeled data laboriously produced by human annotators. A common workaround is the generation of labeled training data from knowledge bases; this approach is not suitable for long-tail entity types that are, by definition, scarcely represented in KBs. This paper presents an iterative approach for training NER and NET classifiers in scientific publications that relies on minimal human input, namely a small seed set of instances for the targeted entity type. We introduce different strategies for training data extraction, semantic expansion, and result entity filtering. We evaluate our approach on scientific publications, focusing on the long-tail entities types Datasets, Methods in computer science publications, and Proteins in biomedical publications.",2018
Research Track - Constructing a Recipe Web from Historical Newspapers,"Historical newspapers provide a lens on customs and habits of the past. For example, recipes published in newspapers highlight what and how we ate and thought about food. The challenge here is that newspaper data is often unstructured and highly varied. Digitised historical newspapers add an additional challenge, namely that of fluctuations in OCR quality. Therefore, it is difficult to locate and extract recipes from them. We present our approach based on distant supervision and automatically extracted lexicons to identify recipes in digitised historical newspapers, to generate recipe tags, and to extract ingredient information. We provide OCR quality indicators and their impact on the extraction process. We enrich the recipes with links to information on the ingredients. Our research shows how natural language processing, machine learning, and semantic web can be combined to construct a rich dataset from heterogeneous newspapers for the historical analysis of food culture.",2018
"Research Track - That’s Interesting, Tell Me More! Finding Descriptive Support Passages for Knowledge Graph Relationships","We address the problem of finding descriptive explanations of facts stored in a knowledge graph. This is important in high-risk domains such as healthcare, intelligence, etc. where users need additional information for decision making and is especially crucial for applications that rely on automatically constructed knowledge graphs where machine-learned systems extract facts from an input corpus and working of the extractors is opaque to the end-user. We follow an approach inspired from information retrieval and propose a simple, yet effective and efficient solution that takes into account passage level as well as document level properties to produce a ranked list of passages describing a given input relation. We test our approach using Wikidata as the knowledge base and Wikipedia as the source corpus and report results of user studies conducted to study the effectiveness of our proposed model.",2018
Research Track - QA4IE: A Question Answering Based Framework for Information Extraction,"Information Extraction (IE) refers to automatically extracting structured relation tuples from unstructured texts. Common IE solutions, including Relation Extraction (RE) and open IE systems, can hardly handle cross-sentence tuples, and are severely restricted by limited relation types as well as informal relation specifications (e.g., free-text based relation tuples). In order to overcome these weaknesses, we propose a novel IE framework named QA4IE, which leverages the flexible question answering (QA) approaches to produce high quality relation triples across sentences. Based on the framework, we develop a large IE benchmark with high quality human evaluation. This benchmark contains 293K documents, 2M golden relation triples, and 636 relation types. We compare our system with some IE baselines on our benchmark and the results show that our system achieves great improvements.",2018
Research Track - An Ontology-Driven Probabilistic Soft Logic Approach to Improve NLP Entity Annotations,"Many approaches for Knowledge Extraction and Ontology Population rely on well-known Natural Language Processing (NLP) tasks, such as Named Entity Recognition and Classification (NERC) and Entity Linking (EL), to identify and semantically characterize the entities mentioned in natural language text. Despite being intrinsically related, the analyses performed by these tasks differ, and combining their output may result in NLP annotations that are implausible or even conflicting considering common world knowledge about entities. In this paper we present a Probabilistic Soft Logic (PSL) model that leverages ontological entity classes to relate NLP annotations from different tasks insisting on the same entity mentions. The intuition behind the model is that an annotation likely implies some ontological classes on the entity identified by the mention, and annotations from different tasks on the same mention have to share more or less the same implied entity classes. In a setting with various NLP tools returning multiple, confidence-weighted, candidate annotations on a single mention, the model can be operationally applied to compare the different annotation combinations, and to possibly revise the tools’ best annotation choice. We experimented applying the model with the candidate annotations produced by two state-of-the-art tools for NERC and EL, on three different datasets. The results show that the joint “a posteriori” annotation revision suggested by our PSL model consistently improves the original scores of the two tools.",2018
Research Track - Exploring RDFS KBs Using Summaries,"Ontology summarization aspires to produce an abridged version of the original data source highlighting its most important concepts. However, in an ideal scenario, the user should not be limited only to static summaries. Starting from the summary, s/he should be able to further explore the data source requesting more detailed information for a particular part of it. In this paper, we present a new approach enabling the dynamic exploration of summaries through two novel operations zoom and extend. Extend focuses on a specific subgraph of the initial summary, whereas zoom on the whole graph, both providing granular information access to the end-user. We show that calculating these operators is NP-complete and provide approximations for their calculation. Then, we show that using extend, we can answer more queries focusing on specific nodes, whereas using global zoom, we can answer overall more queries. Finally, we show that the algorithms employed can efficiently approximate both operators.",2018
Research Track - What Is the Cube Root of 27? Question Answering Over CodeOntology,"We present an unsupervised approach to process natural language questions that cannot be answered by factual question answering nor advanced data querying, requiring instead ad-hoc code generation and execution. To address this challenging task, our system,  Open image in new window , performs language-to-code translation by interpreting the natural language question and generating a SPARQL query that is run against CodeOntology, a large RDF repository containing millions of triples representing Java code constructs. The query retrieves a number of Java source code snippets and methods, ranked by  Open image in new window  on both syntactic and semantic features, to find the best candidate, that is then executed to get the correct answer. The evaluation of the system is based on a dataset extracted from StackOverflow and experimental results show that our approach is comparable with other state-of-the-art proprietary systems, such as the closed-source WolframAlpha computational knowledge engine.",2018
Research Track - GraFa: Scalable Faceted Browsing for RDF Graphs,"Faceted browsing has become a popular paradigm for user interfaces on the Web and has also been investigated in the context of RDF graphs. However, current faceted browsers for RDF graphs encounter performance issues when faced with two challenges: scale, where large datasets generate many results, and heterogeneity, where large numbers of properties and classes generate many facets. To address these challenges, we propose GraFa: a faceted browsing system for heterogeneous large-scale RDF graphs based on a materialisation strategy that performs an offline analysis of the input graph in order to identify a subset of the exponential number of possible facet combinations that are candidates for indexing. In experiments over Wikidata, we demonstrate that materialisation allows for displaying (exact) faceted views over millions of diverse results in under a second while keeping index sizes relatively small. We also present initial usability studies over GraFa.",2018
Research Track - Semantics and Validation of Recursive SHACL,"With the popularity of RDF as an independent data model came the need for specifying constraints on RDF graphs, and for mechanisms to detect violations of such constraints. One of the most promising schema languages for RDF is SHACL, a recent W3C recommendation. Unfortunately, the specification of SHACL leaves open the problem of validation against recursive constraints. This omission is important because SHACL by design favors constraints that reference other ones, which in practice may easily yield reference cycles.",2018
Research Track - Efficient Handling of SPARQL OPTIONAL for OBDA,"OPTIONAL is a key feature in SPARQL for dealing with missing information. While this operator is used extensively, it is also known for its complexity, which can make efficient evaluation of queries with OPTIONAL challenging. We tackle this problem in the Ontology-Based Data Access (OBDA) setting, where the data is stored in a SQL relational database and exposed as a virtual RDF graph by means of an R2RML mapping. We start with a succinct translation of a SPARQL fragment into SQL. It fully respects bag semantics and three-valued logic and relies on the extensive use of the LEFT JOIN operator and COALESCE function. We then propose optimisation techniques for reducing the size and improving the structure of generated SQL queries. Our optimisations capture interactions between JOIN, LEFT JOIN, COALESCE and integrity constraints such as attribute nullability, uniqueness and foreign key constraints. Finally, we empirically verify effectiveness of our techniques on the BSBM OBDA benchmark.",2018
Research Track - Certain Answers for SPARQL with Blank Nodes,"Blank nodes in RDF graphs can be used to represent values known to exist but whose identity remains unknown. A prominent example of such usage can be found in the Wikidata dataset where, e.g., the author of Beowulf is given as a blank node. However, while SPARQL considers blank nodes in a query as existentials, it treats blank nodes in RDF data more like constants. Running SPARQL queries over datasets with unknown values may thus lead to counter-intuitive results, which may make the standard SPARQL semantics unsuitable for datasets with existential blank nodes. We thus explore the feasibility of an alternative SPARQL semantics based on certain answers. In order to estimate the performance costs that would be associated with such a change in semantics for current implementations, we adapt and evaluate approximation techniques proposed in a relational database setting for a core fragment of SPARQL. To further understand the impact that such a change in semantics may have on query solutions, we analyse how this new semantics would affect the results of user queries over Wikidata.",2018
Research Track - Mapping Diverse Data to RDF in Practice,"Converting data from diverse data sources to custom RDF datasets often faces several practical challenges related with the need to restructure and transform the source data. Existing RDF mapping languages assume that the resulting datasets mostly preserve the structure of the original data. In this paper, we present real cases that highlight the limitations of existing languages, and describe D2RML, a transformation-oriented RDF mapping language which addresses such practical needs by incorporating a programming flavor in the mapping process.",2018
Research Track - Representativeness of Knowledge Bases with the Generalized Benford’s Law,"Knowledge bases (KBs) such as DBpedia, Wikidata, and YAGO contain a huge number of entities and facts. Several recent works induce rules or calculate statistics on these KBs. Most of these methods are based on the assumption that the data is a representative sample of the studied universe. Unfortunately, KBs are biased because they are built from crowdsourcing and opportunistic agglomeration of available databases. This paper aims at approximating the representativeness of a relation within a knowledge base. For this, we use the generalized Benford’s law, which indicates the distribution expected by the facts of a relation. We then compute the minimum number of facts that have to be added in order to make the KB representative of the real world. Experiments show that our unsupervised method applies to a large number of relations. For numerical relations where ground truths exist, the estimated representativeness proves to be a reliable indicator.",2018
