title,abstract,year
Research Track - Multi-label Based Learning for Better Multi-criteria Ranking of Ontology Reasoners,"A growing number of highly optimized reasoning algorithms have been developed to allow inference tasks on expressive ontology languages such as OWL(DL). Nevertheless, there is broad agreement that a reasoner could be optimized for some, but not all the ontologies. This particular fact makes it hard to select the best performing reasoner to handle a given ontology, especially for novice users. In this paper, we present a novel method to support the selection ontology reasoners. Our method generates a recommendation in the form of reasoner ranking. The efficiency as well as the correctness are our main ranking criteria. Our solution combines and adjusts multi-label classification and multi-target regression techniques. A large collection of ontologies and 10 well-known reasoners are studied. The experimental results show that the proposed method performs significantly better than several state-of-the-art ranking solutions. Furthermore, it proves that our introduced ranking method could effectively be evolved to a competitive meta-reasoner.",2017
Research Track - A Decidable Very Expressive Description Logic for Databases,"We introduce \(\mathcal{DLR}^+\), an extension of the n-ary propositionally closed description logic \(\mathcal{DLR}\) to deal with attribute-labelled tuples (generalising the positional notation), projections of relations, and global and local objectification of relations, able to express inclusion, functional, key, and external uniqueness dependencies. The logic is equipped with both TBox and ABox axioms. We show how a simple syntactic restriction on the appearance of projections sharing common attributes in a \(\mathcal{DLR}^+\) knowledge base makes reasoning in the language decidable with the same computational complexity as \(\mathcal{DLR}\). The obtained \(\mathcal{DLR}^{\pm }\) n-ary description logic is able to encode more thoroughly conceptual data models such as EER, UML, and ORM.",2017
Research Track - The Efficacy of OWL and DL on User Understanding of Axioms and Their Entailments,"OWL is recognized as the de facto standard notation for ontology engineering. The Manchester OWL Syntax (MOS) was developed as an alternative to symbolic description logic (DL) and it is believed to be more effective for users. This paper sets out to test that belief from two perspectives by evaluating how accurately and quickly people understand the informational content of axioms and derive inferences from them. By conducting a between-group empirical study, involving 60 novice participants, we found that DL is just as effective as MOS for people’s understanding of axioms. Moreover, for two types of inference problems, DL supported significantly better task performance than MOS, yet MOS never significantly outperformed DL. These surprising results suggest that the belief that MOS is more effective than DL, at least for these types of task, is unfounded. An outcome of this research is the suggestion that ontology axioms, when presented to non-experts, may be better presented in DL rather than MOS. Further empirical studies are needed to explain these unexpected results and to see whether they hold for other types of task.",2017
Research Track - Improving Visual Relationship Detection Using Semantic Modeling of Scene Descriptions,"Structured scene descriptions of images are useful for the automatic processing and querying of large image databases. We show how the combination of a statistical semantic model and a visual model can improve on the task of mapping images to their associated scene description. In this paper we consider scene descriptions which are represented as a set of triples (subject, predicate, object), where each triple consists of a pair of visual objects, which appear in the image, and the relationship between them (e.g. man-riding-elephant, man-wearing-hat). We combine a standard visual model for object detection, based on convolutional neural networks, with a latent variable model for link prediction. We apply multiple state-of-the-art link prediction methods and compare their capability for visual relationship detection. One of the main advantages of link prediction methods is that they can also generalize to triples which have never been observed in the training data. Our experimental results on the recently published Stanford Visual Relationship dataset, a challenging real world dataset, show that the integration of a statistical semantic model using link prediction methods can significantly improve visual relationship detection. Our combined approach achieves superior performance compared to the state-of-the-art method from the Stanford computer vision group.",2017
Research Track - An Empirical Study on How the Distribution of Ontologies Affects Reasoning on the Web,"The Web of Data is an inherently distributed environment where ontologies are located in (physically) remote locations and are subject to constant changes. Reasoning is affected by these changes, but the extent and significance of this dependency is not well-studied yet. To address this problem, this paper presents an empirical study on how the distribution of ontological data on the Web affects the outcome of reasoning. We study (1) to what degree datasets depend on external ontologies and (2) to what extent the inclusion of additional ontological information via IRI de-referencing and the owl:imports directive to the input datasets leads to new derivations.",2017
Research Track - Expressive Stream Reasoning with Laser,"An increasing number of use cases require a timely extraction of non-trivial knowledge from semantically annotated data streams, especially on the Web and for the Internet of Things (IoT). Often, this extraction requires expressive reasoning, which is challenging to compute on large streams. We propose Laser, a new reasoner that supports a pragmatic, non-trivial fragment of the logic LARS which extends Answer Set Programming (ASP) for streams. At its core, Laser implements a novel evaluation procedure which annotates formulae to avoid the re-computation of duplicates at multiple time points. This procedure, combined with a judicious implementation of the LARS operators, is responsible for significantly better runtimes than the ones of other state-of-the-art systems like C-SPARQL and CQELS, or an implementation of LARS which runs on the ASP solver Clingo. This enables the application of expressive logic-based reasoning to large streams and opens the door to a wider range of stream reasoning use cases.",2017
Research Track - Semantics and Validation of Shapes Schemas for RDF,"We present a formal semantics and proof of soundness for shapes schemas, an expressive schema language for RDF graphs that is the foundation of Shape Expressions Language 2.0. It can be used to describe the vocabulary and the structure of an RDF graph, and to constrain the admissible properties and values for nodes in that graph. The language defines a typing mechanism called shapes against which nodes of the graph can be checked. It includes an algebraic grouping operator, a choice operator and cardinality constraints for the number of allowed occurrences of a property. Shapes can be combined using Boolean operators, and can use possibly recursive references to other shapes.",2017
Research Track - Zooming in on Ontologies: Minimal Modules and Best Excerpts,"Ensuring access to the most relevant knowledge contained in large ontologies has been identified as an important challenge. To this end, minimal modules (sub-ontologies that preserve all entailments over a given vocabulary) and excerpts (certain, small number of axioms that best capture the knowledge regarding the vocabulary by allowing for a degree of semantic loss) have been proposed. In this paper, we introduce the notion of subsumption justification as an extension of justification (a minimal set of axioms needed to preserve a logical consequence) to capture the subsumption knowledge between a term and all other terms in the vocabulary. We present algorithms for computing subsumption justifications based on a simulation notion developed for the problem of deciding the logical difference between ontologies. We show how subsumption justifications can be used to obtain minimal modules and to compute best excerpts by additionally employing a partial Max-SAT solver. This yields two state-of-the-art methods for computing all minimal modules and all best excerpts, which we evaluate over large biomedical ontologies.",2017
Research Track - Semantic Wide and Deep Learning for Detecting Crisis-Information Categories on Social Media,"When crises hit, many flog to social media to share or consume information related to the event. Social media posts during crises tend to provide valuable reports on affected people, donation offers, help requests, advice provision, etc. Automatically identifying the category of information (e.g., reports on affected individuals, donations and volunteers) contained in these posts is vital for their efficient handling and consumption by effected communities and concerned organisations. In this paper, we introduce Sem-CNN; a wide and deep Convolutional Neural Network (CNN) model designed for identifying the category of information contained in crisis-related social media content. Unlike previous models, which mainly rely on the lexical representations of words in the text, the proposed model integrates an additional layer of semantics that represents the named entities in the text, into a wide and deep CNN network. Results show that the Sem-CNN model consistently outperforms the baselines which consist of statistical and non-semantic deep learning models.",2017
Research Track - Tractable Query Answering for Expressive Ontologies and Existential Rules,"The disjunctive skolem chase is a sound and complete (albeit non-terminating) algorithm that can be used to solve conjunctive query answering over DL ontologies and programs with disjunctive existential rules. Even though acyclicity notions can be used to ensure chase termination for a large subset of real-world knowledge bases, the complexity of reasoning over acyclic theories still remains high. Hence, we study several restrictions which not only guarantee chase termination but also ensure polynomiality. We include an evaluation that shows that almost all acyclic DL ontologies do indeed satisfy these general restrictions.",2017
Research Track - Global RDF Vector Space Embeddings,"Vector space embeddings have been shown to perform well when using RDF data in data mining and machine learning tasks. Existing approaches, such as RDF2Vec, use local information, i.e., they rely on local sequences generated for nodes in the RDF graph. For word embeddings, global techniques, such as GloVe, have been proposed as an alternative. In this paper, we show how the idea of global embeddings can be transferred to RDF embeddings, and show that the results are competitive with traditional local techniques like RDF2Vec.",2017
Research Track - LDScript: A Linked Data Script Language,"In addition to the existing standards dedicated to representation or querying, Semantic Web programmers could really benefit from a dedicated programming language enabling them to directly define functions on RDF terms, RDF graphs or SPARQL results. This is especially the case, for instance, when defining SPARQL extension functions. The ability to capitalize complex SPARQL filter expressions into extension functions or to define and reuse dedicated aggregates are real cases where a dedicated language can support modularity and maintenance of the code. Other families of use cases include the definition of functional properties associated to RDF resources or the definition of procedural attachments as functions assigned to RDFS or OWL classes with the selection of the function to be applied to a resource depending on the type of the resource. To address these needs we define LDScript, a Linked Data script language on top of the SPARQL filter expression language. We provide the formal grammar of the syntax and the Natural Semantics inference rules of the semantics of the language. We also provide a benchmark and perform an evaluation using real test bases from W3C with different implementations and approaches comparing, in particular, script interpretation and Java compilation.",2017
Research Track - Temporal Query Answering in DL-Lite over Inconsistent Data,"In ontology-based systems that process data stemming from different sources and that is received over time, as in context-aware systems, reasoning needs to cope with the temporal dimension and should be resilient against inconsistencies in the data. Motivated by such settings, this paper addresses the problem of handling inconsistent data in a temporal version of ontology-based query answering. We consider a recently proposed temporal query language that combines conjunctive queries with operators of propositional linear temporal logic and extend to this setting three inconsistency-tolerant semantics that have been introduced for querying inconsistent description logic knowledge bases. We investigate their complexity for DL-Lite\(_{\mathcal {R}}\) temporal knowledge bases, and furthermore complete the picture for the consistent case.",2017
Research Track - Practical Update Management in Ontology-Based Data Access,"Ontology-based Data Access (OBDA) is gaining importance both scientifically and practically. However, little attention has been paid so far to the problem of updating OBDA systems. This is an essential issue if we want to be able to cope with modifications of data both at the ontology and at the source level, while maintaining the independence of the data sources. In this paper, we propose mechanisms to properly handle updates in this context. We show that updating data both at the ontology and source level is first-order rewritable. We also provide a practical implementation of such updating mechanisms based on non-recursive Datalog.",2017
Research Track - Computing Authoring Tests from Competency Questions: Experimental Validation,"This paper explores whether Authoring Tests derived from Competency Questions accurately represent the expectations of ontology authors. In earlier work we proposed that an ontology authoring interface can be improved by allowing the interface to test whether a given Competency Question (CQ) is able to be answered by the ontology at a given stage of its construction, an approach known as CQ-driven Ontology Authoring (CQOA). The experiments presented in the present paper suggest that CQOA’s understanding of CQs matches users’ understanding quite well, especially for inexperienced ontology authors.",2017
Research Track - Matching Web Tables with Knowledge Base Entities: From Entity Lookups to Entity Embeddings,"Web tables constitute valuable sources of information for various applications, ranging from Web search to Knowledge Base (KB) augmentation. An underlying common requirement is to annotate the rows of Web tables with semantically rich descriptions of entities published in Web KBs. In this paper, we evaluate three unsupervised annotation methods: (a) a lookup-based method which relies on the minimal entity context provided in Web tables to discover correspondences to the KB, (b) a semantic embeddings method that exploits a vectorial representation of the rich entity context in a KB to identify the most relevant subset of entities in the Web table, and (c) an ontology matching method, which exploits schematic and instance information of entities available both in a KB and a Web table. Our experimental evaluation is conducted using two existing benchmark data sets in addition to a new large-scale benchmark created using Wikipedia tables. Our results show that: (1) our novel lookup-based method outperforms state-of-the-art lookup-based methods, (2) the semantic embeddings method outperforms lookup-based methods in one benchmark data set, and (3) the lack of a rich schema in Web tables can limit the ability of ontology matching tools in performing high-quality table annotation. As a result, we propose a hybrid method that significantly outperforms individual methods on all the benchmarks.",2017
Research Track - Learning Commonalities in SPARQL,"Finding the commonalities between descriptions of data or knowledge is a foundational reasoning problem of Machine Learning. It was formalized in the early 70’s as computing a least general generalization ( \(\mathtt {lgg}\) ) of such descriptions. We revisit this well-established problem in the SPARQL query language for RDF graphs. In particular, and by contrast to the literature, we address it for the entire class of conjunctive SPARQL queries, a.k.a. Basic Graph Pattern Queries (BGPQs), and crucially, when background knowledge is available as RDF Schema ontological constraints, we take advantage of it to devise much more precise \(\mathtt {lgg}\)s, as our experiments on the popular DBpedia dataset show.",2017
Research Track - Meta Structures in Knowledge Graphs,"This paper investigates meta structures, schema-level graphs that abstract connectivity information among a set of entities in a knowledge graph. Meta structures are useful in a variety of knowledge discovery tasks ranging from relatedness explanation to data retrieval. We formalize the meta structure computation problem and devise efficient automata-based algorithms. We introduce a meta structure-based relevance measure, which can retrieve entities related to those in input. We implemented our machineries in a visual tool called MEKoNG. We report on an extensive experimental evaluation, which confirms the suitability of our proposal from both the efficiency and effectiveness point of view.",2017
Research Track - AMUSE: Multilingual Semantic Parsing for Question Answering over Linked Data,"The task of answering natural language questions over RDF data has received wide interest in recent years, in particular in the context of the series of QALD benchmarks. The task consists of mapping a natural language question to an executable form, e.g. SPARQL, so that answers from a given KB can be extracted. So far, most systems proposed are (i) monolingual and (ii) rely on a set of hard-coded rules to interpret questions and map them into a SPARQL query. We present the first multilingual QALD pipeline that induces a model from training data for mapping a natural language question into logical form as probabilistic inference. In particular, our approach learns to map universal syntactic dependency representations to a language-independent logical form based on DUDES (Dependency-based Underspecified Discourse Representation Structures) that are then mapped to a SPARQL query as a deterministic second step. Our model builds on factor graphs that rely on features extracted from the dependency graph and corresponding semantic representations. We rely on approximate inference techniques, Markov Chain Monte Carlo methods in particular, as well as Sample Rank to update parameters using a ranking objective. Our focus lies on developing methods that overcome the lexical gap and present a novel combination of machine translation and word embedding approaches for this purpose. As a proof of concept for our approach, we evaluate our approach on the QALD-6 datasets for English, German & Spanish.",2017
Research Track - Computing FO-Rewritings in \mathcal{EL} in Practice: From Atomic to Conjunctive Queries,"A prominent approach to implementing ontology-mediated queries (OMQs) is to rewrite into a first-order query, which is then executed using a conventional SQL database system. We consider the case where the ontology is formulated in the description logic \(\mathcal{EL}\) and the actual query is a conjunctive query and show that rewritings of such OMQs can be efficiently computed in practice, in a sound and complete way. Our approach combines a reduction with a decomposed backwards chaining algorithm for OMQs that are based on the simpler atomic queries, also illuminating the relationship between first-order rewritings of OMQs based on conjunctive and on atomic queries. Experiments with real-world ontologies show promising results.",2017
Research Track - Challenges of Source Selection in the WoD,"Federated querying, the idea to execute queries over several distributed knowledge bases, lies at the core of the semantic web vision. To accommodate this vision, SPARQL provides the SERVICE keyword that allows one to allocate sub-queries to servers. In many cases, however, data may be available from multiple sources resulting in a combinatorially growing number of alternative allocations of subqueries to sources. Running a federated query on all possible sources might not be very lucrative from a user’s point of view if extensive execution times or fees are involved in accessing the sources’ data. To address this shortcoming, federated join-cardinality approximation techniques have been proposed to narrow down the number of possible allocations to a few most promising (or results-yielding) ones.",2017
Research Track - Language-Agnostic Relation Extraction from Wikipedia Abstracts,"Large-scale knowledge graphs, such as DBpedia, Wikidata, or YAGO, can be enhanced by relation extraction from text, using the data in the knowledge graph as training data, i.e., using distant supervision. While most existing approaches use language-specific methods (usually for English), we present a language-agnostic approach that exploits background knowledge from the graph instead of language-specific techniques and builds machine learning models only from language-independent features. We demonstrate the extraction of relations from Wikipedia abstracts, using the twelve largest language editions of Wikipedia. From those, we can extract 1.6M new relations in DBpedia at a level of precision of 95%, using a RandomForest classifier trained only on language-independent features. Furthermore, we show an exemplary geographical breakdown of the information extracted.",2017
Research Track - A Formal Framework for Comparing Linked Data Fragments,"The Linked Data Fragment (LDF) framework has been proposed as a uniform view to explore the trade-offs of consuming Linked Data when servers provide (possibly many) different interfaces to access their data. Every such interface has its own particular properties regarding performance, bandwidth needs, caching, etc. Several practical challenges arise. For example, before exposing a new type of LDFs in some server, can we formally say something about how this new LDF interface compares to other interfaces previously implemented in the same server? From the client side, given a client with some restricted capabilities in terms of time constraints, network connection, or computational power, which is the best type of LDFs to complete a given task? Today there are only a few formal theoretical tools to help answer these and other practical questions, and researchers have embarked in solving them mainly by experimentation.",2017
Research Track - Alignment Cubes: Towards Interactive Visual Exploration and Evaluation of Multiple Ontology Alignments,"Ontology alignment is an area of active research where many algorithms and approaches are being developed. Their performance is usually evaluated by comparing the produced alignments to a reference alignment in terms of precision, recall and F-measure. These measures, however, only provide an overall assessment of the quality of the alignments, but do not reveal differences and commonalities between alignments at a finer-grained level such as, e.g., regions or individual mappings. Furthermore, reference alignments are often unavailable, which makes the comparative exploration of alignments at different levels of granularity even more important. Making such comparisons efficient calls for a “human-in-the-loop” approach, best supported through interactive visual representations of alignments. Our approach extends a recent tool, Matrix Cubes, used for visualizing dense dynamic networks. We first identify use cases for ontology alignment evaluation that can benefit from interactive visualization, and then detail how our Alignment Cubes support interactive exploration of multiple ontology alignments. We demonstrate the usefulness of Alignment Cubes by describing visual exploration scenarios, showing how Alignment Cubes support common tasks identified in the use cases.",2017
Research Track - Attributed Description Logics: Ontologies for Knowledge Graphs,"In modelling real-world knowledge, there often arises a need to represent and reason with meta-knowledge. To equip description logics (DLs) for dealing with such ontologies, we enrich DL concepts and roles with finite sets of attribute–value pairs, called annotations, and allow concept inclusions to express constraints on annotations. We show that this may lead to increased complexity or even undecidability, and we identify cases where this increased expressivity can be achieved without incurring increased complexity of reasoning. In particular, we describe a tractable fragment based on the lightweight description logic \(\mathcal {EL}\), and we cover \(\mathcal {SROIQ}\), the DL underlying OWL 2 DL.",2017
