title,abstract,year
Resources Track - A Framework to Build Games with a Purpose for Linked Data Refinement,"With the rise of linked data and knowledge graphs, the need becomes compelling to find suitable solutions to increase the coverage and correctness of datasets, to add missing knowledge and to identify and remove errors. Several approaches – mostly relying on machine learning and NLP techniques – have been proposed to address this refinement goal; they usually need a partial gold standard, i.e. some “ground truth” to train automatic models. Gold standards are manually constructed, either by involving domain experts or by adopting crowdsourcing and human computation solutions.",2018
Resources Track - Browsing Linked Data Catalogs with LODAtlas,"The Web of Data is growing fast, as exemplified by the evolution of the Linked Open Data (LOD) cloud over the last ten years. One of the consequences of this growth is that it is becoming increasingly difficult for application developers and end-users to find the datasets that would be relevant to them. Semantic Web search engines, open data catalogs, datasets and frameworks such as LODStats and LOD Laundromat, are all useful but only give partial, even if complementary, views on what datasets are available on the Web. We introduce LODAtlas, a portal that enables users to find datasets of interest. Users can make different types of queries about both the datasets’ metadata and contents, aggregated from multiple sources. They can then quickly evaluate the matching datasets’ relevance, thanks to LODAtlas’ summary visualizations of their general metadata, connections and contents.",2018
Resources Track - The SPAR Ontologies,"Over the past eight years, we have been involved in the development of a set of complementary and orthogonal ontologies that can be used for the description of the main areas of the scholarly publishing domain, known as the SPAR (Semantic Publishing and Referencing) Ontologies. In this paper, we introduce this suite of ontologies, discuss the basic principles we have followed for their development, and describe their uptake and usage within the academic, institutional and publishing communities.",2018
Resources Track - Drammar: A Comprehensive Ontological Resource on Drama,"This paper reports about the release of a comprehensive ontological resource on drama, called Drammar. Drama is pervasive across cultures and is realized through disparate media items. Drammar has been designed with the goals to describe and encode the core dramatic qualities and to serve as a knowledge base underlying a number of applications. The impact of the resource is displayed through its direct application in a few tasks and its extension to serve in novel projects in the digital humanities.",2018
Resources Track - The Computer Science Ontology: A Large-Scale Taxonomy of Research Areas," Ontologies of research areas are important tools for characterising, exploring, and analysing the research landscape. Some fields of research are comprehensively described by large-scale taxonomies, e.g., MeSH in Biology and PhySH in Physics. Conversely, current Computer Science taxonomies are coarse-grained and tend to evolve slowly. For instance, the ACM classification scheme contains only about 2K research topics and the last version dates back to 2012. In this paper, we introduce the Computer Science Ontology (CSO), a large-scale, automatically generated ontology of research areas, which includes about 26K topics and 226K semantic relationships. It was created by applying the Klink-2 algorithm on a very large dataset of 16M scientific articles. CSO presents two main advantages over the alternatives: (i) it includes a very large number of topics that do not appear in other classifications, and (ii) it can be updated automatically by running Klink-2 on recent corpora of publications. CSO powers several tools adopted by the editorial team at Springer Nature and has been used to enable a variety of solutions, such as classifying research publications, detecting research communities, and predicting research trends. To facilitate the uptake of CSO we have developed the CSO Portal, a web application that enables users to download, explore, and provide granular feedback on CSO at different levels. Users can use the portal to rate topics and relationships, suggest missing relationships, and visualise sections of the ontology. The portal will support the publication of and access to regular new releases of CSO, with the aim of providing a comprehensive resource to the various communities engaged with scholarly data.",2018
Resources Track - VoxEL: A Benchmark Dataset for Multilingual Entity Linking,"The Entity Linking (EL) task identifies entity mentions in a text corpus and associates them with corresponding entities in a given knowledge base. While traditional EL approaches have largely focused on English texts, current trends are towards language-agnostic or otherwise multilingual approaches that can perform EL over texts in many languages. One of the obstacles to ongoing research on multilingual EL is a scarcity of annotated datasets with the same text in different languages. In this work we thus propose VoxEL: a manually-annotated gold standard for multilingual EL featuring the same text expressed in five European languages. We first motivate and describe the VoxEL dataset, using it to compare the behaviour of state of the art EL (multilingual) systems for five different languages, contrasting these results with those obtained using machine translation to English. Overall, our results identify how five state-of-the-art multilingual EL systems compare for various languages, how the results of different languages compare, and further suggest that machine translation of input text to English is now a competitive alternative to dedicated multilingual EL configurations.",2018
Resources Track - DistLODStats: Distributed Computation of RDF Dataset Statistics,"Over the last years, the Semantic Web has been growing steadily. Today, we count more than 10,000 datasets made available online following Semantic Web standards. Nevertheless, many applications, such as data integration, search, and interlinking, may not take the full advantage of the data without having a priori statistical information about its internal structure and coverage. In fact, there are already a number of tools, which offer such statistics, providing basic information about RDF datasets and vocabularies. However, those usually show severe deficiencies in terms of performance once the dataset size grows beyond the capabilities of a single machine. In this paper, we introduce a software component for statistical calculations of large RDF datasets, which scales out to clusters of machines. More specifically, we describe the first distributed in-memory approach for computing 32 different statistical criteria for RDF datasets using Apache Spark. The preliminary results show that our distributed approach improves upon a previous centralized approach we compare against and provides approximately linear horizontal scale-up. The criteria are extensible beyond the 32 default criteria, is integrated into the larger SANSA framework and employed in at least four major usage scenarios beyond the SANSA community.",2018
Resources Track - Knowledge Integration for Disease Characterization: A Breast Cancer Example,"With the rapid advancements in cancer research, the information that is useful for characterizing disease, staging tumors, and creating treatment and survivorship plans has been changing at a pace that creates challenges when physicians try to remain current. One example involves increasing usage of biomarkers when characterizing the pathologic prognostic stage of a breast tumor. We present our semantic technology approach to support cancer characterization and demonstrate it in our end-to-end prototype system that collects the newest breast cancer staging criteria from authoritative oncology manuals to construct an ontology for breast cancer. Using a tool we developed that utilizes this ontology, physician-facing applications can be used to quickly stage a new patient to support identifying risks, treatment options, and monitoring plans based on authoritative and best practice guidelines. Physicians can also re-stage existing patients or patient populations, allowing them to find patients whose stage has changed in a given patient cohort. As new guidelines emerge, using our proposed mechanism, which is grounded by semantic technologies for ingesting new data from staging manuals, we have created an enriched cancer staging ontology that integrates relevant data from several sources with very little human intervention.",2018
Resources Track - Comunica: A Modular SPARQL Query Engine for the Web,"Query evaluation over Linked Data sources has become a complex story, given the multitude of algorithms and techniques for single- and multi-source querying, as well as the heterogeneity of Web interfaces through which data is published online. Today’s query processors are insufficiently adaptable to test multiple query engine aspects in combination, such as evaluating the performance of a certain join algorithm over a federation of heterogeneous interfaces. The Semantic Web research community is in need of a flexible query engine that allows plugging in new components such as different algorithms, new or experimental SPARQL features, and support for new Web interfaces. We designed and developed a Web-friendly and modular meta query engine called  Open image in new window  that meets these specifications. In this article, we introduce this query engine and explain the architectural choices behind its design. We show how its modular nature makes it an ideal research platform for investigating new kinds of Linked Data interfaces and querying algorithms. Comunica facilitates the development, testing, and evaluation of new query processing capabilities, both in isolation and in combination with others.",2018
Resources Track - VoCaLS: Vocabulary and Catalog of Linked Streams,"The nature of Web data is changing. The popularity of news feeds and social media, the rise of the Web of Things, and the adoption of sensor technologies are examples of streaming data that reached the Web scale. The different nature of streaming data calls for specific solutions to problems like data integration and analytics. There is a need for streaming-specific Web resources: new vocabularies to describe, find and select streaming data sources, and systems that can cooperate dynamically to solve stream processing tasks. To foster interoperability between these streaming services on the Web, we propose the Vocabulary & Catalog of Linked Streams (VoCaLS). VoCaLS is a three-module ontology to (i) publish streaming data following Linked Data principles, (ii) describe streaming services and (iii) track the provenance of stream processing.",2018
In-Use Track - Semantic Technologies for Healthy Lifestyle Monitoring,"People are nowadays well aware that adopting healthy lifestyles, i.e., a combination of correct diet and adequate physical activity, may significantly contribute to the prevention of chronic diseases. We present the use of Semantic Web technologies to build a system for supporting and motivating people in following healthy lifestyles. Semantic technologies are used for modeling all relevant information, and for fostering reasoning activities by combining real-time user-generated data and domain expert knowledge. The proposed solution is validated in a realistic scenario and lessons learned from this experience are reported.",2018
Resources Track - A Complex Alignment Benchmark: GeoLink Dataset,"Ontology alignment has been studied for over a decade, and over that time many alignment systems and methods have been developed by researchers in order to find simple 1-to-1 equivalence matches between two ontologies. However, very few alignment systems focus on finding complex correspondences. One reason for this limitation may be that there are no widely accepted alignment benchmarks that contain such complex relationships. In this paper, we propose a real-world dataset from the GeoLink project as a potential complex alignment benchmark. The dataset consists of two ontologies, the GeoLink Base Ontology (GBO) and the GeoLink Modular Ontology (GMO), as well as a manually created reference alignment, that was developed in consultation with domain experts from different institutions. The alignment includes 1:1, 1:n, and m:n equivalence and subsumption correspondences, and is available in both Expressive and Declarative Ontology Alignment Language (EDOAL) and rule syntax.",2018
In-Use Track - Supporting Digital Healthcare Services Using Semantic Web Technologies,"We report on our efforts and faced challenges in using Semantic Web technologies for the purposes of supporting healthcare services provided by Babylon Health. First, we created a large medical Linked Data Graph (LDG) which integrates many publicly available (bio)medical data sources as well as several country specific ones for which we had to build custom RDF-converters. Even for data sources already distributed in RDF format a conversion process had to be applied in order to unify their schemata, simplify their structure and adapt them to the Babylon data model. Another important issue in maintaining and managing the LDG was versioning and updating with new releases of data sources. After creating the LDG, various services were built on top in order to provide an abstraction layer for non-expert end-users like doctors and software engineers which need to interact with it. Finally, we report on one of the key use cases built in Babylon, namely an AI-based chatbot which can be used by users to determine if they are in need of immediate medical treatment or they can follow a conservative treatment at home. To match user text to our internal AI-models an NLP-based knowledge extraction and logic-based reasoning approach was implemented and evaluation provided with encouraging results.",2018
"In-Use Track - Reshaping the Knowledge Graph by Connecting Researchers, Data and Practices in ResearchSpace","ResearchSpace is an open source platform designed at the British Museum to help establish a community of researchers, where their underlying activities are framed by data sharing, active engagement in formal arguments, and semantic publishing. Using Semantic Web languages and technologies, the innovations of the system are shaped by a social conceptualisation of the graph-based representation of information. This is employed by integrated semantic components aimed at subject experts that offer mechanisms to create, annotate, assert, argue, search, cite, and justify data-driven research. This paper showcases a new onto-epistemological approach that supports researchers to contribute to a growing and sustainable corpus of knowledge that has history, not just provenance, built-in. It describes our considerations in designing for interdisciplinary collaboration, usability and trust in the digital space, highlighted by use cases in archaeology, art history, and history of science.",2018
In-Use Track - Getting the Most Out of Wikidata: Semantic Technology Usage in Wikipedia’s Knowledge Graph,"Wikidata is the collaboratively curated knowledge graph of the Wikimedia Foundation (WMF), and the core project of Wikimedia’s data management strategy. A major challenge for bringing Wikidata to its full potential was to provide reliable and powerful services for data sharing and query, and the WMF has chosen to rely on semantic technologies for this purpose. A live SPARQL endpoint, regular RDF dumps, and linked data APIs are now forming the backbone of many uses of Wikidata. We describe this influential use case and its underlying infrastructure, analyse current usage, and share our lessons learned and future plans.",2018
In-Use Track - Ontology-Based Recommendation of Editorial Products," Major academic publishers need to be able to analyse their vast catalogue of products and select the best items to be marketed in scientific venues. This is a complex exercise that requires characterising with a high precision the topics of thousands of books and matching them with the interests of the relevant communities. In Springer Nature, this task has been traditionally handled manually by publishing editors. However, the rapid growth in the number of scientific publications and the dynamic nature of the Computer Science landscape has made this solution increasingly inefficient. We have addressed this issue by creating Smart Book Recommender (SBR), an ontology-based recommender system developed by The Open University (OU) in collaboration with Springer Nature, which supports their Computer Science editorial team in selecting the products to market at specific venues. SBR recommends books, journals, and conference proceedings relevant to a conference by taking advantage of a semantically enhanced representation of about 27K editorial products. This is based on the Computer Science Ontology, a very large-scale, automatically generated taxonomy of research areas. SBR also allows users to investigate why a certain publication was suggested by the system. It does so by means of an interactive graph view that displays the topic taxonomy of the recommended editorial product and compares it with the topic-centric characterization of the input conference. An evaluation carried out with seven Springer Nature editors and seven OU researchers has confirmed the effectiveness of the solution.",2018
In-Use Track - Synthesizing Knowledge Graphs from Web Sources with the MINTE^+ Framework,"Institutions from different domains require the integration of data coming from heterogeneous Web sources. Typical use cases include Knowledge Search, Knowledge Building, and Knowledge Completion. We report on the implementation of the RDF Molecule-Based Integration Framework MINTE\(^+\) in three domain-specific applications: Law Enforcement, Job Market Analysis, and Manufacturing. The use of RDF molecules as data representation and a core element in the framework gives MINTE\(^+\) enough flexibility to synthesize knowledge graphs in different domains. We first describe the challenges in each domain-specific application, then the implementation and configuration of the framework to solve the particular problems of each domain. We show how the parameters defined in the framework allow to tune the integration process with the best values according to each domain. Finally, we present the main results, and the lessons learned from each application.",2018
