title,abstract,year
Research Track - Reliable Granular References to Changing Linked Data,"Nanopublications are a concept to represent Linked Data in a granular and provenance-aware manner, which has been successfully applied to a number of scientific datasets. We demonstrated in previous work how we can establish reliable and verifiable identifiers for nanopublications and sets thereof. Further adoption of these techniques, however, was probably hindered by the fact that nanopublications can lead to an explosion in the number of triples due to auxiliary information about the structure of each nanopublication and repetitive provenance and metadata. We demonstrate here that this significant overhead disappears once we take the version history of nanopublication datasets into account, calculate incremental updates, and allow users to deal with the specific subsets they need. We show that the total size and overhead of evolving scientific datasets is reduced, and typical subsets that researchers use for their analyses can be referenced and retrieved efficiently with optimized precision, persistence, and reliability.",2017
Research Track - Cost-Driven Ontology-Based Data Access,"SPARQL query answering in ontology-based data access (OBDA) is carried out by translating into SQL queries over the data source. Standard translation techniques try to transform the user query into a union of conjunctive queries (UCQ), following the heuristic argument that UCQs can be efficiently evaluated by modern relational database engines. In this work, we show that translating to UCQs is not always the best choice, and that, under certain conditions on the interplay between the ontology, the mappings, and the statistics of the data, alternative translations can be evaluated much more efficiently. To find the best translation, we devise a cost model together with a novel cardinality estimation that takes into account all such OBDA components. Our experiments confirm that (i) alternatives to the UCQ translation might produce queries that are orders of magnitude more efficient, and (ii) the cost model we propose is faithful to the actual query evaluation cost, and hence is well suited to select the best translation.",2017
Research Track - The Odyssey Approach for Optimizing Federated SPARQL Queries,"Answering queries over a federation of SPARQL endpoints requires combining data from more than one data source. Optimizing queries in such scenarios is particularly challenging not only because of (i) the large variety of possible query execution plans that correctly answer the query but also because (ii) there is only limited access to statistics about schema and instance data of remote sources. To overcome these challenges, most federated query engines rely on heuristics to reduce the space of possible query execution plans or on dynamic programming strategies to produce optimal plans. Nevertheless, these plans may still exhibit a high number of intermediate results or high execution times because of heuristics and inaccurate cost estimations. In this paper, we present Odyssey, an approach that uses statistics that allow for a more accurate cost estimation for federated queries and therefore enables Odyssey to produce better query execution plans. Our experimental results show that Odyssey produces query execution plans that are better in terms of data transfer and execution time than state-of-the-art optimizers. Our experiments using the FedBench benchmark show execution time gains of at least 25 times on average.",2017
Research Track - Automated Fine-Grained Trust Assessment in Federated Knowledge Bases,"The federation of different data sources gained increasing attention due to the continuously growing amount of data. But the more data are available from heterogeneous sources, the higher the risk is of inconsistency. To tackle this challenge in federated knowledge bases we propose a fully automated approach for computing trust values at different levels of granularity. Gathering both the conflict graph and statistical evidence generated by inconsistency detection and resolution, we create a Markov network to facilitate the application of Gibbs sampling to compute a probability for each conflicting assertion. Based on which, trust values for each integrated data source and its respective signature elements are computed. We evaluate our approach on a large distributed dataset from the domain of library science.",2017
Research Track - Entity Comparison in RDF Graphs,"In many applications, there is an increasing need for the new types of RDF data analysis that are not covered by standard reasoning tasks such as SPARQL query answering. One such important analysis task is entity comparison, i.e., determining what are similarities and differences between two given entities in an RDF graph. For instance, in an RDF graph about drugs, we may want to compare Metamizole and Ibuprofen and automatically find out that they are similar in that they are both analgesics but, in contrast to Metamizole, Ibuprofen also has a considerable anti-inflammatory effect. Entity comparison is a widely used functionality available in many information systems, such as universities or product comparison websites. However, comparison is typically domain-specific and depends on a fixed set of aspects to compare. In this paper, we propose a formal framework for domain-independent entity comparison over RDF graphs. We model similarities and differences between entities as SPARQL queries satisfying certain additional properties, and propose algorithms for computing them.",2017
Research Track - Completeness-Aware Rule Learning from Knowledge Graphs,"Knowledge graphs (KGs) are huge collections of primarily encyclopedic facts. They are widely used in entity recognition, structured search, question answering, and other important tasks. Rule mining is commonly applied to discover patterns in KGs. However, unlike in traditional association rule mining, KGs provide a setting with a high degree of incompleteness, which may result in the wrong estimation of the quality of mined rules, leading to erroneous beliefs such as all artists have won an award, or hockey players do not have children.",2017
Research Track - Provenance Information in a Collaborative Knowledge Graph: An Evaluation of Wikidata External References,"Wikidata is a collaboratively-edited knowledge graph; it expresses knowledge in the form of subject-property-value triples, which can be enhanced with references to add provenance information. Understanding the quality of Wikidata is key to its widespread adoption as a knowledge resource. We analyse one aspect of Wikidata quality, provenance, in terms of relevance and authoritativeness of its external references. We follow a two-staged approach. First, we perform a crowdsourced evaluation of references. Second, we use the judgements collected in the first stage to train a machine learning model to predict reference quality on a large-scale. The features chosen for the models were related to reference editing and the semantics of the triples they referred to. \(61\%\) of the references evaluated were relevant and authoritative. Bad references were often links that changed and either stopped working or pointed to other pages. The machine learning models outperformed the baseline and were able to accurately predict non-relevant and non-authoritative references. Further work should focus on implementing our approach in Wikidata to help editors find bad references.",2017
Research Track - Mining Hypotheses from Data in OWL: Advanced Evaluation and Complete Construction,"Automated acquisition (learning) of ontologies from data has attracted research interest because it can complement manual, expensive construction of ontologies. We investigate the problem of General Terminology Induction in OWL, i.e. acquiring general, expressive TBox axioms (hypotheses) from an ABox (data). We define novel measures designed to rigorously evaluate the quality of hypotheses while respecting the standard semantics of OWL. We propose an informed, data-driven algorithm that constructs class expressions for hypotheses in OWL and guarantees completeness. We empirically evaluate the quality measures on two corpora of ontologies and run a case study with a domain expert to gain insight into applicability of the measures and acquired hypotheses. The results show that the measures capture different quality aspects and not only correct hypotheses can be interesting.",2017
"Research Track - Investigating Learnability, User Performance, and Preferences of the Path Query Language SemwidgQL Compared to SPARQL","In this paper, we present an empirical comparison of user performance and perceived usability for Sparql versus SemwidgQL, a path-oriented Rdf query language. We developed SemwidgQL to facilitate the formulation of Rdf queries and to enable non-specialist developers and web authors to integrate Linked Data and other semantic data sources into standard web applications. We performed a user study in which participants wrote a set of queries in both languages. We measured both objective performance as well as subjective responses to a set of questionnaire items. Results indicate that SemwidgQL is easier to learn, more efficient, and preferred by learners. To assess the applicability of SemwidgQL in real applications, we analyzed its expressiveness based on a large corpus of observed Sparql queries, showing that the language covers more than 90% of the typical queries performed on Linked Data.",2017
Research Track - Strider: A Hybrid Adaptive Distributed RDF Stream Processing Engine,"Real-time processing of data streams emanating from sensors is becoming a common task in Internet of Things scenarios. The key implementation goal consists in efficiently handling massive incoming data streams and supporting advanced data analytics services like anomaly detection. In an on-going, industrial project, a 24 / 7 available stream processing engine usually faces dynamically changing data and workload characteristics. These changes impact the engine’s performance and reliability. We propose Strider, a hybrid adaptive distributed RDF Stream Processing engine that optimizes logical query plan according to the state of data streams. Strider has been designed to guarantee important industrial properties such as scalability, high availability, fault tolerance, high throughput and acceptable latency. These guarantees are obtained by designing the engine’s architecture with state-of-the-art Apache components such as Spark and Kafka. We highlight the efficiency (e.g., on a single machine machine, up to 60x gain on throughput compared to state-of-the-art systems, a throughput of 3.1 million triples/second on a 9 machines cluster, a major breakthrough in this system’s category) of Strider on real-world and synthetic data sets.",2017
Research Track - Semantic Faceted Search with Aggregation and Recursion,"Faceted search is the de facto approach for exploration of data in e-commerce: it allows users to construct queries in an intuitive way without a prior knowledge of formal query languages. This approach has been recently adapted to the context of RDF. Existing faceted search systems however do not allow users to construct queries with aggregation and recursion which poses limitations in practice. In this work we extend faceted search over RDF with these functionalities and study the corresponding query language. In particular, we investigate complexity of the query answering and query containment problems.",2017
Research Track - Cross-Lingual Entity Alignment via Joint Attribute-Preserving Embedding,"Entity alignment is the task of finding entities in two knowledge bases (KBs) that represent the same real-world object. When facing KBs in different natural languages, conventional cross-lingual entity alignment methods rely on machine translation to eliminate the language barriers. These approaches often suffer from the uneven quality of translations between languages. While recent embedding-based techniques encode entities and relationships in KBs and do not need machine translation for cross-lingual entity alignment, a significant number of attributes remain largely unexplored. In this paper, we propose a joint attribute-preserving embedding model for cross-lingual entity alignment. It jointly embeds the structures of two KBs into a unified vector space and further refines it by leveraging attribute correlations in the KBs. Our experimental results on real-world datasets show that this approach significantly outperforms the state-of-the-art embedding approaches for cross-lingual entity alignment and could be complemented with methods based on machine translation.",2017
Research Track - Ontolex JeuxDeMots and Its Alignment to the Linguistic Linked Open Data Cloud,"JeuxDeMots (JdM) is a rich collaborative lexical network in French, built on a crowdsourcing principle as a game with a purpose, represented in an ad-hoc tabular format. In the interest of reuse and interoperability, we propose a conversion algorithm for JdM following the Ontolex model, along with a word sense alignment algorithm, called JdMBabelizer, that anchors JdM sense-refinements to synsets in the lemon edition of BabelNet and thus to the Linguistic Linked Open Data cloud. Our alignment algorithm exploits the richness of JdM in terms of weighted semantic-lexical relations—particularly the inhibition relation between senses—that are specific to JdM. We produce a reference alignment dataset for JdM and BabelNet that we use to evaluate the quality of our algorithm and that we make available to the community. The obtained results are comparable to those of state of the art approaches.",2017
Research Track - Blockchain Enabled Privacy Audit Logs,"Privacy audit logs are used to capture the actions of participants in a data sharing environment in order for auditors to check compliance with privacy policies. However, collusion may occur between the auditors and participants to obfuscate actions that should be recorded in the audit logs. In this paper, we propose a Linked Data based method of utilizing blockchain technology to create tamper-proof audit logs that provide proof of log manipulation and non-repudiation. We also provide experimental validation of the scalability of our solution using an existing Linked Data privacy audit log model.",2017
Research Track - VICKEY: Mining Conditional Keys on Knowledge Bases,"A conditional key is a key constraint that is valid in only a part of the data. In this paper, we show how such keys can be mined automatically on large knowledge bases (KBs). For this, we combine techniques from key mining with techniques from rule mining. We show that our method can scale to KBs of millions of facts. We also show that the conditional keys we mine can improve the quality of entity linking by up to 47% points.",2017
"Research Track - Towards Holistic Concept Representations: Embedding Relational Knowledge, Visual Attributes, and Distributional Word Semantics","Knowledge Graphs (KGs) effectively capture explicit relational knowledge about individual entities. However, visual attributes of those entities, like their shape and color and pragmatic aspects concerning their usage in natural language are not covered. Recent approaches encode such knowledge by learning latent representations (‘embeddings’) separately: In computer vision, visual object features are learned from large image collections and in computational linguistics, word embeddings are extracted from huge text corpora which capture their distributional semantics. We investigate the potential of complementing the relational knowledge captured in KG embeddings with knowledge from text documents and images by learning a shared latent representation that integrates information across those modalities. Our empirical results show that a joined concept representation provides measurable benefits for (i) semantic similarity benchmarks, since it shows a higher correlation with the human notion of similarity than uni- or bi-modal representations, and (ii) entity-type prediction tasks, since it clearly outperforms plain KG embeddings. These findings encourage further research towards capturing types of knowledge that go beyond today’s KGs.",2017
Research Track - Cross-Lingual Infobox Alignment in Wikipedia Using Entity-Attribute Factor Graph,"Wikipedia infoboxes contain information about article entities in the form of attribute-value pairs, and are thus a very rich source of structured knowledge. However, as the different language versions of Wikipedia evolve independently, it is a promising but challenging problem to find correspondences between infobox attributes in different language editions. In this paper, we propose 8 effective features for cross lingual infobox attribute matching containing categories, templates, attribute labels and values. We propose entity-attribute factor graph to consider not only individual features but also the correlations among attribute pairs. Experiments on the two Wikipedia data sets of English-Chinese and English-French show that proposed approach can achieve high F1-measure: 85.5% and 85.4% respectively on the two data sets. Our proposed approach finds 23,923 new infobox attribute mappings between English and Chinese Wikipedia, and 31,576 between English and French based on no more than six thousand existing matched infobox attributes. We conduct an infobox completion experiment on English-Chinese Wikipedia and complement 76,498 (more than 30% of EN-ZH Wikipedia existing cross-lingual links) pairs of corresponding articles with more than one attribute-value pairs.",2017
Resource Track - Linked Data Publication of Live Music Archives and Analyses,We describe the publication of a linked data set exposing metadata from the Internet Archive Live Music Archive along with detailed feature analysis data of the audio files contained in the archive. The collection is linked to existing musical and geographical resources allowing for the extraction of useful or nteresting subsets of data using additional metadata.,2017
Research Track - Encoding Category Correlations into Bilingual Topic Modeling for Cross-Lingual Taxonomy Alignment,"Cross-lingual taxonomy alignment (CLTA) refers to mapping each category in the source taxonomy of one language onto a ranked list of most relevant categories in the target taxonomy of another language. Recently, vector similarities depending on bilingual topic models have achieved the state-of-the-art performance on CLTA. However, these models only model the textual context of categories, but ignore explicit category correlations, such as correlations between the categories and their co-occurring words in text or correlations among the categories of ancestor-descendant relationships in a taxonomy. In this paper, we propose a unified solution to encode category correlations into bilingual topic modeling for CLTA, which brings two novel category correlation based bilingual topic models, called CC-BiLDA and CC-BiBTM. Experiments on two real-world datasets show our proposed models significantly outperform the state-of-the-art baselines on CLTA (at least +10.9% in each evaluation metric).",2017
Resource Track - CodeOntology: RDF-ization of Source Code,"In this paper, we leverage advances in the Semantic Web area, including data modeling (RDF), data management and querying (JENA and SPARQL), to develop CodeOntology, a community-shared software framework supporting expressive queries over source code. The project consists of two main contributions: an ontology that provides a formal representation of object-oriented programming languages, and a parser that is able to analyze Java source code and serialize it into RDF triples. The parser has been successfully applied to the source code of OpenJDK 8, gathering a structured dataset consisting of more than 2 million RDF triples. CodeOntology allows to generate Linked Data from any Java project, thereby enabling the execution of highly expressive queries over source code, by means of a powerful language like SPARQL.",2017
Research Track - An Extension of SPARQL for Expressing Qualitative Preferences,"In this paper we present SPREFQL, an extension of the SPARQL language that allows appending a ""PREFER"" clause that expresses ‘soft’ preferences over the query results obtained by the main body of the query. The extension does not add expressivity and any SPREFQL query can be transformed to an equivalent standard SPARQL query. However, clearly separating preferences from the ‘hard’ patterns and filters in the ""WHERE"" clause gives queries where the intention of the client is more cleanly expressed, an advantage for both human readability and machine optimization. In the paper we formally define the syntax and the semantics of the extension and we also provide empirical evidence that optimizations specific to SPREFQL improve run-time efficiency by comparison to the usually applied optimizations on the equivalent standard SPARQL query.",2017
Resource Track - Diefficiency Metrics: Measuring the Continuous Efficiency of Query Processing Approaches,"During empirical evaluations of query processing techniques, metrics like execution time, time for the first answer, and throughput are usually reported. Albeit informative, these metrics are unable to quantify and evaluate the efficiency of a query engine over a certain time period – or diefficiency –, thus hampering the distinction of cutting-edge engines able to exhibit high-performance gradually. We tackle this issue and devise two experimental metrics named dief@t and dief@k, which allow for measuring the diefficiency during an elapsed time period t or while k answers are produced, respectively. The dief@t and dief@k measurement methods rely on the computation of the area under the curve of answer traces, and thus capturing the answer concentration over a time interval. We report experimental results of evaluating the behavior of a generic SPARQL query engine using both metrics. Observed results suggest that dief@t and dief@k are able to measure the performance of SPARQL query engines based on both the amount of answers produced by an engine and the time required to generate these answers.",2017
Resource Track - The MedRed Ontology for Representing Clinical Data Acquisition Metadata,"Electronic Data Capture (EDC) software solutions are progressively being adopted for conducting clinical trials and studies, carried out by biomedical, pharmaceutical and health-care research teams. In this paper we present the MedRed Ontology, whose goal is to represent the metadata of these studies, using well-established standards, and reusing related vocabularies to describe essential aspects, such as validation rules, composability, or provenance. The paper describes the design principles behind the ontology and how it relates to existing models and formats used in the industry. We also reuse well-known vocabularies and W3C recommendations. Furthermore, we have validated the ontology with existing clinical studies in the context of the MedRed project, as well as a collection of metadata of well-known studies. Finally, we have made the ontology available publicly following best practices and vocabulary sharing guidelines.",2017
Resource Track - Iguana: A Generic Framework for Benchmarking the Read-Write Performance of Triple Stores,"The performance of triples stores is crucial for applications driven by RDF. Several benchmarks have been proposed that assess the performance of triple stores. However, no integrated benchmark-independent execution framework for these benchmarks has yet been provided. We propose a novel SPARQL benchmark execution framework called Iguana. Our framework complements benchmarks by providing an execution environment which can measure the performance of triple stores during data loading, data updates as well as under different loads and parallel requests. Moreover, it allows a uniform comparison of results on different benchmarks. We execute the FEASIBLE and DBPSB benchmarks using the Iguana framework and measure the performance of popular triple stores under updates and parallel user requests. We compare our results (See https://doi.org/10.6084/m9.figshare.c.3767501.v1) with state-of-the-art benchmarking results and show that our benchmark execution framework can unveil new insights pertaining to the performance of triple stores.",2017
Resource Track - LOD-a-lot,"LOD-a-lot democratizes access to the Linked Open Data (LOD) Cloud by serving more than 28 billion unique triples from 650 K datasets over a single self-indexed file. This corpus can be queried online with a sustainable Linked Data Fragments interface, or downloaded and consumed locally: LOD-a-lot is easy to deploy and demands affordable resources (524 GB of disk space and 15.7 GB of RAM), enabling Web-scale repeatable experimentation and research even by standard laptops.",2017
