title,abstract
Deuce: A Lightweight User Interface for Structured Editing," We present a structure-aware code editor, called Deuce, that is equipped with direct manipulation capabilities for invoking automated program transformations. Compared to traditional refactoring environments, Deuce employs a direct manipulation interface that is tightly integrated within a text-based editing workflow. In particular, Deuce draws (i) clickable widgets atop the source code that allow the user to structurally select the unstructured text for subexpressions and other relevant features, and (ii) a lightweight, interactive menu of potential transformations based on the current selections. We implement and evaluate our design with mostly standard transformations in the context of a small functional programming language. A controlled user study with 21 participants demonstrates that structural selection is preferred to a more traditional text-selection interface and may be faster overall once users gain experience with the tool. These results accord with Deuce’s aim to provide human-friendly structural interactions on top of familiar text-based editing. "
Do You Remember This Source Code?,
Do programmers work at night or during weekend?," Abnormal working hours can reduce work health, general well-being, and productivity, independent from a profession. To inform future approaches for automatic stress and overload detection, this paper establishes empirically collected measures of the work patterns of software engineers. To this aim, we perform the first large-scale study of software engineers’ working hours by investigating the time stamps of commit activities of 86 large open source software projects, both containing hired and volunteer developers. We find that two thirds of software engineers mainly follow typical office hours, empirically established to be from 10h to 18h, and do not usually work during nights and weekends. Large variations between projects and individuals exist. Surprisingly, we found no support that project maturation would decrease abnormal working hours. In the Firefox case study, we found that hired developers work more during office hours while seniority, either in terms of number of commits or job status, did not impact working hours. We conclude that the use of working hours or timestamps of work products for stress detection requires establishing baselines at the level of individuals. "
Does the Propagation of Artifact Changes across Tasks reflect Work Dependencies?," Developers commonly define tasks to help coordinate software development efforts-whether they be feature implementation, refactoring, or bug fixes. Developers establish links between tasks to express implicit dependencies that needs explicit handling-dependencies that often require the developers responsible for a given task to assess how changes in a linked task affect their own work and vice versa (i.e., change propagation). While seemingly useful, it is unknown if change propagation indeed coincides with task links. No study has investigated to what extent change propagation actually occurs between task pairs and whether it is able to serve as a metric for characterizing the underlying task dependency. In this paper, we study the temporal relationship between developer reading and changing of source code in relationship to task links. We identify seven situations that explain the varying correlation of change propagation with linked task pairs and find six motifs describing when change propagation occurs between non-linked task pairs. Our paper demonstrates that task links are indeed useful for recommending which artifacts to monitor for changes, which developers to involve in a task, or which tasks to inspect. "
DroidStar: Callback Typestates for Android Classes,
Efficient Sampling of SAT Solutions for Testing," In software and hardware testing, generating multiple inputs which satisfy a given set of constraints is an important problem with applications in fuzz testing and stimulus generation. However, it is a challenge to perform the sampling efficiently, while generating a diverse set of inputs which satisfy the constraints. We developed a new algorithm QuickSampler which requires a small number of solver calls to produce millions of samples which satisfy the constraints with high probability. We evaluate QuickSampler on large real-world benchmarks and show that it can produce unique valid solutions orders of magnitude faster than other state-of-the-art sampling tools, with a distribution which is reasonably close to uniform in practice.  Link to Publication: https://people.eecs.berkeley.edu/~rtd/papers/quicksampler.pdf"
EnMobile: Entity-based Characterization and Analysis of Mobile Malware," Modern mobile malware tend to conduct their malicious exploits through sophisticated patterns of interactions that involve multiple entities, e.g., the mobile platform, human users, and network locations. Such malware often evade the detection by existing approaches due to their limited expressiveness and accuracy in characterizing and detecting these malware. To address these issues, in this paper, we recognize entities in the environment of an app, the app’s interactions with such entities, and the provenance of these interactions, i.e., the intent and ownership of each interaction, as the key to comprehensively characterizing modern mobile apps, and mobile malware in particular. With this insight, we propose a novel approach named EnMobile including a new entity-based characterization of mobile-app behaviors, and corresponding static analyses, to accurately characterize an app’s interactions with entities. We implement EnMobile and provide a practical application of EnMobile in a signature-based scheme for detecting mobile malware. We evaluate EnMobile on a set of 6614 apps consisting of malware from Genome and Drebin along with benign apps from Google Play. Our results show that EnMobile detects malware with substantially higher precision and recall than four state-of-the-art approaches, namely Apposcopy, Drebin, MUDFLOW, and AppContext. "
Enlightened Debugging," Numerous automated techniques have been proposed to reduce the cost of software debugging, a notoriously time-consuming and human-intensive activity. Among these techniques, Statistical Fault Localization (SFL) is particularly popular. One issue with SFL is that it is based on strong, often unrealistic assumptions on how developers behave when debugging. To address this problem, we propose Enlighten, an interactive, feedback-driven fault localization technique. Given a failing test, Enlighten (1) leverages SFL and dynamic dependence analysis to identify suspicious method invocations and corresponding data values, (2) presents the developer with a query about the most suspicious invocation expressed in terms of inputs and outputs, (3) encodes the developer feedback on the correctness of individual data values as extra program speci cations, and (4) repeats these steps until the fault is found. We evaluated Enlighten in two ways. First, we applied Enlighten to 1,807 real and seeded faults in 3 open source programs using an automated oracle as a simulated user; for over 96% of these faults, Enlighten required less than 10 interactions with the simulated user to localize the fault, and a sensitivity analysis showed that the results were robust to erroneous responses. Second, we performed an actual user study on 4 faults with 24 participants and found that participants who used Enlighten performed signi cantly better than those not using our tool, in terms of both number of faults localized and time needed to localize the faults. "
FAST Approaches to Scalable Similarity-based Test Case Prioritization," Many test case prioritization criteria have been proposed for speeding up fault detection. Among them, similarity-based approaches give priority to the test cases that are the most dissimilar from those already selected. However, the proposed criteria do not scale up to handle the many thousands or even some millions test suite sizes of modern industrial systems and simple heuristics are used instead. We introduce the FAST family of test case prioritization techniques that radically changes this landscape by borrowing algorithms commonly exploited in the big data domain to find similar items. FAST techniques provide scalable similarity-based test case prioritization in both white-box and black-box fashion. The results from experimentation on real world C and Java subjects show that the fastest members of the family outperform other black-box approaches in efficiency with no significant impact on effectiveness, and also outperform white-box approaches, including greedy ones, if preparation time is not counted. A simulation study of scalability shows that one FAST technique can prioritize a million test cases in less than 20 minutes. "
FaCoY – A Code-to-Code Search Engine," Code search is an unavoidable activity in software development. Various approaches and techniques have been explored in the literature to support code search tasks. Most of these approaches focus on serving user queries provided as natural language free-form input. However, there exists a wide range of use-case scenarios where a code-to-code approach would be most beneficial. For example, research directions in code transplantation, code diversity, patch recommendation can leverage a code-to-code search engine to find essential ingredients for their techniques. In this paper, we propose FaCoY, a novel approach for statically finding code fragments which may be semantically similar to user input code. FaCoY implements a query alternation strategy: instead of directly matching code query tokens with code in the search space, FaCoY first attempts to identify other tokens which may also be relevant in implementing the functional behavior of the input code. With various experiments, we show that (1) FaCoY is more effective than online code-to-code search engines; (2) FaCoY can detect more semantic code clones (i.e., Type-4) in BigCloneBench than the state-of-the-art; (3) FaCoY, while static, can detect code fragments which are indeed similar with respect to runtime execution behavior; and (4) FaCoY can be useful in code/patch recommendation.  Link to Publication: https://doi.org/10.1145/3180155.3180187"
Fine-Grained Test Minimization," As a software system evolves, its test suite can accumulate redundancies over time. Test minimization aims at removing redundant test cases. However, current techniques remove whole test cases from the test suite using test adequacy criteria, such as code coverage. This has two limitations, namely (1) by removing a whole test case the corresponding test assertions are also lost, which can inhibit test suite effectiveness, (2) the issue of partly redundant test cases, i.e., tests with redundant test statements, is ignored. We propose a novel approach for fine-grained test case minimization. Our analysis is based on the inference of a test suite model that enables automated test reorganization within test cases. It enables removing redundancies at the test statement level, while preserving the coverage and test assertions of the test suite. We evaluated our approach, implemented in a tool called Testler, on the test suites of 15 open source projects. Our analysis shows that over 4,639 (24%) of the tests in these test suites are partly redundant, with over 11,819 redundant test statements in total. Our results show that Testler removes 43% of the redundant test statements, reducing the number of partly redundant tests by 52%. As a result, test suite execution time is reduced by up to 37% (20% on average), while maintaining the original statement coverage, branch coverage, test assertions, and fault detection capability. "
From UI Design Image to GUI Skeleton: A Neural Machine Translator to Bootstrap Mobile GUI Implementation," A GUI skeleton is the starting point for implementing a UI design image. To obtain a GUI skeleton from a UI design image, developers have to visually understand UI elements and their spatial layout in the image, and then translate this understanding into proper GUI components and their compositions. Automating this visual understanding and translation would be beneficial for bootstraping mobile GUI implementation, but it is a challenging task due to the diversity of UI designs and the complexity of GUI skeletons to generate. Existing tools are rigid as they depend on heuristically-designed visual understanding and GUI generation rules. In this paper, we present a neural machine translator that combines recent advances in computer vision and machine translation for translating a UI design image into a GUI skeleton. Our translator learns to extract visual features in UI images, encode these features’ spatial layouts, and generate GUI skeletons in a unified neural network framework, without requiring manual rule development. For training our translator, we develop an automated GUI exploration method to automatically collect large-scale UI data from real-world applications. We carry out extensive experiments to evaluate the accuracy, generality and usefulness of our approach. "
GUILeak: Tracing Privacy-Policy Claims on User Input Data for Android Applications,
Generalized Data Structure Synthesis," Data structure synthesis is the task of generating data structure implementations from high-level specifications. Recent work in this area has shown potential to save programmer time and reduce the risk of defects. Existing techniques focus on data structures for manipulating subsets of a single collection, but real-world programs often track multiple related collections and aggregate properties such as sums, counts, minimums, and maximums. This paper shows how to synthesize data structures that track subsets and aggregations of multiple related collections. Our technique decomposes the synthesis task into alternating steps of query synthesis and incrementalization. The query synthesis step implements pure operations over the data structure state by leveraging existing enumerative synthesis techniques, specialized to the data structures domain. The incrementalization step implements imperative state modifications by re-framing them as fresh queries that determine what to change, coupled with a small amount of code to apply the change. As an added benefit of this approach over previous work, the synthesized data structure is optimized for not only the queries in the specification but also the required update operations. We have evaluated our approach in four large case studies, demonstrating that these extensions are broadly applicable. "
Goal-Conflict Likelihood Assessment based on Model Counting," In goal-oriented requirements engineering approaches, conflict analysis has been proposed as an abstraction for risk analysis. Intu- itively, given a set of expected goals to be achieved by the system-to-be, a conflict represents a subtle situation that makes goals diverge, i.e., not be satis able as a whole. Conflict analysis is typically driven by the identify-assess-control cycle, aimed at identifying, assessing and resolving conflicts that may obstruct the satisfaction of the expected goals. In particular, the assessment step is concerned with evaluating how likely the identi ed conflicts are, and how likely and severe are their consequences. So far, existing assessment approaches restrict their analysis to obstacles (conflicts that prevent the satisfaction of a single goal), and assume that certain probabilistic information on the domain is pro- vided, that needs to be previously elicited from experienced users, statistical data or simulations. In this paper, we present a novel automated approach to assess how likely a conflict is, that applies to general conflicts (not only obstacles) without requiring probabilistic information on the domain. Intuitively, given the LTL formulation of the domain and of a set of goals to be achieved, we compute goal conflicts, and exploit string model counting techniques to estimate the likelihood of the occurrence of the corresponding conflicting situations and the severity in which these a ect the satisfaction of the goals. This information can then be used to prioritize conflicts to be resolved, and suggest which goals to drive attention to for refinements. "
HireBuild: An Automatic Approach to History-Driven Repair of Build Scripts,
How Modern News Aggregators Help Development Communities Shape and Share Knowledge," Many developers rely on modern news aggregator sites such as Reddit and Hacker News to stay up to date with the latest technological developments and trends. In order to understand what motivates developers to contribute, what kind of content is shared, and how knowledge is shaped by the community, we interviewed and surveyed developers that participate on the Reddit programming subreddit and we analyzed a sample of posts on both Reddit and Hacker News. We learned what kind of content is shared in these websites and developer motivations for posting, sharing, discussing, evaluating, and aggregating knowledge on these aggregators, while revealing challenges developers face in terms of how content and participant behavior is moderated. Our insights aim to improve the practices developers follow when using news aggregators, as well as guide tool makers on how to improve their tools. Our findings are also relevant to researchers that study developer communities of practice. "
How not to structure your database-backed web applications: a study of performance bugs in the wild," Many web applications use databases for persistent data storage, and using Object Relational Mapping (ORM) frameworks is a common way to develop such database-backed web applications. Unfortunately, developing efficient ORM applications is challenging, as the ORM framework hides the underlying database query generation and execution. This problem is becoming more severe as these applications need to process an increasingly large amount of persistent data. Recent research has targeted specific aspects of performance problems in ORM applications. However, there has not been any systematic study to identify common performance antipatterns in real-world such applications, how they affect resulting application performance, and remedies for them. In this paper, we try to answer these questions through a comprehensive study of 12 representative real-world ORM applications. We generalize 9 ORM performance anti-patterns from more than 200 performance issues that we obtain by studying their bug-tracking systems and profiling their latest versions. To prove our point, we manually fix 64 performance issues in their latest versions and obtain a median speedup of 2× (and up to 39× max) with fewer than 5 lines of code change in most cases. Many of the issues we found have been confirmed by developers, and we have implemented ways to identify other code fragments with similar issues as well. "
Hybrid Regression Test Selection,
Identifying Design Problems in the Source Code: A Grounded Theory," The prevalence of design problems may cause re-engineering or even discontinuation of the system. Due to missing, informal or outdated design documentation, developers often have to rely on the source code to identify design problems. Therefore, developers have to analyze different symptoms that manifest in several code elements, which may quickly turn into a complex task. Although researchers have been investigating techniques to help developers in identifying design problems, there is little knowledge on how developers actually proceed to identify design problems. In order to tackle this problem, we conducted a multi-trial industrial experiment with professionals from 5 software companies to build a grounded theory. The resulting theory offers explanations on how developers identify design problems in practice. For instance, it reveals the characteristics of symptoms that developers consider helpful. Moreover, developers often combine different types of symptoms to identify a single design problem. This knowledge serves as a basis to further understand the phenomena and advance towards more effective identification techniques. "
Identifying Features in Forks,
Identifying Patch Correctness in Test-Based Program Repair," Test-based automatic program repair has attracted a lot of attention in recent years. However, the test suites in practice are often too weak to guarantee correctness and existing approaches often generate a large number of incorrect patches. To reduce the number of incorrect patches generated, we propose a novel approach that heuristically determines the correctness of the generated patches. The core idea is to exploit the behavior similarity of test case executions. The passing tests on original and patched programs are likely to behave similarly while the failing tests on original and patched programs are likely to behave differently. Also, if two tests exhibit similar runtime behavior, the two tests are likely to have the same test results. Based on these observations, we generate new test inputs to enhance the test suites and use their behavior similarity to determine patch correctness. Our approach is evaluated on a dataset consisting of 139 patches generated from existing program repair systems including jGenProg, Nopol, jKali, ACS and HDRepair. Our approach successfully prevented 56.3% of the incorrect patches to be generated, without blocking any correct patches. "
Inferring Hierarchical Motifs from Execution Traces,
Inferring and Asserting Distributed System Invariants," Distributed systems are difficult to debug and understand. A key reason for this is distributed state, which is not easily accessible and must be pieced together from the states of the individual nodes in the system. We propose Dinv, an automatic approach to help developers of distributed systems uncover the runtime distributed state properties of their systems. Dinv uses static and dynamic program analyses to infer relations between variables at different nodes. For example, in a leader election algorithm, Dinv can relate the variable leader at different nodes to derive the invariant ∀ nodes i, j, leader_i = leader_j. This can increase the developer’s confidence in the correctness of their system. The developer can also use Dinv to convert an inferred invariant into a distributed runtime assertion on distributed state. We applied Dinv to several popular distributed systems, such as etcd Raft, Hashicorp Serf, and Taipei-Torrent, which have between 1.7K and 144K LOC and are widely used. Dinv derived useful invariants for these systems, including invariants that capture the correctness of distributed routing strategies, leadership, and key hash distribution. We also used Dinv to assert correctness of the inferred etcd Raft invariants at runtime, using these asserts to detect injected silent bugs.  Link to Publication: http://www.cs.ubc.ca/~bestchai/papers/dinv-icse18.pdf"
Inheritance Usage Patterns in Open-Source Systems," This research investigates how object-oriented inheritance is actually used in practice. The aim is to close the gap between inheritance guidance and inheritance practice. It is based on detailed analyses of 2440 inheritance hierarchies drawn from 14 open-source systems. The original contributions made by this paper concern pragmatic assessment of inheritance hierarchy design quality. The findings show that inheritance is very widely used but that most of the usage patterns that occur in practice are simple in structure. They are so simple that they may not require much inheritance-specific design consideration. On the other hand, the majority of classes defined using inheritance actually appear within a relatively small number of large, complex hierarchies. While some of these large hierarchies appear to have a consistent structure, often based on a problem domain model or a design pattern, others do not. Another contribution is that the quality of hierarchies, especially the large problematic ones, may be assessed in practice based on size, shape, and the definition and invocation of novel methods – all properties that can be detected automatically. "
"Is ""Better Data"" Better Than ""Better Data Miners""?"," We report and fix an important systematic error in prior studies that ranked classifiers for software analytics. Those studies did not (a) assess classifiers on multiple criteria and they did not (b) study how variations in the data affect the results. Hence, this paper applies (a) multi-criteria tests while (b) fixing the weaker regions of the training data (using SMOTUNED, which is a self-tuning version of SMOTE). This approach leads to dramatically large increases in software defect predictions. When applied in a 5*5 cross-validation study for 3,681 JAVA classes (containing over a million lines of code) from open source systems, SMOTUNED increased AUC and recall by 60% and 20% respectively. These improvements are independent of the classifier used to predict for quality. Same kind of pattern (improvement) was observed when a comparative analysis of SMOTE and SMOTUNED was done against the most recent class imbalance technique. In conclusion, for software analytic tasks like defect prediction, (1) data pre-processing can be more important than classifier choice, (2) ranking studies are incomplete without such pre-processing, and (3) SMOTUNED is a promising candidate for pre-processing.  Link to Publication: http://dx.doi.org/10.1145/3180155.3180197"
Large-Scale Analysis of Framework-Specific Exceptions in Android Apps,
Launch-Mode-Aware Context-Sensitive Activity Transition Analysis for Android Apps,
