title,abstract
Leveraging Program Analysis to Reduce User-Perceived Latency in Mobile Applications," Reducing network latency in mobile applications is an effective way of improving the mobile user experience and has tangible economic benefits. This paper presents PALOMA, a novel client-centric technique for reducing the network latency by prefetching HTTP requests in Android apps. Our work leverages string analysis and callback control-flow analysis to automatically instrument apps using PALOMA’s rigorous formulation of scenarios that address “what” and “when” to prefetch. PALOMA has been shown to incur significant runtime savings (several hundred milliseconds per prefetchable HTTP request), both when applied on a reusable evaluation benchmark we have developed and on real applications. "
Multi-Granular Conflict and Dependency Analysis in Software Engineering based on Graph Transformation," Conflict and dependency analysis (CDA) of graph transformation has been shown to be a versatile foundation for understanding interactions in many software engineering domains, including software analysis and design, model-driven engineering, and testing. In this paper, we propose a novel static CDA technique that is multi-granular in the sense that it can detect all conflicts and dependencies on multiple granularity levels. Specifically, we provide an efficient algorithm suite for computing binary, coarse-grained, and fine-grained conflicts and dependencies: Binary granularity indicates the presence or absence of conflicts and dependencies, coarse granularity focuses on root causes for conflicts and dependencies, and fine granularity shows each conflict and dependency in full detail. Doing so, we can address specific performance and usability requirements that we identified in a literature survey of CDA usage scenarios. In an experimental evaluation, our algorithm suite computes conflicts and dependencies rapidly. Finally, we present a user study, in which the participants found our coarse-grained results more understandable than the fine-grained ones reported in a state-of-the-art tool. Our overall contribution is twofold: (i) we significantly speed up the computation of fine-grained and binary CDA results and, (ii) complement them with coarse-grained ones, which offer usability benefits for numerous use cases. "
Multi-Objective Integer Programming Approaches for Solving Optimal Feature Selection Problem," The optimal feature selection problem in software product line is typically addressed by the approaches based on Indicator-based Evolutionary Algorithm (IBEA). In this study, we first expose the mathematical nature of this problem — multi-objective binary integer linear programming. Then, we implement/propose three mathematical programming approaches to solve this problem at diﬀerent scales. For small-scale problems (roughly, less than 100 features), we implement two established approaches to find all exact solutions. For medium-to-large problems (roughly, more than 100 features), we propose one efficient approach that can generate a representation of the entire Pareto front in linear time complexity. The empirical results show that our proposed method can find significantly more non-dominated solutions in similar or less execution time, in comparison with IBEA and its recent enhancement (i.e., IBED that combines IBEA and Diﬀerential Evolution). "
Nemo: Multi-Criteria Test-Suite Minimization with Integer Nonlinear Programming," Multi-criteria test-suite minimization aims to remove redundant test cases from a test suite based on some criteria such as code coverage, while trying to optimally maintain the capability of the reduced suite based on other criteria such as fault-detection effectiveness. Existing techniques addressing this problem with integer linear programming claim to produce optimal solutions. However, the multi-criteria test-suite minimization problem is inherently nonlinear, due to the fact that test cases are often dependent on each other in terms of test-case criteria. In this paper, we propose a framework that formulates the multi-criteria test-suite minimization problem as an integer nonlinear programming problem. To solve this problem optimally, we programmatically transform this nonlinear problem into a linear one and then solve the problem using modern linear solvers. We have implemented our framework as a tool, called Nemo, that supports a number of modern linear and nonlinear solvers. We have evaluated Nemo with a publicly available dataset and minimization problems involving multiple criteria including statement coverage, fault-revealing capability, and test execution time. The experimental results show that Nemo can be used to efficiently find an optimal solution for multi-criteria test-suite minimization problems with modern solvers, and the optimal solutions outperform the suboptimal ones by up to 164.29% in terms of the criteria considered in the problem. "
Neuro-Symbolic Program Repair for Correcting Introductory Programming Assignments,
On The Dichotomy of Debugging Behavior Among Programmers," Debugging is an inevitable activity in most software projects, often difficult and more time-consuming than expected, giving it the nick- name the “dirty little secret of computer science.” Surprisingly, we have little knowledge on how software engineers debug software problems in the real world, whether they use dedicated debugging tools, and how knowledgeable they are about debugging. This study aims to shed light on these aspects by following a mixed-methods research approach. We conduct an online survey capturing how 176 developers reflect on debugging. We augment this subjective survey data with objective observations on how 458 developers use the debugger included in their integrated development environments (IDEs) by instrumenting the popular ECLIPSE and INTELLIJ IDEs with the purpose-built plugin WATCHDOG 2.0. To clarify the in- sights and discrepancies observed in the previous steps, we followed up by conducting interviews with debugging experts and regular de- bugging users. Our results indicate that IDE-provided debuggers are not used as often as expected, as “printf debugging” remains a fea- sible choice for many programmers. Furthermore, both knowledge and use of advanced debugging features are low. These results call to strengthen hands-on debugging experience in computer science curricula and have already refined the implementation of modern IDE debuggers. "
Online App Review Analysis for Identifying Emerging Issues," Detecting emerging issues (e.g., new bugs) timely and precisely is crucial for developers to update their apps. App reviews provide an opportunity to proactively collect user complaints and promptly improve apps’ user experience, in terms of bug fixing and feature refinement. However, the tremendous quantities of reviews and noise words (e.g., misspelled words) increase the difficulties in accurately identifying newly-appearing app issues. In this paper, we propose a novel and automated framework IDEA, which aims to IDentify Emerging App issues effectively based on online review analysis. We evaluate IDEA on six popular apps from Google Play and Apple’s App Store, employing the official app changelogs as our ground truth. Experiment results demonstrate the effectiveness of IDEA in identifying emerging app issues. Feedback from engineers and product managers shows that 88.9% of them think that the identified issues can facilitate app development in practice. Moreover, we have successfully applied IDEA to several products of Tencent, which serve hundreds of millions of users. "
"Open Source barriers to entry, revisited: A tools perspective"," Research has revealed that significant barriers exist when entering Open-Source Software (OSS) communities and that women disproportionately experience such barriers. However, this research has focused mainly on social/cultural factors, ignoring the environment itself — the tools and infrastructure. To shed some light onto how tools and infrastructure might somehow factor into OSS barriers to entry, we conducted a field study with five teams of software professionals, who worked through five use-cases to analyze the tools and infrastructure used in their OSS projects. These software professionals found tool/infrastructure barriers in 7% to 71% of the use-case steps that they analyzed, most of which are tied to newcomer barriers that have been established in the literature. Further, over 80% of the barrier types they found include attributes that are biased against women. "
Perses: Syntax-Guided Program Reduction,
Precise Concolic Unit Testing of C Programs with Alarm Filtering Using Symbolic Calling Contexts,
Prioritizing Browser Environments for Web Application Test Execution,
Program Splicing,
Programming Not Only by Example," Recent years have seen great progress in automated synthesis techniques that can automatically generate code based on some intent expressed by the programmer, but communicating this intent remains a major challenge. When the expressed intent is coarse-grained (for example, restriction on the expected type of an expression), the synthesizer often produces a long list of results for the programmer to choose from, shifting the heavy-lifting to the user. An alternative approach, successfully used in end-user synthesis, is programming by example (PBE), where the user leverages examples to interactively and iteratively refine the intent. However, using only examples is not expressive enough for programmers, who can observe the generated program and refine the intent by directly relating to parts of the generated program. We present a novel approach to interacting with a synthesizer using a granular interaction model. Our approach employs a rich interaction model where (i) the synthesizer decorates a candidate program with debug information that assists in understanding the program and identifying good or bad parts, and (ii) the user is allowed to provide feedback not only on the expected output of a program but also on the program itself. After identifying a program as (partially) correct or incorrect, the user can also explicitly indicate the good or bad parts, to allow the synthesizer to accept or discard parts of the program instead of discarding the program as a whole. We show the value of our approach in a controlled user study. Our study shows that participants have a strong preference for granular feedback instead of examples and can provide granular feedback much faster. "
Propagating Configuration Decisions with Modal Implication Graphs,
RFC-Directed Differential Testing of Certificate Validation in SSL/TLS Implementations," Certificate validation in Secure Socket Layer or Transport Layer Security protocol (SSL/TLS) is critical to Internet security. Thus, it is significant to check whether certificate validation in SSL/TLS is correctly implemented. With this motivation, we propose a novel differential testing approach which is directed by the standard Request For Comments (RFC). First, rules of certificates are extracted automatically from RFCs. Second, low-level test cases are generated through dynamic symbolic execution. Third, high-level test cases, i.e. certificates, are assembled automatically. Finally, with the assembled certificates being test cases, certificate validations in SSL/TLS implementations are tested to reveal latent vulnerabilities or bugs. Our approach named RFCcert has the following advantages: (1) certificates of RFCcert are discrepancy-targeted since they are assembled according to standards instead of genetics; (2) with the obtained certificates, RFCcert not only reveals the invalidity of traditional differential testing but also is able to conduct testing that traditional differential testing cannot do; and (3) the supporting tool of RFCcert has been implemented and extensive experiments show that the approach is effective in finding bugs of SSL/TLS implementations. "
Redefining Prioritization: Continuous Prioritization for Continuous Integration,
Reducer-Based Construction of Conditional Verifiers," Despite recent advances, software verification remains challenging. To solve hard verification tasks, we need to leverage not just one but several different verifiers employing different technologies. To this end, we need to exchange information between verifiers. Conditional model checking was proposed as a solution to exactly this problem: The idea is to let the first verifier output a condition which describes the state space that it successfully verified and to instruct the second verifier to verify the yet unverified state space using this condition. However, most verifiers do not understand conditions as input. In this paper, we propose the usage of an off-the-shelf construction of a conditional verifier from a given traditional verifier and a reducer. The reducer takes as input the program to be verified and the condition, and outputs a residual program whose paths cover the unverified state space described by the condition. As a proof of concept, we designed and implemented one particular reducer and composed three conditional model checkers from the three best verifiers at SV-COMP 2017. We defined a set of claims and experimentally evaluated their validity. All experimental data and results are available for replication. "
Repairing Crashes in Android Apps,
Roles and Impacts of Hands-on Software Architects in Five Industrial Case Studies,
Search-Based Test Data Generation for SQL Queries," Database-centric systems strongly rely on SQL queries to manage and manipulate their data. These SQL commands can range from very simple selections to queries that involve several tables, subqueries, and grouping operations. And, as with any important piece of code, developers should properly test SQL queries. In order to completely test a SQL query, developers need to create test data that exercise all possible coverage targets in a query, e.g., JOINs and WHERE predicates. And indeed, this task can be challenging and time-consuming for complex queries. Previous studies have modeled the problem of generating test data as a constraint satisfaction problem and, with the help of SAT solvers, generate the required data. However, such approaches have strong limitations, such as partial support for queries with JOINs, subqueries, and strings (which are commonly used in SQL queries). In this paper, we model test data generation for SQL queries as a search-based problem. Then, we devise and evaluate three different approaches based on random search, biased random search, and genetic algorithms (GAs). The GA, in particular, uses a fitness function based on information extracted from the physical query plan of a database engine as search guidance. We then evaluate each approach in 2,135 queries extracted from three open source software and one industrial software system. Our results show that GA is able to completely cover 98.6% of all queries in the dataset, requiring only a few seconds for each query. Moreover, it does not suffer from the limitations affecting state-of-the art techniques. "
Secure Coding Practices in Java: Challenges and Vulnerabilities,
Self-Hiding Behavior in Android Apps: Detection and Characterization,
Semantic Program Repair Using a Reference Implementation," Automated program repair has been studied via the use of techniques involving search, semantic analysis and artificial intelligence. Most of these techniques rely on tests as the correctness criteria, which causes the test overfitting problem. Although various approaches such as learning from code corpus have been proposed to address this problem, they are unable to guarantee that the generated patches generalize beyond the given tests. This work studies automated repair of errors using a reference implementation. The reference implementation is symbolically analyzed to automatically infer a specification of the intended behavior. This specification is then used to synthesize a patch that enforces conditional equivalence of the patched and the reference programs. The use of the reference implementation as an implicit correctness criterion alleviates overfitting in test-based repair. Besides, since we generate patches by semantic analysis, the reference program may have a substantially different implementation from the patched program, which distinguishes our approach from existing techniques for regression repair like Relifix. Our experiments in repairing the embedded Linux Busybox with GNU Coreutils as reference (and vice-versa) revealed that the proposed approach scales to real-world programs and enables the generation of more correct patches. "
Sentiment Analysis for Software Engineering: How Far Can We Go?,
Software Protection on the Go: A Large-Scale Empirical Study on Mobile App Obfuscation," The prosperity of smartphone markets has raised new concerns about software security on mobile platforms, leading to a growing demand for effective software obfuscation techniques. Due to various differences between the mobile and desktop ecosystems, obfuscation faces both technical and non-technical challenges when applied to mobile software. Although there have been quite a few software security solution providers launching their mobile app obfuscation services, it is yet unclear how real-world mobile developers perform obfuscation as part of their software engineering practices. Our research takes a first step to systematically studying the deployment of software obfuscation techniques in mobile software development. With the help of an automated but coarse-grained method, we computed the likelihood of an app being obfuscated for over a million app samples crawled from Apple App Store. We then inspected the top 6600 instances and managed to identify 601 obfuscated versions of 539 iOS apps. By analyzing this sample set with extensive manual effort, we made various observations that reveal the status quo of mobile obfuscation in the real world, providing insights into understanding and improving the situation of software protection on mobile platforms. "
Spatio-Temporal Context Reduction: A Pointer-Analysis-Based Static Approach for Detecting Use-After-Free Vulnerabilities,
Speedoo: Prioritizing Performance Optimization Opportunities,
Static Automated Program Repair for Heap Properties," Static analysis tools have demonstrated effectiveness at finding bugs in real world code. Such tools are increasingly widely adopted to improve software quality in practice. Automated Program Repair (APR) has the potential to further cut down on the cost of improving software quality. However, there is a disconnect between these effective bug-finding tools and APR. Recent advances in APR rely on test cases, making them inapplicable to newly discovered bugs or bugs difficult to test for deterministically (like memory leaks). Additionally, the quality of patches generated to satisfy a test suite is a key challenge. We address these challenges by adapting advances in practical static analysis and verification techniques to enable a new technique that finds and then accurately fixes real bugs without test cases. We present a new automated program repair technique using Separation Logic. At a high-level, our technique reasons over semantic effects of existing program fragments to fix faults related to general pointer safety properties: resource leaks, memory leaks, and null dereferences. The procedure automatically translates identified fragments into source-level patches, and verifies patch correctness with respect to reported faults. In this work we conduct the largest study of automatically fixing undiscovered bugs in realworld code to date. We demonstrate our approach by correctly fixing 55 bugs, including 11 previously undiscovered bugs, in 11 real-world projects. "
Statistical Errors in Software Engineering Experiments: A Preliminary Literature Review," Background: Statistical concepts and techniques are often applied incorrectly, even in mature disciplines such as medicine or psychology. Surprisingly, there are very few works that study statistical problems in software engineering (SE). Aim: Assess the existence of statistical errors in SE experiments. Method: Compile the most common statistical errors in experimental disciplines. Survey experiments published in ICSE to assess whether errors occur in high quality SE publications. Results: The same errors as identified in others disciplines were found in ICSE experiments, where 30% of the reviewed papers included several error types such as: a) missing statistical hypotheses, b) missing sample size calculation, c) failure to assess statistical test assumptions, and d) uncorrected multiple testing. This rather large error rate is greater for research papers where experiments are confined to the validation section. The origin of the errors can be traced back to: a) researchers not having sufficient statistical training, and, b) a profusion of exploratory research. Conclusions: This paper provides preliminary evidence that SE research suffers from the same statistical problems as other experimental disciplines. However, the SE community appears to be unaware of any shortcomings in its experiments, whereas other disciplines work hard to avoid these threats. Further research is necessary to find the underlying causes and set up corrective measures, but there are some potentially effective actions and are a priori easy to implement: a) improve the statistical training of SE researchers, and b) enforce quality assessment and reporting guidelines in SE publications. "
Statistical Learning of API Fully Qualified Names in Code Snippets of Online Forums,
Symbolic Verification of Regular Properties," Verifying the regular properties of programs has been a significant challenge. This paper tackles this challenge by presenting symbolic regular verification (SRV) that offers significant speedups over the state-of-the-art. SRV is based on dynamic symbolic execution (DSE) and enabled by novel techniques for mitigating path explosion: (1) a regular property-oriented path slicing algorithm, and (2) a synergistic combination of property-oriented path slicing and guiding. Slicing prunes redundant paths, while guiding boosts the search for counterexamples. We have implemented SRV for Java and evaluated it on 15 real-world open-source Java programs (totaling 259K lines of code). Our evaluation results demonstrate the effectiveness and efficiency of SRV. Compared with the state-of-the-art — pure DSE, pure guiding, and pure path slicing — SRV achieves average speedups of more than 8.4X, 8.6X, and 7X, respectively, making symbolic regular property verification significantly more practical. "
Synthesizing Qualitative Research in Software Engineering: A Critical Review,
Testing Vision-Based Control Systems Using Learnable Evolutionary Algorithms," Vision-based control systems are key enablers of many autonomous vehicular systems, including self-driving cars. Testing such systems is complicated by complex and multidimensional input spaces. We propose an automated testing algorithm that builds on learnable evolutionary algorithms. These algorithms rely on machine learning or a combination of machine learning and Darwinian genetic operators to guide the generation of new solutions (test scenarios in our context). Our approach combines multiobjective population-based search algorithms and decision tree classification models to achieve the following goals: First, classification models guide the search-based generation of tests faster towards critical test scenarios (i.e., test scenarios leading to failures). Second, search algorithms refine classification models so that the models can accurately characterize critical regions (i.e., the regions of a test input space that are likely to contain most critical test scenarios). Our evaluation performed on an industrial automotive automotive system shows that: (1) Our algorithm outperforms a baseline evolutionary search algorithm and generates 78% more distinct, critical test scenarios compared to the baseline algorithm. (2) Our algorithm accurately characterizes critical regions of the system under test, thus identifying the conditions that are likely to lead to system failures. "
The Evolution of Requirements Practices in Software Startups," We use Grounded Theory to study the evolution of requirements practices of 16 software startups as they grow and introduce new products and services. These startups operate in a dynamic environment, with significant time and market pressure, and rarely have time for systematic requirements analysis. Our theory describes the evolution of practice along six dimensions that emerged as relevant to their requirements activities: requirements artefacts, knowledge management, requirements-related roles, planning, technical debt and product quality. Beyond the relationships among the dimensions, our theory also explains the turning points that drove the evolution along these dimensions. These changes are reactive, rather than planned, suggesting an overall pragmatic lightness, i.e., flexibility, in the startups’ evolution towards engineering practices for requirements. Our theory organises knowledge about evolving requirements practice in maturing startups, and provides practical insights for startups’ assessing their own evolution as they face challenges to their growth. Our research also suggests that a startup’s evolution along the six dimensions is not fundamental to its success, but has significant effects on their product, their employees and the company. "
The Road to Live Programming: Insights From the Practice,
