title,abstract
Time to Clean your Test Objectives," Testing is the primary approach for detecting software defects. A major challenge faced by testers lies in crafting efficient test suites, able to detect a maximum number of bugs with manageable effort. To do so, they rely on coverage criteria, which define some precise test objectives to be covered. However, many common criteria specify a significant number of objectives that occur to be infeasible or redundant in practice, like covering dead code or semantically equal mutants. Such objectives are well-known to be harmful to the design of test suites, impacting both the efficiency and precision of the tester’s effort. This work introduces a sound and scalable technique to prune out a significant part of the infeasible and redundant objectives produced by a panel of white-box criteria. In a nutshell, we reduce this task to proving the validity of logical assertions in the code under test. The technique is implemented in a tool that relies on weakest-precondition calculus and SMT solving for proving the assertions. The tool is built on top of the Frama-C verification platform, which we carefully tune for our specific scalability needs. The experiments reveal that the pruning capabilities of the tool can reduce the number of targeted test objectives in a program by up to 27% and scale to real programs of 200K lines, making it possible to automate a painstaking part of their current testing process.  Link to Publication: http://www.marcozzi.net"
To Distribute or Not to Distribute? Why Licensing Bugs Matter,
To Preserve or Not to Preserve Invalid Solutions in Search-Based Software Engineering: A Case Study in Software Product Lines,
Towards Optimal Concolic Testing," Concolic testing integrates concrete execution (e.g., random testing) and symbolic execution for test case generation. It is shown to be more cost-effective than random testing or symbolic execution sometimes. A concolic testing strategy is a function which decides when to apply random testing or symbolic execution, and if it is the latter case, which program path to symbolically execute. Many heuristics-based strategies have been proposed. It is still an open problem what is the optimal concolic testing strategy. In this work, we make two contributions towards solving this problem. First, we show the optimal strategy can be defined based on the probability of program paths and the cost of constraint solving. The problem of identifying the optimal strategy is then reduced to a model checking problem of Markov Decision Processes with Costs. Secondly, in view of the complexity in identifying the optimal strategy, we design a greedy algorithm for approximating the optimal strategy. We conduct two sets of experiments. One is based on randomly generated models and the other is based on a set of C programs. The results show that existing heuristics have much room to improve and our greedy algorithm often outperforms existing heuristics. "
Towards Practical Program Repair with On-Demand Candidate Generation,
Towards Refactoring-Aware Regression Test Selection,
Traceability in the Wild: Automatically Augmenting Incomplete Trace links," Software and systems traceability is widely accepted as an essential element for supporting many software development tasks. Today’s version control systems provide inbuilt features that allow developers to tag each commit with one or more issue ID, thereby providing the building blocks from which project-wide traceability can be established between feature requests, bug fixes, commits, source code, and specific developers. However, our analysis of six open source projects showed that on average only 60% of the commits were linked to specific issues. Without these fundamental links the entire set of project-wide links will be incomplete, and therefore not trustworthy. In this paper we address the fundamental problem of missing links between commits and issues. Our approach leverages a combination of process and text-related features characterizing issues and code changes to train a classifier to identify missing issue tags in commit messages, thereby generating the missing links. We conducted a series of experiments to evaluate our approach against six open source projects and showed that it was able to effectively recommend links for tagging issues at an average of 96% recall and 33% precision. In a related task for augmenting a set of existing trace links, the classifier returned precision at levels greater than 89% in all projects and recall of 50%. "
UFO: Predictive Concurrency Use-After-Free Detection,"  Jeff Huang is currently an Assistant Professor in the Department of Computer Science and Engineering at Texas A&M University. His research focuses on developing techniques and tools for improving software performance and reliability based on fundamental program analyses and programming language theory. His research has won awards including ACM SIGSOFT Outstanding Dissertation Award, SIGPLAN PLDI Distinguished Paper Award, SIGPLAN Research Highlights, Google Faculty Research Award, and NSF CAREER Award."
Understanding Developers’ Needs on Deprecation as a Language Feature," Deprecation is a language feature that allows API producers to mark a feature as obsolete. We aim to gain a deep understanding of the needs of API producers and consumers alike regarding deprecation. To that end, we investigate why API producers deprecate features, whether they remove deprecated features, how they expect consumers to react, and what prompts an API consumer to react to deprecation. To achieve this goal we conduct semi-structured interviews with 17 third-party Java API producers and survey 170 Java developers. We observe that the current deprecation mechanism in Java and the proposal to enhance it does not address all the needs of a developer. This leads us to propose and evaluate three further enhancements to the deprecation mechanism. "
When Not to Comment: Questions and Tradeoffs with API Documentation for C++ Projects,
When Testing Meets Code Review: Why and How Developers Review Tests," Automated testing is considered an essential process for ensuring software quality. However, writing and maintaining high-quality test code is challenging and frequently considered of secondary importance. For production code, many open source and industrial software projects employ code review, a well-established software quality practice, but the question remains whether and how code review is also used for ensuring the quality of test code. The aim of this research is to answer this question and to increase our understanding of what developers think and do when it comes to reviewing test code. We conducted both quantitative and qualitative methods to analyze more than 300,000 code reviews, and interviewed 12 developers about how they review test files. This work resulted in an overview of current code reviewing practices, a set of identified obstacles limiting the review of test code, and a set of issues that developers would like to see improved in code review tools. The study reveals that reviewing test files is very different from reviewing production files, and that the navigation within the review itself is one of the main issues developers currently face. Based on our findings, we propose a series of recommendations and suggestions for the design of tools and future research. "
