title,abstract
"""Was my contribution fairly reviewed?"" A framework and an empirical study of fairness in Modern Code Reviews"," Modern code reviews improve the quality of software products. Although modern code reviews rely heavily on human interactions, little is known regarding whether they are performed fairly. Fairness plays a role in any process where decisions that affect others are made. When a system is perceived to be unfair, it affects negatively the productivity and motivation of its participants. In this paper, using fairness theory we create a framework that describes how fairness affects modern code reviews. To demonstrate its applicability, and the importance of fairness in code reviews, we conducted an empirical study that asked developers of a large industrial open source ecosystem (OpenStack) what their perceptions are regarding fairness in their code reviewing process. Our study shows that, in general, the code review process in OpenStack is perceived as fair; however, a significant portion of respondents perceive it as unfair. We also show that the variability in the way they prioritize code reviews signals a lack of consistency and the existence of bias (potentially increasing the perception of unfairness). The contributions of this paper are: we propose a framework—based on fairness theory—for studying and managing social behaviour in modern code reviews, we provide support for the framework through the results of a case study on a large industrial-backed open source project, we present evidence that fairness is an issue in the code review process of a large open source ecosystem, and, we present a set of guidelines for practitioners to address unfairness in modern code reviews. "
A Combinatorial Approach for Exposing Off-Nominal Behaviors,
A Graph Solver for the Automated Generation of Consistent Domain-Specific Models,
A Large-Scale Empirical Study on the Effects of Code Obfuscations on Android Apps and Anti-Malware Products," The Android platform has been the dominant mobile platform in recent years resulting in millions of apps and security threats against those apps. Anti-malware products aim to protect smartphone users from these threats, especially from malicious apps. However, malware authors use code obfuscation on their apps to evade detection by anti-malware products. To assess the effects of code obfuscation on Android apps and anti-malware products, we have conducted a large-scale empirical study that evaluates the effectiveness of the top anti-malware products against various obfuscation tools and strategies. To that end, we have obfuscated 3,000 benign apps and 3,000 malicious apps and generated 73,362 obfuscated apps using 29 obfuscation strategies from 7 open-source, academic, and commercial obfuscation tools. The findings of our study indicate that (1) code obfuscation significantly impacts Android anti-malware products; (2) the majority of anti-malware products are severely impacted by even trivial obfuscations; (3) in general, combined obfuscation strategies do not successfully evade anti-malware products more than individual strategies; (4) the detection of anti-malware products depend not only on the applied obfuscation strategy but also on the leveraged obfuscation tool; (5) anti-malware products are slow to adopt signatures of malicious apps; and (6) code obfuscation often results in changes to an app’s semantic behaviors. "
A Static Verification Framework for Message Passing in Go using Behavioural Types," The Go programming language has been heavily adopted in industry as a language that efficiently combines systems programming with concurrency. Go’s concurrency primitives, inspired by process calculi such as CCS and CSP, feature channel-based communication and lightweight threads, providing a distinct means of structuring concurrent software. Despite its popularity, the Go programming ecosystem offers little to no support for guaranteeing the correctness of message-passing concurrent programs. This work proposes a practical verification framework for message passing concurrency in Go by developing a robust static analysis that infers an abstract model of a program’s communication behaviour in the form of a behavioural type, a powerful process calculi typing discipline. We make use of our analysis to deploy a model and termination checking based verification of the inferred behavioural type that is suitable for a range of safety and liveness properties of Go programs, providing several improvements over existing approaches. We evaluate our framework and its implementation on publicly available real-world Go code. "
A Temporal Permission Analysis and Enforcement Framework for Android,
Accurate and Efficient Refactoring Detection in Commit History," Refactoring detection algorithms have been crucial to a variety of applications: (i) empirical studies about the evolution of code, tests, and faults, (ii) tools for library API migration, (iii) improving the comprehension of changes and code reviews, etc. However, recent research has questioned the accuracy of the state-of-the-art refactoring detection tools, which poses threats to the reliability of their application. Moreover, previous refactoring detection tools are very sensitive to user-provided similarity thresholds, which further reduces their practical accuracy. In addition, their requirement to build the project versions/revisions under analysis makes them inapplicable in many real-world scenarios. To reinvigorate a previously fruitful line of research that has stifled, we designed, implemented, and evaluated RMiner, a technique that overcomes the above limitations. At the heart of RMiner is an AST-based statement matching algorithm that determines refactoring candidates without requiring user-defined thresholds. To empirically evaluate RMiner, we created the most comprehensive oracle to date that uses triangulation to create a dataset with considerably reduced bias, representing 3,188 refactorings from 185 open-source projects. Using this oracle, we found that RMiner has a precision of 98% and recall of 87%, which is a significant improvement over the previous state-of-the-art. "
Adding Sparkle to Social Coding: An Empirical Study of Repository Badges in the npm Ecosystem," In fast-paced, reuse-heavy, and distributed software development, the transparency provided by social coding platforms like GitHub is essential to decision making. Developers infer the quality of projects using visible cues, known as signals, collected from personal profile and repository pages. We report on a large-scale, mixed-methods empirical study of npm packages that explores the emerging phenomenon of repository badges, with which maintainers signal underlying qualities about their projects to contributors and users. We investigate which qualities maintainers intend to signal and how well badges correlate with those qualities. After surveying developers, mining 294,941 repositories, and applying statistical modeling and time-series analyses, we find that non-trivial badges, which display the build status, test coverage, and up-to-dateness of dependencies, are mostly reliable signals, correlating with more tests, better pull requests, and fresher dependencies. Displaying such badges correlates with best practices, but the effects do not always persist. "
Almost There: A Study on Quasi-Contributors in Open-Source Software Projects," Recent studies suggest that well-known OSS projects struggle to find the needed workforce to continue evolving—in part because external developers fail to overcome their first contribution barriers. In this paper, we investigate how and why quasi-contributors (external developers who did not succeed in getting their contributions accepted to an OSS project) fail. To achieve our goal, we collected data from 21 popular, non-trivial GitHub projects, identified quasi-contributors, and analyzed their pull-requests. In addition, we conducted surveys with quasi-contributors, and projects’ integrators, to understand their perceptions about nonacceptance. We found 10,099 quasi-contributors — about 70% of the total actual contributors — that submitted 12,367 nonaccepted pull-requests. In five projects, we found more quasi-contributors than actual contributors. About one-third of the developers who took our survey disagreed with the nonacceptance, and around 30% declared the nonacceptance demotivated or prevented them from placing another pull-request. The main reasons for pull-request nonacceptance from the quasi-contributors’ perspective were “superseded/duplicated pull-request” and “mismatch between developer’s and team’s vision/opinion.” A manual analysis of a representative sample of 263 pull-requests corroborated with this finding. We also found reasons related to the relationship with the community and lack of experience or commitment from the quasi-contributors. This empirical study is particularly relevant to those interested in fostering developers’ participation and retention in OSS communities. "
Are Code Examples on an Online Q&A Forum Reliable? A Study of API Misuse on Stack Overflow," Programmers often consult an online Q&A forum such as Stack Over ow to learn new APIs. This paper presents an empirical study on the prevalence and severity of API misuse on Stack Over ow. To reduce manual assessment e ort, we design ExampleCheck, an API usage mining framework that extracts patterns from over 380K Java repositories on GitHub and subsequently reports potential API usage violations in Stack Over ow posts. We analyze 217,818 Stack Over ow posts using ExampleCheck and nd that 31% may have potential API usage violations that could produce unexpected behavior such as program crashes and resource leaks. Such API misuse is caused by three main reasons—missing control constructs, missing or incorrect order of API calls, and incorrect guard conditions. Even the posts that are accepted as correct answers or upvoted by other programmers are not necessarily more reliable than other posts in terms of API misuse. This study result calls for a new approach to augment Stack Over ow with alternative API usage details that are not typically shown in curated examples. "
Are Mutation Scores Correlated with Real Fault Detection? A Large Scale Empirical study on the Relationship Between Mutants and Real Faults," Empirical validation of software testing studies is increasingly relying on mutants. This practice is motivated by the strong correlation between mutant scores and real fault detection that is reported in the literature. In contrast, our study shows that correlations are the results of the confounding effects of the test suite size. In particular, we investigate the relation between two independent variables, mutation score and test suite size, with one dependent variable the detection of (real) faults. We use two data sets, CoreBench and Defects4J, with large C and Java programs and real faults and provide evidence that all correlations between mutation scores and real fault detection are weak when controlling for test suite size. We also find that both independent variables significantly influence the dependent one, with significantly better fits, but overall with relative low prediction power. By measuring the fault detection capability of the top ranked, according to mutation score, test suites (opposed to randomly selected test suites of the same size), we find that achieving higher mutation scores improves significantly the fault detection. Taken together, our data suggest that mutants provide good guidance for improving the fault detection of test suites, but their correlation with fault detection are weak. "
Assessing the Threat of Untracked Changes in Software Evolution,
Augusto: Exploiting Popular Functionalities for the Generation of Semantic GUI Tests with Oracles," Testing software applications by interacting with their graphical user interface (GUI) is an expensive and complex process. Current automatic test case generation techniques implement explorative approaches that, although producing useful test cases, have a limited capability of covering semantically relevant interactions, thus frequently missing important testing scenarios. These techniques typically interact with the available widgets following the structure of the GUI, without any guess about the functions that are executed. In this paper we propose Augusto, a test case generation technique that exploits a built-in knowledge of the semantics associated with popular and well-known functionalities, such as CRUD operations, to automatically generate effective test cases with automated functional oracles. Empirical results indicate that Augusto can reveal faults that cannot be revealed with state of the art techniques. "
Automated Localization for Unreproducible Builds,
Automated Repair of Mobile Friendly Problems in Web Pages,
Automated Reporting of GUI Design Violations for Mobile Apps,
Automatically Finding Bugs in Cyber-Physical System Development Tool Chains With Slforge, Source code & data: https://github.com/verivital/slsf_randgen/wiki 
Automatically Generating Search Heuristics for Concolic Testing," We present a technique to automatically generate search heuristics for concolic testing. A key challenge in concolic testing is how to effectively explore the program’s execution paths to achieve high code coverage in a limited time budget. Concolic testing employs a search heuristic to address this challenge, which favors exploring particular types of paths that are most likely to maximize the final coverage. However, manually designing a good search heuristic is nontrivial and typically ends up with suboptimal and unstable outcomes. The goal of this paper is to overcome this shortcoming of concolic testing by automatically generating search heuristics. We define a class of search heuristics, namely a parameterized heuristic, and present an algorithm that efficiently finds an optimal heuristic for each subject program. Experimental results with open-source C programs show that our technique successfully generates search heuristics that significantly outperform existing manually-crafted heuristics in terms of branch coverage and bug-finding. "
CCAligner: a token based large-gap clone detector,
Chopped Symbolic Execution," Symbolic execution is a powerful program analysis technique that systematically explores multiple program paths. However, despite important technical advances, symbolic execution often struggles to reach deep parts of the code due to the well-known path explosion problem and constraint solving limitations. In this paper, we propose chopped symbolic execution, a novel form of symbolic execution that allows users to specify uninteresting parts of the code to exclude during the analysis, thus only targeting the exploration to paths of importance. However, the excluded parts are not summarily ignored, as this may lead to both false positives and false negatives. Instead, they are executed lazily, when their effect may be observable by code under analysis. Chopped symbolic execution leverages various on-demand static analyses at runtime to automatically exclude code fragments while resolving their side effects, thus avoiding expensive manual annotations and imprecision. Our preliminary results show that the approach can effectively improve the effectiveness of symbolic execution in several different scenarios, including failure reproduction and test suite augmentation.  Link to Publication: https://www.cs.tau.ac.il/~maon/pubs/2018-icse.pdf"
Collective Program Analysis," Popularity of data-driven software engineering has led to an increasing demand on the infrastructures to support efficient execution of tasks that require deeper source code analysis. While task optimization and parallelization are the adopted solutions, other research directions are less explored. We present collective program analysis (CPA), a technique for scaling large scale source code analysis by leveraging analysis specific similarity. Analysis specific similarity is about, whether two or more programs can be considered similar for a given analysis. The key idea of collective program analysis is to cluster programs based on analysis specific similarity, such that running the analysis on one candidate in each cluster is sufficient to produce the result for others. For determining the analysis specific similarity and for clustering analysis-equivalent programs, we use a sparse representation and a canonical labeling scheme. A sparse representation contains only the parts that are relevant for the analysis and the canonical labeling helps with finding isomorphic sparse representations. In a nutshell, two or more programs with same sparse representation must behave similarly for the given analysis. Our evaluation shows that for a variety of source code analysis tasks when run on a large dataset of programs, our technique is able to achieve substantial reduction in the analysis times; on average 69% when compared to baseline and on average 36% when compared to a prior technique. We also show that there exists a large amount of analysis-equivalent programs in large datasets for variety of analysis. "
ConflictJS: Finding and Understanding Conflicts Between JavaScript Libraries," It is a common practice for client-side web applications to build on various third-party JavaScript libraries. Due to the lack of namespaces in JavaScript, these libraries all share the same global namespace. As a result, one library may inadvertently modify or even delete the APIs of another library, causing unexpected behavior of library clients. Given the quickly increasing number of libraries, manually keeping track of such conflicts is practically impossible both for library developers and users. This paper presents ConflictJS, an automated and scalable approach to analyze libraries for conflicts. The key idea is to tackle the huge search space of possible conflicts in two phases. At first, a dynamic analysis of individual libraries identifies pairs of potentially conflicting libraries. Then, targeted test synthesis validates potential conflicts by creating a client application that suffers from a conflict. The overall approach is free of false positives, in the sense that it reports a problem only when such a client exists. We use ConflictJS to analyze and study conflicts among 951 real-world libraries. The results show that one out of four libraries is potentially conflicting and that 166 libraries are involved in at least one certain conflict. The detected conflicts cause crashes and other kinds of unexpected behavior. Our work helps library developers to prevent conflicts, library users to avoid combining conflicting libraries, and provides evidence that designing a language without explicit namespaces has undesirable effects. "
Context-Aware Conversational Developer Assistants," Building and maintaining modern software systems requires developers to perform a variety of tasks that span various tools and information sources. The crosscutting nature of these development tasks requires developers to maintain complex mental models and forces them (a) to manually split their high-level tasks into low-level commands that are supported by the various tools, and (b) to (re)establish their current context in each tool. In this paper we present Devy, a Conversational Developer Assistant (CDA) that enables developers to focus on their high-level development tasks. Devy reduces the number of manual, often complex, low-level commands that developers need to perform, freeing them to focus on their high-level tasks. Specifically, Devy infers high-level intent from developer’s voice commands and combines this with an automatically-generated context model to determine appropriate workflows for invoking lowlevel tool actions; where needed, Devy can also prompt the developer for additional information. Through a mixed methods evaluation with 21 industrial developers, we found that Devy provided an intuitive interface that was able to support many development tasks while helping developers stay focused within their development environment. While industrial developers were largely supportive of the automation Devy enabled, they also provided insights into several other tasks and workflows CDAs could support to enable them to better focus on the important parts of their development tasks. "
Context-Aware Patch Generation for Better Automated Program Repair," Because of its potential impacts, search-based automated program repair has received great attention in the research community. However, its effectiveness is limited in the number of correct patches that can be successfully generated. There are two causes of such limitation. First, the search space does not contain the correct patch. Second, the search space is huge and therefore the correct patch cannot be generated (\ie correct patches are either generated after incorrect plausible ones or not generated within the time budget). To increase the likelihood of including correct patches in the search space, we propose to work at a fine granularity in terms of AST nodes. This, however, will further enlarge the search space, increasing the challenge to find the correct patches. We address the challenge by devising a strategy to prioritize the candidate patches based on their likelihood of being correct. Specifically, we study the use of AST nodes’ context information to estimate the likelihood. In this paper, we propose \textsc{CapGen}, a context-aware patch generation technique. The novelty which allows \textsc{CapGen} to produce more correct patches lies in three aspects: (1) The fine-granularity design enables it to find more correct fixing ingredients; (2) The context-aware prioritization of mutation operators enables it to constrain the search space; (3) Three context-aware models enable it to rank correct patches at high positions before incorrect plausible ones. We evaluate \textsc{CapGen} on \textsc{Defects4J} and compare it with the state-of-the-art program repair techniques. Our evaluation shows that \textsc{CapGen} outperforms and complements existing techniques. \textsc{CapGen} achieves a high precision of $84.00%$ and can prioritize the correct patches before $98.78%$ of the incorrect plausible ones. "
Dataflow Tunneling: Mining Inter-request Data Dependencies for Request-based Applications," Request-based applications, e.g., most server-side applications, expose services to users in a request-based paradigm, in which requests are served by request-handler methods. An important task for request-based applications is inter-request analysis, which analyzes request-handler methods that are related by inter-request data dependencies together. However, in the request-based paradigm, data dependencies between related request-handler methods are implicitly established by the underlying frameworks that execute these methods. As a result, existing analysis tools are usually limited to the scope of each single method without the knowledge of dependencies between different methods. In this paper, we design an approach called dataflow tunneling to capture inter-request data dependencies from concrete application executions and produce data-dependency specifications. Our approach answers two key questions: (1) what request-handler methods have data dependencies and (2) what these data dependencies are. Our evaluation using applications developed with two representative and popular frameworks shows that our approach is general and accurate. We also present a characteristic study and a use case of cache tuning based on the mined specifications. We envision that our approach can provide key information to enable future inter-request analysis techniques. "
DeFlaker: Automatically Detecting Flaky Tests," Developers often run tests to check that their latest changes to a code repository did not break any previously working functionality. Ideally, any new test failures would indicate regressions caused by the latest changes. However, some test failures may not be due to the latest changes but due to non-determinism in the tests, popularly called flaky tests. The typical way to detect flaky tests is to rerun failing tests repeatedly. Unfortunately, rerunning failing tests can be costly and can slow down the development cycle. We present the first extensive evaluation of rerunning failing tests and propose a new technique, called DeFlaker, that detects if a test failure is due to a flaky test without rerunning and with very low runtime overhead. DeFlaker monitors the coverage of latest code changes and marks as flaky any newly failing test that did not execute any of the changes. We deployed DeFlaker live, in the build process of 96 Java projects on TravisCI, and found 87 previously unknown flaky tests in 10 of these projects. We also ran experiments on project histories, where DeFlaker detected 1,874 flaky tests from 4,846 failures, with a low false alarm rate (1.5%). DeFlaker had a higher recall (95.5% vs. 23%) of confirmed flaky tests than Maven’s default flaky test detector. "
Debugging Data Flows in Reactive Programs,
Debugging with Intelligence via Probabilistic Inference,
Deep Code Search,
DeepTest: Automated Testing of Deep-Neural-Network-driven Autonomous Cars,
DetReduce: Minimizing Android GUI Test Suites for Regression Testing,
