title,abstract
Traceability Support for Multi-Lingual Software ProjectsACM SIGSOFT Distinguished Paper AwardMSR - Technical Paper,"Software traceability establishes associations between diverse soft-ware artifacts such as requirements, design, code, and test cases. Due to the non-trivial costs of manually creating and maintaining links,many researchers have proposed automated approaches based on information retrieval techniques. However, many globally distributed software projects produce software artifacts written in two or more languages. The use of intermingled languages reduces the efficacy of automated tracing solutions. In this paper, we first analyze and dis-cuss patterns of intermingled language use across multiple projects,and then evaluate several different tracing algorithms including the Vector Space Model (VSM), Latent Semantic Indexing (LSI), Latent Direchlet Allocation (LDA), and various models that combine mono-and cross-lingual word embeddings with the Generative Vector Space Model (GVSM). Based on an analysis of 14 Chinese-English projects, our results show that best performance is achieved using mono-lingual word embeddings integrated into GVSM with machine translation as a preprocessing step."
Using Large-Scale Anomaly Detection on Code to Improve Kotlin CompilerMSR - Technical Paper,"In this work we apply anomaly detection to source code and bytecode to facilitate development of a programming language and its compiler. We define anomaly as a code fragment that is different from typical code written in a particular programming language. Identifying such code fragments is beneficial to both language developers and end users, since anomalies may indicate potential issues with the compiler or with runtime performance. Moreover, anomalies could correspond to problems in language design. For this study, we choose Kotlin as the target programming language. We outline and discuss approaches to obtaining vector representations of source code and bytecode and to detection of anomalies across vectorized code snippets. The paper presents a method that aims to detect two types of anomalies: syntax tree anomalies and so-called compiler-induced anomalies that arise only in the compiled bytecode. We describe several experiments that employ different combinations of vectorizaton and anomaly detection techniques, and discuss types of detected anomalies and their usefulness for language developers. We demonstrate that the extracted anomalies and the underlying extraction technique provide additional value for language development."
Using Others' Tests to Avoid Breaking UpdatesMSR - Technical Paper,"The reuse of third-party packages has become a common practice in contemporary software development. Software dependencies are constantly evolving with newly added features and patches that fix bugs in older versions. However, updating dependencies could introduce new bugs or break backward compatibility. In this work, we propose a technique to detect breakage-inducing versions of third-party dependencies. The key insight behind our approach is to leverage the automated test suites of other projects that depend upon the same dependency to test newly released versions. We conjecture that this crowd-based approach will help to detect breakage-inducing versions because it broadens the set of realistic usage scenarios to which a package version has been exposed. To evaluate our conjecture, we perform an empirical study of 391,553 npm packages. We use the dependency network from these packages to identify candidate tests of third-party packages. Moreover, to evaluate our proposed technique, we mine the history of this dependency network to identify ten breakage-inducing versions. We find that our proposed technique can detect six of the ten studied breakage-inducing versions. Our findings can help developers to make more informed decisions when they update their dependencies."
Visualization of Methods Changeability Based on VCS DataMSR - Technical Paper,"Software engineers have a wide variety of tools and techniques that can help them improve the quality of their code, but still, a lot of bugs remain undetected. In this paper we build on the idea that if a particular fragment of code is changed too often, it could be caused by some technical or architectural issues, therefore, this fragment requires additional attention from developers. Most teams nowadays use version control systems to track changes in their code and organize cooperation between developers. We propose to use data from version control systems to track the number of changes for each method in a project for a selected time period and display this information within the IDE’s code editor. The paper describes such a tool built as a plugin for IntelliJ IDEA."
"What constitutes Software? An Empirical, Descriptive Study of ArtifactsMSR - Technical Paper","The term software is ubiquitous, however, it does not seem as if we as a community have a clear understanding of what software actually is. Imprecise definitions of software do not help other professions, in particular those acquiring and sourcing software from third-parties, when deciding what precisely are potential deliverables. In this paper we investigate which artifacts constitute software by analyzing 23 715 repositories from Github, we categorize the found artifacts into high-level categories, such as, code, data, and documentation (and into 19 more concrete categories) and we can confirm the notion of others that software is more than just source code or programs, for which the term is often used synonymously. With this work we provide an empirical study of more than 13 million artifacts, we provide a taxonomy of artifact categories, and we can conclude that software most often consists of variously distributed amounts of code in different forms, such as, source code, binary code, scripts, etc., data, such as, configuration files, images, databases, etc., and documentation, such as user documentation, licenses, etc."
What is the Vocabulary of Flaky Tests?MSR - Technical Paper,"Flaky tests are tests whose outcomes are non-deterministic. Despite the recent research activity on this topic, no effort has been made on understanding the vocabulary of flaky tests (e.g., networking or concurrency identifiers). This work proposes to automatically classify tests as flaky or not. Classification of flaky tests is important,for example, to detect the introduction of flaky test and to search for flaky tests after they are introduced in test suites. We evaluated performance of various machine learning algorithms to solve this problem. We constructed a dataset of flaky and non-flaky tests by running more than 50k test cases, 100 times each. We then used machine learning techniques on the resulting data set to predict which tests are flaky from their source. Based on features, such as counting stemmed tokens extracted from source code identifiers, we achieved an F-measure of 0.95 for the identification of flaky tests. The best performance was achieved when using Random Forest and Support Vector Machines for the prediction. In terms of the code identifiers that are most strongly associated with test flakiness, we noted that job, action, and services are commonly associated with flaky tests."
