title,abstract
The Android Update Problem: An Empirical Study," Many phone vendors use Android as their underlying OS, but often extend it to add new functionality and to make it compatible with their specific phones. When a new version of Android is released, phone vendors need to merge or re-apply their customizations and changes to the new release. This is a difficult and time-consuming process, which often leads to late adoption of new versions. In this paper, we perform an empirical study to understand the nature of changes that phone vendors make, versus changes made in the original development of Android. By investigating the overlap of different changes, we also determine the possibility of having automated support for merging them. We develop a publicly available tool chain, based on a combination of existing tools, to study such changes and their overlap. As a proxy case study, we analyze the changes in the popular community-based variant of Android, LineageOS, and its corresponding Android versions. We investigate and report the common types of changes that occur in practice. Our findings show that 83% of subsystems modified by LineageOS are also modified in the next release of Android. By taking the nature of overlapping changes into account, we assess the feasibility of having automated tool support to help phone vendors with the Android update problem. Our results show that 56% of the changes in LineageOS have the potential to be safely automated. "
The Open-Closed Principle of Modern Machine Learning Frameworks,
The Patch-Flow Method for Measuring Inner Source Collaboration," Inner source (IS) is the use of open source software development (SD) practices and the establishment of an open source-like culture within an organization. IS enables and requires developers to collaborate more than traditional SD methods such as plan-driven or agile development. To better understand IS, researchers and practitioners need to measure IS collaboration. However, there is no method yet for doing so. In this paper, we present a method for measuring IS collaboration by measuring the patch-flow within an organization. Patch-flow is the flow of code contributions across organizational boundaries such as project, organizational unit, or profit center boundaries. We evaluate our patch-flow measurement method using case study research with a software developing multi-industry company. By applying the method in the case organization, we evaluate its relevance and viability and discuss its usefulness. We found that about half (47.9%) of all code contributions constitute patch-flow between organizational units, almost all (42.2%) being between organizational units working on different products. Such significant patch-flow indicates high relevance of the patch-flow phenomenon and hence the method presented in this paper. Our patch-flow measurement method is the first of its kind to measure and quantify IS collaboration. It can serve as a base for further quantitative analyses of IS collaboration. "
Toward Predicting Architectural Significance of Implementation Issues,
Towards Extracting Web API Specifications from Documentation,
Towards Identifying Paid Open Source Developers - A Case Study with Mozilla Developers,
"Understanding the Usage, Impact, and Adoption of Non-OSI Approved Licenses"," The software license is one of the most important non-executable pieces of any software system. However, due to its non-technical nature, developers often misuse or misunderstand software licenses. Although previous studies reported problems related to licenses clashes and inconsistencies, in this paper we shed the light on an important but yet overlooked issue: the use of non-approved open-source licenses. Such licenses claim to be open-source, but have not been formally approved by the Open Source Initiative (OSI). When a developer releases a software under a non-approved license, even if the interest is to make it open-source, the original author might not be granting the rights required by those who use the software. To uncover the reasons behind the use of non- approved licenses, we conducted a mix-method study, mining data from 657K open-source projects and their 4,367K versions, and surveying 76 developers that published some of these projects. Although 1,058,554 of the project versions employ at least one non-approved license, non-approved licenses account for 21.51% of license usage. We also observed that it is not uncommon for developers to change from a non-approved to an approved license. When asked, some developers mentioned that this transition was due to a better understanding of the disadvantages of using an non- approved license. This perspective is particularly important since developers often rely on package managers to easily and quickly get their dependencies working "
Was Self-Admitted Technical Debt Removal a Real Removal? An In-Depth Perspective," Technical Debt (TD) has been defined as “code being not quite right yet”, and its presence is often self-admitted by developers through comments. The purpose of such comments is to keep track of TD and appropriately address it when possible. Building on a previous quantitative investigation by Maldonado et al. on the removal of self-admitted technical debt (SATD), in this paper we perform an in-depth quantitative and qualitative study of how SATD is addressed in five Java open source projects. On the one hand, we look at whether SATD is “accidentally” removed, and the extent to which the SATD removal is being documented. We found that that (i) between 20% and 50% of SATD comments are accidentally removed while entire classes or methods are dropped, (ii) 8% of the SATD removal is acknowledged in commit messages, and (iii) while most of the changes addressing SATD require complex source code changes, very often SATD is addressed by specific changes to method calls or conditionals. Our results can be used to better plan TD management or learn patterns for addressing certain kinds of TD and provide recommendations to developers. "
What Did Really Change with the new Release of the App?,
What are your Programming Language’s Energy-Delay Implications?," Motivation: Even though many studies examine the energy efficiency of hardware and embedded systems, those that investigate the energy consumption of software applications are still limited, and mostly focused on mobile applications. As modern applications become even more complex and heterogeneous a need arises for methods that can accurately assess their energy consumption. Goal: Measure the energy consumption and run-time performance of commonly used programming tasks implemented in different programming languages and executed on a variety of platforms to help developers to choose appropriate implementation platforms. Method: Obtain measurements to calculate the Energy Delay Product, a weighted function that takes into account a task’s energy consumption and run-time performance. We perform our tests by calculating the Energy Delay Product of 25 programming tasks, found in the Rosetta Code Repository, which are implemented in 14 programming languages and run on three different computer platforms, a server, a laptop, and an embedded system. Results: Compiled programming languages are outperforming the interpreted ones for most, but not for all tasks. C, C#, and JavaScript are on average the best performing compiled, semi-compiled, and interpreted programming languages for the Energy Delay Product, and Rust appears to be well-placed for i/o-intensive operations, such as file handling. We also find that a good behaviour, energywise, can be the result of clever optimizations and design choices in seemingly unexpected programming languages. "
What do large commits tell us? A taxonomical study of large commits,
Which Contributions Predict Whether Developers Are Accepted Into GitHub Teams,
Why are Android Apps Removed From Google Play? A Large-scale Empirical Study,
