title,abstract
Developer-Driven Code Smell PrioritizationMSR - Technical Paper,"Code smells are symptoms of poor implementation choices applied during software evolution. While previous research has devoted a notable effort in the definition of automated solutions to detect them in source code, still little is known on how to support developers when prioritizing them. Some works attempted to deliver solutions that can rank smell instances based on their severity, computed on the basis of software metrics. However, this may not be enough since it has been shown that the recommendations provided by current approaches do not take the developer’s perception of design issues into account. In this paper, we perform a first step toward the concept of emph{developer-driven} code smell prioritization and propose a machine learner able to rank code smells according to the perceived criticality that developers assign to them. We test our technique in an empirical study to investigate its accuracy but also the features that are more relevant for classifying the developer’s perception. Finally, we compare our approach with a state-of-the-art technique. Key findings show that the devised solution has an F-Measure up to 85% and outperforms the baseline approach."
Did You Remember To Test Your Tokens?MSR - Technical Paper,"Authentication is a critical security feature for confirming the identity of a system’s users, typically implemented with help from frameworks like Spring Security. It’s important to robustly test complex security features, and unit testing is an effective technique for verifying the correctness of the fine-grained behaviors of a feature. Unfortunately, resources to help developers unit test security features are limited. Most guides focus on black box or penetration testing, tests produced by existing test generation tools are difficult to maintain, and recommendation solutions usually focus on prioritization and selection of existing tests. These solutions are not applicable to developers writing new unit tests, or who want to use metrics other than coverage to track what has been tested."
Embedding Java Classes with code2vec: Improvements from Variable ObfuscationMSR - Technical Paper,"Automatic source code analysis in key areas of software engineering, such as code security, can benefit from Machine Learning (ML). However, many standard ML approaches require a numeric representation of data and cannot be applied directly to source code. Thus, to enable ML, we need to embed source code into numeric feature vectors while maintaining the semantics of the code as much as possible. code2vec is a recently released embedding approach that uses the proxy task of method name prediction to map Java methods to feature vectors. However, experimentation with code2vec shows that it learns to rely on variable names for prediction, causing it to be easily fooled by typos or adversarial attacks. Moreover, it is only able to embed individual Java methods and cannot embed an entire collection of methods such as those present in a typical Java class, making it difficult to perform predictions at the class level (e.g., for the identification of malicious Java classes). Both shortcomings are addressed in the research presented in this paper. We investigate the effect of obfuscating variable names during training of a code2vec model to force it to rely on the structure of the code rather than specific names and consider a simple approach to creating class-level embeddings by aggregating sets of method embeddings. Our results, obtained on a challenging new collection of source-code classification problems, indicate that obfuscating variable names produces an embedding model that is both impervious to variable naming and more accurately reflects code semantics. The datasets, models, and code are shared for further ML research on source code."
Empirical Study of Restarted and Flaky Builds on Travis CIMSR - Technical Paper,"Continuous Integration (CI) is a development practice where developers frequently integrate code into a common codebase. After the code is integrated, the CI server runs a test suite and other tools to produce a set of reports (e.g., output of linters and tests). If the result of a CI test run is unexpected, developers have the option to manually restart the build, re-running the same test suite on the same code; this can reveal build flakiness, if the restarted build outcome differs from the original build. In this study, we analyze restarted builds, flaky builds, and their impact on the development workflow. We observe that developers restart at least 1.72% of builds, amounting to 56,522 restarted builds in our Travis CI dataset. We observe that more mature and more complex projects are more likely to include restarted builds. The restarted builds are mostly builds that are initially failing due to a test, network problem, or a Travis CI limitations such as execution timeout. Finally, we observe that restarted builds have a major impact on development workflow. Indeed, in 54.42% of the restarted builds, the developers analyze and restart a build within an hour of the initial failure. This suggests that developers wait for CI results, interrupting their workflow to address the issue. Restarted builds also slow down the merging of pull requests by a factor of three, bringing median merging time from 16h to 48h."
Ethical Mining – A Case Study on MSR Mining ChallengesACM SIGSOFT Distinguished Paper AwardMSR - Technical Paper,"Research in Mining Software Repositories (MSR) is research involving human subjects, as the repositories usually contain data about developers’ interactions with the repositories. Therefore, any research in the area needs to consider the ethics implications of the intended activity before starting. This paper presents a discussion of the ethics implications of MSR research, using the mining challenges from the years 2010 to 2019 as a case study. It highlights problems that one may encounter in creating such datasets, and discusses ethics challenges that may be encountered when using existing datasets. An analysis of 102 accepted papers to the Mining Challenge Track suggests that none had an explicit discussion of ethics considerations. Whilst this does not necessarily mean ethics were not considered, the sparsity of discussion leads us to suggest that the MSR community should at least increase awareness by openly discussing ethicas considerations."
Forking Without Clicking: on How to Identify Software Repository ForksMSR - Technical Paper,"The notion of software “fork” has been shifting over time from the (negative) phenomenon of community disagreements that result in the creation of separate development lines and ultimately software products, to the (positive) practice of using distributed version control system (VCS) repositories to collaboratively improve a single software product without stepping on each others toes in the interim. Either way, VCS repositories involved in a fork share parts of a common development history."
From Innovations to Prospects: What Is Hidden Behind Cryptocurrencies?MSR - Technical Paper,"The great influence of Bitcoin has promoted the rapid development of blockchain-based digital currencies, especially the altcoins, since 2013. However, most altcoins share similar source codes, resulting in concerns about code innovations. In this paper, an empirical study on existing altcoins is carried out to offer a thorough understanding of various aspects associated with altcoin innovations. Firstly, we construct the dataset of altcoins, including source code repositories, GitHub fork relations, and market capitalizations (cap). Then, we analyze the altcoin innovations from the perspective of source code similarities. The results demonstrate that more than 85% of altcoin repositories present high code similarities. Next, a temporal clustering algorithm is proposed to mine the inheritance relationship among various altcoins. The family pedigrees of altcoin are constructed, in which the altcoin presents similar evolution features as biology, such as power-law in family size, variety in family evolution, etc. Finally, we investigate the correlation between code innovations and market capitalization. Although we fail to predict the price of altcoins based on their code similarities, the results show that altcoins with higher innovations reflect better market prospects."
Improved Automatic Summarization of Subroutines via Attention to File ContextMSR - Technical Paper,"Software documentation largely consists of short, natural language summaries of the subroutines in the software. These summaries help programmers quickly understand what a subroutine does without having to read the source code him or herself. The task of writing these descriptions is called “source code summarization” and has been a target of research for several years. Recently, AI-based approaches have superseded older, heuristic-based approaches. Yet, to date these AI-based approaches assume that all the content needed to predict summaries is inside subroutine itself. This assumption limits performance because many subroutines cannot be understood without surrounding context. In this paper, we present an approach that models the file context of subroutines (i.e. other subroutines in the same file) and uses an attention mechanism to find words and concepts to use in summaries. We show in an experiment that our approach extends and improves several recent baselines."
Investigating Severity Thresholds for Test SmellsMSR - Technical Paper,"Test smells are poor design decisions implemented in test code, which can have an impact on the effectiveness and maintainability of unit tests. Even though test smell detection tools exist, how to rank the severity of the detected smells is an open research topic. In this work, we aim at investigating the severity rating for four test smells and investigate their perceived impact on test suite maintainability by the developers. To accomplish this, we first analyzed some 1,500 open-source projects to elicit severity thresholds for commonly found test smells. Then, we conducted a study with developers to evaluate our thresholds. We found that (1) current detection rules for certain test smells are considered as too strict by the developers and (2) our newly defined severity thresholds are in line with the participants’ perception of how test smells have an impact on the maintainability of a test suite."
Need for tweet. How open-source developers use Twitter to talk about their GitHub workMSR - Technical Paper,"Social media, especially Twitter, has always been a part of the professional lives of software developers, with prior work reporting on a diversity of usage scenarios, including sharing information, staying current, and promoting one’s work. However, previous studies of Twitter use by software developers are generally restricted to surveys or small samples, and typically lack information about activities of the study subjects (and their outcomes) on other platforms. To enable such future research, in this paper we propose a computational approach to cross-linking users on Twitter and GitHub, the dominant platform for hosting open-source development, revealing 70,428 users active on both. As a preliminary analysis of this dataset, we report on a case study of 800 tweets by open-source developers about GitHub work, combining precise automatic characterization of tweet authors in terms of their relationship to the GitHub items linked in their tweets with a deep qualitative analysis of the tweet contents. We find that developers have very distinct behavioral patterns when including GitHub links in their tweets and these patterns are correlated with the relationship between the tweet author and the repository they link to. Based on this analysis, we hypothesize about what might explain such behavioral differences and what the implications of different tweeting patterns could be for the sustainability of GitHub projects."
"On the Prevalence, Impact, and Evolution of SQL code smells in Data-Intensive SystemsMSR - Technical Paper","Code smells indicate software design problems that harm software quality. Data-intensive systems that frequently access databases often suffer from SQL code smells besides the traditional smells. While there have been extensive studies on traditional code smells, recently, there has been a growing interest in SQL code smells. In this paper, we conduct an empirical study to investigate the prevalence and evolution of SQL code smells in open source, data-intensive systems. We collected 150 projects and examined both traditional and SQL code smells in these projects. Our investigation delivers several important findings. First, SQL code smells are indeed prevalent in data-intensive software systems. Second, SQL code smells have a weak co-occurrence with traditional code smells. Third, SQL code smells have a weaker association with bugs than that of traditional code smells. Fourth, SQL code smells are more likely to be introduced at the beginning of the project lifetime and likely to be left in the code without a fix, compared to traditional code smells. Overall, our results show that SQL code smells are indeed prevalent and persistent in the studied data-intensive software systems. Developers should be aware of these smells and consider detecting and refactoring SQL code smells and traditional code smells separately, using dedicated tools."
On the Relationship between User Churn and Software IssuesMSR - Technical Paper,"User satisfaction is essential for the success of software projects. In fact, even when the budget and the schedule of a project are in control, user dissatisfaction may still lead the project to failure. However, the satisfaction of a user is only part of the success recipe, since a strong competition can also detract users more easily from a software product/service. Users’ churn is the jargon used to denote when a user decides to change from a product/service to those offered by the competitors. In this study, we empirically investigate the relationship between the issues that are present in a software project and the users’ churn. For this purpose, we investigate a new dataset provided by the alternativeto.net platform. Alternativeto.net has a unique feature that allows users to recommend alternatives for a specific software product. The recommendation of alternatives can signal the intention to switch from one software product to another. Through our empirical study, we observe that (i) the intention to change software is tightly associated to the issues that are present in these software; (ii) we can use deep learning models to predict the rate of potential churn that will occur for a software; (iii) the longer the issue takes to be fixed, the higher the chances of users’ churn; and (iv) issues within more general software modules are more likely to be associated with users’ churn. Our study can provide more insights on the prioritization of issues that need to be fixed by considering the probability of users’ churn."
PUMiner: Mining Security Posts from Developer Question and Answer Websites with PU LearningMSR - Technical Paper,"Security is an increasing concern in software development. Developer Question and Answer (Q&A) websites provide a large amount of security discussion. Existing studies have used human-defined rules to mine security discussions, but these works still miss many posts, which may lead to an incomplete analysis of the security practices reported on Q&A websites. Traditional supervised Machine Learning methods can automate the mining process; however, the required negative (non-security) class is too expensive to obtain. We propose a novel learning framework, PUMiner, to automatically mine security posts from Q&A websites. PUMiner builds a context-aware embedding model to extract features of the posts, and then develops a two-stage PU model to identify security content using the labelled Positive and Unlabelled posts. We evaluate PUMiner on more than 17.2 million posts on Stack Overflow and 52,611 posts on Security StackExchange. We show that PUMiner is effective with the validation performance of at least 85% across all model configurations. Moreover, Matthews Correlation Coefficient (MCC) of PUMiner is 0.906 points, 148% and 10.4% higher than one-class SVM, positive-similarity filtering, and one-stage PU models on unseen testing posts, respectively. PUMiner also performs well with an MCC of 0.745 for scenarios where string matching totally fails. Even when the ratio of the labelled positive posts to the unlabelled ones is only 1:100, PUMiner still achieves a strong MCC of 0.65, which is 160% better than fully-supervised learning. Using PUMiner, we provide the largest and up-to-date security content on Q&A websites for practitioners and researchers."
Painting Flowers: Reasons for Using Single-State State Machines in Model-Driven EngineeringMSR - Technical Paper,"Models, as the main artifact in model-driven engineering, have been extensively used for goals such as code generation and verification in the area of embedded systems modeling. One of the most popular behavioral modeling techniques is state machine. Many state machine modeling guidelines recommend that a state machine should have more than one state in order to be meaningful. However, single-state state machines (SSSMs) violating this recommendation have been used in modeling cases reported in the literature. In this paper, we investigate the use of SSSMs by studying their prevalence and roles in the domain of embedded systems, as well as why developers use them and what advantages and disadvantages developers perceive. We employ the sequential explanatory strategy to study 1500 state machines from 26 components at a large company producing embedded systems. We observe that 25 out of 26 components contain SSSMs, making up 25.3% of the model base. To understand the reasons for this extensive usage we conduct a series of interviews followed by a grounded theory building. The results suggest that SSSMs are used to interface with the existing code base, to deal with tool limitations, to facilitate maintenance and to ease verification. Based on our results, we provide implications to modeling tool builders. Furthermore, we formulate two hypotheses about the effectiveness of SSSMs as well as the impacts of SSSMs on development, maintenance and verification."
Polyglot and Distributed Software Repository Mining with CROSSFLOWMSR - Technical Paper,"Repository mining of large-scale software systems often requires substantial storage and computational resources, commonly involving a large number of calls made to rate-limited APIs, such as those exposed by GitHub and StackOverflow. This creates an increasing need for repository mining programs to be executed in a distributed manner, such that remote collaborators can contribute computational and storage resources, as well as API quotas (without the need for sharing API access tokens or credentials). In this paper we present CROSSFLOW, a novel framework for building polyglot distributed repository mining programs. We demonstrate how CROSSFLOW offers delegation of mining jobs to remote workers and can cache their results, how such workers are able to implement advanced behaviors like load balancing and rejecting jobs they either cannot perform or would execute sub-optimally, and how workers of the same analysis program can be written in different programing languages like Java and Python, executing only relevant parts of the program described in that language."
RTPTorrent: An Open-source Dataset for Evaluating Regression Test PrioritizationMSR - Technical Paper,"The software engineering practice of automated testing helps programmers find defects earlier during development. With growing software projects and longer-running test suites, frequency and immediacy of feedback decline, thereby making defects harder to repair. Regression test prioritization (RTP) is concerned with running relevant tests earlier to lower the costs of defect localization and to improve feedback."
SoftMon: A Tool to Compare Similar Open-source Software from a Performance PerspectiveMSR - Technical Paper,"Over the past two decades, a rich ecosystem of open-source software has evolved. For every type of application, there are a wide variety of alternatives. We observed that even if different applications that perform similar tasks are compiled with the same versions of the compiler and the libraries, they perform very differently while running on the same system. Sadly prior work in this area that compares two code bases for similarities does not help us in finding the reasons for the difference in performance. In this paper, we develop a tool, SoftMon, that can compare the codebases of two separate applications and pinpoint the exact set of functions that are disproportionately responsible for differences in performance. Our tool uses machine learning and NLP techniques to analyze why a given open-source application has a lower performance as compared to its peers, design bespoke applications that can incorporate specific innovations (identified by SoftMon) in competing applications, and diagnose performance bugs. In this paper, we compare a wide variety of large open-source programs such as image editors, audio players, text editors, PDF readers, mail clients and even full-fledged operating systems (OSs). In all cases, our tool was able to pinpoint a set of at the most 10-15 functions that are responsible for the differences within 200 seconds. A subsequent manual analysis assisted by our Graph Visualization Engine helps us find the reasons. We were able to validate most of the reasons by correlating them with subsequent observations made by developers or from extant technical literature. The manual phase of our analysis is limited to 30 minutes (tested with human subjects)."
The Impact of a Major Security Event on an Open Source Project: The Case of OpenSSLMSR - Technical Paper,Context: The Heartbleed vulnerability brought OpenSSL to interna- tional attention in 2014. The almost moribund project was a key security component in public web servers and over a billion mobile devices. This vulnerability led to new investments in OpenSSL.
The Scent of Deep Learning Code: An Empirical StudyMSR - Technical Paper,"Deep learning practitioners are often interested in improving their model accuracy rather than the interpretability of their models. As a result, deep learning applications are inherently complex in their structures. They also need to continuously evolve in terms of code changes and model updates. Given these confounding factors, there is a great chance of violating the recommended programming practices by the developers in their deep learning applications. In particular, the code quality might be negatively affected due to their drive for the higher model performance. Unfortunately, the code quality of deep learning applications has rarely been studied to date. In this paper, we conduct an empirical study using 118 open-source software systems from GitHub where we contrast between deep learning-based and traditional systems in terms of their code quality. We have several major findings. First, deep learning applications smell like the traditional ones. However, long lambda expression, long ternary conditional expression, and complex container comprehension smells are frequently found in deep learning projects. That is, the DL code involves more complex or longer expressions than the traditional code does. Second, code smells are found increasing across the releases of deep learning applications. Third, we found that there is a co-existence between code smells and software bugs in the deep learning code, which confirms our conjecture on the degraded code quality in deep learning applications."
The State of the ML-universe: 10 Years of Artificial Intelligence & Machine Learning Software Development on GitHubMSR - Technical Paper,"In the last few years, artificial intelligence (AI) and machine learning (ML) have become ubiquitous terms. These powerful techniques have escaped obscurity in academic communities with the recent onslaught of AI & ML tools, frameworks, and libraries that make these techniques accessible to a wider audience of developers. As a result, applying AI & ML to solve existing and emergent problems is an increasingly popular practice. However, little is known about this domain from the software engineering perspective. Many AI & ML tools and applications are open source, and hosted on platforms such as GitHub that provide rich tools for large-scale distributed software development. Despite widespread use and popularity, these repositories have never been examined as a community to identify unique properties, development patterns, and trends."
