title,abstract
500+ Times Faster Than Deep Learning (A Case Study Exploring Faster Methods for Text Mining StackOverflow),
A Benchmark Study on Sentiment Analysis for Software Engineering Research," A recent research trend has emerged to identify developers’ emotions, by applying sentiment analysis to the content of communication traces left in collaborative development environments. Trying to overcome the limitations posed by using off-the-shelf sentiment analysis tools, researchers recently started to develop their own tools for the software engineering domain. In this paper, we report a benchmark study to assess the performance and reliability of three sentiment analysis tools specifically customized for software engineering. Furthermore, we offer a reflection on the open challenges, as they emerge from a qualitative analysis of misclassified texts. "
A Deep Learning Approach to Identifying Source Code in Images and Video,
A Design Structure Matrix Approach for Measuring Co-Change-Modularity of Software Products," Several authors have quantified the modularity of software systems in terms of coupling and cohesion metrics. Most of these approaches focus on functional and procedural dependencies in the system. Although highly relevant at the design phase, these static dependencies alone do not account for how a software product evolves over time. Instead, this is also dictated by logical and hidden dependencies between system files. To a large extent, the co-change (co-commit) relation captures these different types of dependencies. In this paper, we define two measures of co-change-modularity of a software product based on a weighted design structure matrix (DSM). The first metric, called the weighted propagation cost, uses matrix exponential to measure how changes to one system file potentially affect the whole product. The second metric, called the weighted clustering cost, uses the output of the first metric to measure the partitionability of the system based on the co-change relation. In addition, we provide a visual representation of how the co-change structure of a system evolves over time. We discuss the theoretical foundation of our work and highlight its advantages over existing methodologies. We apply our approach to GNU Octave and show the findings to be consistent with the available literature on the evolution of Octave. Our analysis is extensible and applicable to a range of scenarios including open source systems.  Link to Publication: https://doi.org/10.1145/3196398.3196409"
A Search System for Mathematical Expressions on Software Binaries," Developers often ask for libraries that implement specific mathematical expressions. A fundamental bottleneck in building information retrieval (IR) systems to answer such mathematical queries is the inability to detect a given expression in software binaries. While we have a few math IR solutions such as EgoMath2 and Tangent-3 that work over text documents, none exist to search over software binaries. Our vision is to build a search system for binaries to answer queries containing mathematical expressions. A wide variety of compilers and differences in the way they optimize the code, pose difficult challenges to solve this problem. In this work, we discuss our preliminary results in detecting mathematical expressions in software binaries. We use a knowledge base assisted approach to solve this problem. We are able to search mathematical expressions with a precision of 80% and a recall of 53%. This work opens up interesting research opportunities in areas such as software security and performance, to help analysts in identifying and analyzing binaries for implementations of mathematical expressions. "
A Study on Inappropriately Partitioned Commits --- How Much and What Kinds of IP Commits in Java Projects? ---,
An Empirical Evaluation of OSGi Dependencies Best Practices in the Eclipse IDE,
An Evaluation of Open-Source Software Microbenchmark Suites for Continuous Performance Assessment," Continuous integration (CI) emphasizes quick feedback to developers. This is at odds with current practice of performance testing, which predominantly focuses on long-running tests against entire systems in production-like environments. Alternatively, software microbenchmarking attempts to establish a performance baseline for small code fragments in short time. This paper investigates the quality of microbenchmark suites with a focus on suitability to deliver quick performance feedback and CI integration. We study ten open-source libraries written in Java and Go with benchmark-suite sizes ranging from 16 to 983 tests, and runtimes between 11 minutes and 8.75 hours. We show that our study subjects include benchmarks with result variability of 50% or higher, indicating that not all benchmarks are useful for reliable discovery of slowdowns. We further artificially inject actual slowdowns into public API methods of the study subjects and test whether test suites are able to discover them. We introduce a performance-test quality metric called the API benchmarking score (ABS). ABS represents a benchmark suite’s ability to find slowdowns among a set of defined core API methods. Resulting benchmarking scores (i.e., fraction of discovered slowdowns) vary between 10% and 100% for the study subjects. This paper’s methodology and results can be used to (1) assess the quality of existing microbenchmark suites, (2) select a set of tests to be run as part of CI, and (3) suggest or generate benchmarks for currently untested parts of an API. "
Analyzing Conflict Predictors in Open-Source Java Projects from GitHub and Travis CI,
Analyzing Requirements and Traceability Information to Improve Bug Localization," Locating bugs in industry-size software systems is time consuming and challenging. An automated approach for assisting the process of tracing from bug descriptions to relevant source code benefits developers. A large body of previous work aims to address this problem and demonstrates considerable achievements. Most existing approaches focus on the key challenge of improving techniques based on textual similarity to identify relevant files. However, there exists a lexical gap between the natural language used to formulate bug reports and the formal source code and its comments. To bridge this gap, state-of-the-art approaches contain a component for analyzing bug history information to increase retrieval performance. In this paper, we propose a novel approach TraceScore that also utilizes projects’ requirements information and explicit dependency trace links to further close the gap in order to relate a new bug report to defective source code files. Our evaluation on more than 13,000 bug reports shows, that TraceScore significantly outperforms two state-of-the-art methods. Further, by integrating TraceScore into an existing bug localization algorithm, we found that TraceScore significantly improves retrieval performance by 49% in terms of mean average precision (MAP). "
Anatomy of Functionality Deletion - An Exploratory Study in Mobile Apps,
Automatic Classification of Software Artifacts in Open-Source Applications,
Automatically Assessing Code Understandability Reanalyzed: Combined Metrics Matter," Previous research shows that developers spend most of their time understanding code. Despite the importance of code understandability for maintenance-related activities, an objective measure of it remains an elusive goal. Recently, Scalabrino et al. reported on an experiment with 46 Java developers designed to evaluate metrics for code understandability. The authors collected and analyzed data on more than a hundred features describing the code snippets, the developers’ experience, and the developers’ performance on a quiz designed to assess understanding. They concluded that none of the metrics considered can individually capture understandability. Expecting that understandability is better captured by a combination of multiple features, we present a reanalysis of the data from the Scalabrino et al. study, in which we use different statistical modeling techniques. Our models suggest that some computed features of code, such as those arising from syntactic structure and documentation, have a small but significant correlation with understandability. Further, we construct a binary classifier of understandability based on various interpretable code features, which has a small amount of discriminating power. Our encouraging results, based on a small data set, suggest that a useful metric of understandability could feasibly be created, but more data is needed. "
Bayesian Hierarchical Modelling for Tailoring Metric Thresholds," Software is highly contextual. While there are cross-cutting ‘global’ lessons, individual software projects exhibit many ‘local’ properties. This data heterogeneity makes drawing local conclusions from global data dangerous. A key research challenge is to construct locally accurate prediction models that are informed by global characteristics and data volumes. Previous work has tackled this problem using clustering and transfer learning approaches, which identify locally similar characteristics. This paper applies a simpler approach known as Bayesian hierarchical modeling. We show that hierarchical modeling supports cross-project comparisons, while preserving local context. To demonstrate the approach, we conduct a conceptual replication of an existing study on setting software metrics thresholds. Our emerging results show our hierarchical model reduces model prediction error compared to a global approach by up to 50%.   I am open to random chats at any time. Neil is an assistant professor in the software engineering group. Neil serves on the steering committee for the International Working Conference on Source Code Analysis and Manipulation (SCAM), is program co-chair, International Conference on Software Architecture, 2018, and associate editor, Journal of Systems and Software. Neil has worked as a postdoc in software engineering at UBC with Gail Murphy, completed his PhD in Computer Science at the University of Toronto, and received his masters and undergraduate degrees at the University of Victoria. Learn more at neilernst.net."
CLEVER: A1:L96 Code Metrics with Clone Detection for Just-In-Time Fault Prevention and Resolution in Large Industrial Projects,
Characterising Deprecated Android APIs,
Closing,
Data-Driven Search-based Software Engineering,
Deep Learning Similarities from Different Representations of Source Code,
Discussion phase,
Evaluating How Developers Use General-Purpose Web-Search for Code Retrieval,
Exploring the Use of Automated API Migrating Techniques in Practice: An Experience Report on Android,
Feature Location using Crowd-based Screencasts,
How Is Video Game Development Different from Software Development in Open Source?," Recent research has provided evidence that, in the industrial context, developing video games diverges from developing software systems in other domains, such as office suites and system utilities. In this paper, we consider video game development in the open source system (OSS) context. Specifically, we investigate how developers contribute to video games vs. non-games by working on different kinds of artifacts, how they handle malfunctions, and how they perceive the development process of their projects. To this purpose, we conducted a mixed, qualitative and quantitative study on a broad suite of 60 OSS projects. Our results confirm the existence of significant differences between game and non-game development, in terms of how project resources are organized and in the diversity of developers’ specializations. Moreover, game developers responding to our survey perceive more difficulties than other developers when reusing code as well as performing automated testing, and they lack a clear overview of their system’s requirements. "
How Swift Developers Handle Errors," Swift is a new programming language developed by Apple as a replacement to Objective-C. It features a sophisticated error handling (EH) mechanism that provides the kind of separation of concerns afforded by exception handling mechanisms in other languages, while also including constructs to improve safety and maintainability. However, Swift also inherits a software development culture stemming from Objective-C being the de-facto standard program- ming language for Apple platforms for the last 15 years. It is, therefore, a priori unclear whether Swift developers embrace the novel EH mechanisms of the programming language or still rely on the old EH culture of Objective-C even working in Swift. In this paper, we study to what extent developers adhere to good practices exemplified by EH guidelines and tutorials, and what are the common bad EH practices particularly relevant to Swift code. Furthermore, we investigate whether perception of these practices differs between novices and experienced Swift developers. To answer these questions we employ a mixed-methods approach and combine 10 semi-structured interviews with Swift developers and quantitative analysis of 78,760 Swift 4 files extracted from 2,733 open-source GitHub repositories. Our findings indicate that there is ample opportunity to improve the way Swift developers use error handling mechanisms. For instance, some recommendations derived in this work are not well spread in the corpus of studied Swift projects. For example, generic catch handlers are common in Swift (even though it is not uncommon for them to share space with their counterparts: non empty catch handlers), custom, developer-defined error types are rare, and developers are mostly reactive when it comes to error handling, using Swift’s constructs mostly to handle errors thrown by libraries, instead of throwing and handling application-specific errors. "
"I'm Leaving You, Travis: A Continuous Integration Breakup Story"," Continuous Integration (CI) services, which can automatically build, test, and deploy software projects, are an invaluable asset in dis2tributed teams, increasing productivity and helping to maintain code quality. Prior work has shown that CI pipelines can be sophisticated, and choosing and configuring a CI system involves tradeoffs. As CI technology matures, new CI tool offerings arise to meet the distinct wants and needs of software teams, as they negotiate a path through these tradeoffs, depending on their context. In this paper, we begin to uncover these nuances, and tell the story of open-source projects falling out of love with Travis, the earliest and most popular cloud-based CI system. Using logistic regression, we quantify the effects that open-source community factors and project technical factors have on the rate of Travis abandonment. We find that increased build complexity reduces the chances of abandonment, that larger projects abandon at higher rates, and that a project’s dominant language has significant but varying effects. Finally, we find the surprising result that metrics of configuration attempts and knowledge dispersion in the project do not affect the rate of abandonment. "
Imprecisions Diagnostic in Source Code Deltas,
Large-Scale Analysis of the Co-Commit Patterns of the Active Developers in GitHub's Top Repositories,
Learning to Mine Aligned Code and Natural Language Pairs from Stack Overflow,
Leveraging Historical Versions of Android Apps for Efficient and Precise Taint Analysis,
Natural Language or Not (NLoN) - package for Software Engineering Text Analysis Pipeline," The use of natural language processing (NLP) is gaining popularity in software engineering. In order to correctly perform NLP, we must pre-process the textual information to separate natural language from other information, such as log messages, that are often part of the communication in software engineering. We present a simple approach for classifying whether some textual input is natural language or not. Although our NLoN package relies on only 11 language features and character tri-grams, we are able to achieve an area under the ROC curve performances between 0.976-0.987 on three different data sources, with Lasso regression from Glmnet as our learner and two human raters for providing ground truth. Cross-source prediction performance is lower and has more fluctuation with top ROC performances from 0.913 to 0.980. Compared with prior work, our approach offers similar performance but is considerably more lightweight, making it easier to apply in software engineering text mining pipelines. Our source code and data are provided as an R-package for further improvements. "
On the impact of security vulnerabilities in the npm package dependency network," Security vulnerabilities are among the most pressing problems in open source software package libraries. It may take a long time to discover and fix vulnerabilities in packages. In addition, vulnerabilities may propagate to dependent packages, making them vulnerable too. This paper presents an empirical study of nearly 400 security reports over a 6-year period in the npm dependency network containing over 610k JavaScript packages. Taking into account the severity of vulnerabilities, we analyse how and when these vulnerabilities are discovered and fixed, and to which extent they a ect other packages in the packaging ecosystem in presence of dependency constraints. We report our findings and provide guidelines for package maintainers and tool developers to improve the process of dealing with security issues.  Link to Publication: http://applications.umons.ac.be/docnum/c7b423fd-d183-486c-9cec-966066b9b364/C9345D51-B92C-4551-BF50-1FA8CF0A6691/paper.pdf"
Prevalence of Confusing Code in Software Projects - Atoms of Confusion in the Wild," Prior work has shown that extremely small code patterns, such as the conditional operator and implicit type conversion, can cause considerable misunderstanding in programmers. Until now, the real world impact of these patterns – known as ‘atoms of confusion’ – was only speculative. This work uses a corpus of 14 of the most popular and influential open source C and C++ projects to measure the prevalence and significance of these small confusing patterns. Our results show that the 15 known types of confusing micro patterns occur millions of times in programs like the Linux kernel and GCC, appearing on average once every 23 lines. We show there is a strong correlation between these confusing patterns and bug-ix commits as well as a tendency for confusing patterns to be commented. We also explore patterns at the project level showing the rate of security vulnerabilities is higher in projects with more atoms. Finally, we examine real code examples containing these atoms, including ones that were used to ind and ix bugs in our corpus. In total this work demonstrates that beyond simple misunderstanding in the lab setting, atoms of confusion are both prevalent – occurring often in real projects, and meaningful – being removed by bug-fix commits at an elevated rate. "
Profiling call changes via motif mining," Components’ interactions in software systems evolve over time increasing in complexity and size. Developers might have hard time to master such complexity during their maintenance activities incrementing the risk to make mistakes. Understanding changes of such interactions helps developer plan their re-factoring activities. In this study, we propose a method to study the occurrence of motifs in call graphs and their role in the evolution of a system. In our settings, motifs are patterns of class calls that can arise for many reasons as, for example, after implementing design patterns. By mining motifs of the call graph obtained from each system’s release, we were able to profile the evolution of 68 releases of five open source systems and show that 1) systems have common motifs that occur non-randomly and persistently over their releases, 2) motifs can be used to describe the evolution of calls, compare systems and eventually reveal releases that underwent major changes, 3) there are no specific motif types that include design patterns in all systems under study, but each system has motifs that likely include them, motifs that do not include them at all, and motifs that include a design pattern and occur only once in every release. Some of the findings resemble the ones for biological / physical systems and, as such, path the way to study the evolution of call graphs as dynamical systems (i.e., as system regulated by analytic functions). "
RestMule: Enabling Resilient Clients for Remote APIs,
SOTorrent: Reconstructing and Analyzing the Evolution Stack Overflow Posts," Stack Overflow (SO) is the most popular question-and-answer website for software developers, providing a large amount of code snippets and free-form text on a wide variety of topics. Like other software artifacts, questions and answers on SO evolve over time, for example when bugs in code snippets are fixed, code is updated to work with a more recent library version, or text surrounding a code snippet is edited for clarity. To be able to analyze how content on SO evolves, we built SOTorrent, an open dataset based on the official SO data dump. SOTorrent provides access to the version history of SO content at the level of whole posts and individual text or code blocks. It connects SO posts to other platforms by aggregating URLs from text blocks and by collecting references from GitHub files to SO posts. In this paper, we describe how we built SOTorrent, and in particular how we evaluated 134 different string similarity metrics regarding their applicability for reconstructing the version history of text and code blocks. Based on a first analysis using the dataset, we present insights into the evolution of SO posts, e.g., that post edits are usually small, happen soon after the initial creation of the post, and that code is rarely changed without also updating the surrounding text. Further, our analysis revealed a close relationship between post edits and comments. Our vision is that researchers will use SOTorrent to investigate and understand the evolution of SO posts and their relation to other platforms such as GitHub. "
Studying the Impact of Adopting Continuous Integration on the Delivery Time of Pull Requests," Continuous Integration (CI) is a software development practice that leads developers to integrate their work more frequently. Software projects have broadly adopted CI to ship new releases more frequently and to improve code integration. The adoption of CI is motivated by the allure of delivering new functionalities more quickly. However, there is little empirical evidence to support such a claim. Through the analysis of 162,653 pull requests (PRs) of 87 GitHub projects that are implemented in 5 different programming languages, we empirically investigate the impact of adopting CI on the time to deliver merged PRs. Surprisingly, only 51.3% of the projects deliver merged PRs more quickly after adopting CI. We also observe that the large increase of PR submissions after CI is a key reason as to why projects deliver PRs more slowly after adopting CI. To investigate the factors that are related to the time-to-delivery of merged PRs, we train regression models that obtain sound median R-squares of 0.64-0.67. Finally, a deeper analysis of our models indicates that, before the adoption of CI, the integration-load of the development team, i.e., the number of submitted PRs competing for being merged, is the most impactful metric on the time to deliver merged PRs before CI. Our models also reveal that PRs that are merged more recently in a release cycle experience a slower delivery time. "
Studying the relationship between exception handling practices and post-release defects," Modern programming languages, such as Java and C#, typically provide features that handle exceptions. These features separate error-handling code from regular source code and aim to assist in the practice of software comprehension and maintenance. Nevertheless, their misuse can still cause reliability degradation or even catastrophic software failures. Prior studies on exception handling revealed the suboptimal practices of the exception handling flows and the prevalence of their anti-patterns. However, little is known about the relationship between exception handling practices and software quality. In this work, we investigate the relationship between software quality (measured by the chance of having post-release defects) and: (i) exception flow characteristics and (ii) 17 exception handling anti-patterns. We perform a case study on three Java and C# open-source projects. By building statistical models of the chance of post-release defects using traditional software metrics and metrics that are associated with exception handling practice, we study whether exception flow characteristics and exception handling anti-patterns have a statistically significant relationship with post-release defects. We find that exception flow characteristics in Java projects have a significant relationship with post-release defects. In addition, although majority of the exception handing anti-patterns are not significant in the models, there exist anti-patterns that can provide significant explanatory power to the chance of post-release defects. Therefore, development teams should consider allocating more resources to improving their exception handling practices, and avoid the anti-patterns that are found to have a relationship with post-release defects. Our findings also highlight the need for techniques that assist in handling exceptions in the software development practice. "
