title,abstract
A Large-Scale Comparative Evaluation of IR-Based Tools for Bug LocalizationMSR - Technical Paper,"This paper reports on a large-scale comparative evaluation of IR-based tools for automatic bug localization. We have divided the bug localization tools in our evaluation into the following three generations: (1) The first-generation tools, now almost a decade old, are based purely on Bag-of-Words (BoW) modeling of software libraries; (2) The second-generation tools that augment BoW-based modeling with two additional pieces of information: historical data, such as change history, and structured information such as class names, method names, etc. And, (3) The most recent third-generation tools that additionally also exploit proximity, order, and semantic relationships between the terms. It is important to realize that the original authors of all these three generations of tools tested them on relatively small-sized datasets that typically consisted no more than a few thousand bug reports. And, for an even more serious shortcoming, those evaluations only involved Java code libraries. The goal of the present paper is to present a comprehensive large-scale evaluation of all three generations of bug-localization tools with code libraries in multiple languages. Our study involves over 20,000 bug reports drawn from a diverse collection of Java, C/C++, and Python projects."
A Machine Learning Approach for Vulnerability CurationACM SIGSOFT Distinguished Paper AwardMSR - Technical Paper,"Central to software composition analysis is a database of vulnerabilities of open-source libraries. Security researchers curate this database from various data sources, including bug tracking systems, commits, and mailing lists. In this article, we report the design and implementation of a machine learning system to help the curation by automatically predicting the vulnerability-relatedness of each data item. It supports a complete pipeline from data collection, model training and prediction, to the validation of new models before deployment. It is executed iteratively to generate better models as new input data become available. It is enhanced by self-training to significantly and automatically increase the size of the training dataset, opportunistically maximizing the improvement in the models’ quality at each iteration. We devised new “deployment stability” metric to evaluate the quality of the new models before deployment into production. We experimentally evaluate the improvement in the performance of the models in one iteration, with 27.59% maximum PR AUC improvements. Ours is the first of such study across a variety of data sources. We discover that the addition of the features of the corresponding commits to the features of issues/pull requests improve the precision for the recall values that matter. We demonstrate the effectiveness of self-training alone, with 10.50% PR AUC improvement, and we discover that there is no uniform ordering of word2vec parameters sensitivity across data sources. We show how the deployment stability metric helped to discover an error."
A Soft Alignment Model for Bug DeduplicationMSR - Technical Paper,"Bug tracking systems (BTS) are widely used in software projects. An important task in such systems consists in identifying duplicate bug reports, i.e., distinct reports related to the same software issue. For several reasons, reporting bugs that have already been reported is quite frequent, making their manual triage unpractical in large BTSs. In this paper, we present a novel deep learning network based on soft-attention alignment to improve duplicate bug report detec- tion. Our model can dynamically focus on distinct segments of the bug reports during the generation of report representations. This architecture is more flexible than previous approaches that compute report representations without or with limited data exchange. We evaluate our model on four well-known datasets derived from BTSs of four popular open-source projects. Our experimental evaluation relies on a ranking-based methodology, which is more adherent to real world scenarios than decision-making methodologies used in many previous works. It demonstrates that our model outperforms state-of-the-art systems and strong baselines in different scenarios. Finally, we also report on ablation studies to confirm our hypothesis that a more flexible architecture is helpful for extracting relevant information from bug reports."
A Study of Potential Code Borrowing and License Violations in Java Projects on GitHubMSR - Technical Paper,"With an ever-increasing amount of open-source software, the popularity of services like GitHub that facilitate code reuse, and common misconceptions about the licensing of open source software, the problem of license violations in the code is getting more and more prominent. In this study, we compile an extensive corpus of popular Java projects from GitHub, search it for code clones and perform an original analysis of possible code borrowing and license violations on the level of code fragments. We chose Java as a language because of its popularity in industry, where the plagiarism problem is especially relevant because of possible legal action. We analyze and discuss distribution of 95 different discovered and manually evaluated licenses in files and projects, differences in the licensing of files, distribution of potential code borrowing between licenses, various types of possible license violations, most violated licenses, etc. Studying possible license violations in specific blocks of code, we have discovered that 29.6% of them might be involved in potential code borrowing and 9.4% of them could potentially violate original licenses."
A Study on the Accuracy of OCR Engines for Source Code Transcription from Programming ScreencastsMSR - Technical Paper,"Programming screencasts can be a rich source of documentation for developers, as they often contain step-by-step explanations of source code, programming concepts, errors, etc. Despite the availability of millions of such videos, the rich information available in programming screencasts, and especially the source code being displayed on screen is not easy to find, search, or reuse by programmers. Recent research has identified this challenge and has proposed solutions that identify and extract source code from video tutorials in order to make it readily available to developers or to other processing tools. A crucial component in this line of work is the choice of Optical Character Recognition (OCR) engine used to identify and transcribe the source code shown on screen. Previous work has simply chosen one OCR engine or another, without consideration for the accuracy of these engines on source code recognition. In this paper we aim to address this oversight and present an empirical study on the accuracy of six OCR engines on the extraction of source code from programming screencasts and code images. Our results show that the transcription accuracy varies greatly from one OCR engine to another and that the most widely chosen OCR engine in previous studies is by far not the best choice. We also show how other factors, such as font type and size can impact the results. We conclude by offering guidelines for programming screencast creators on which fonts to use to enable a better OCR recognition of their source code, as well as advice on OCR choice for researchers aiming to analyze source code in screencasts."
A Tale of Docker Build Failures: A Preliminary StudyMSR - Technical Paper,"Docker containers have become the de-facto industry standard.Docker builds often break, and a large amount of efforts are put into troubleshooting broken builds. Prior studies have evaluated the rate at which builds in large organizations fail. However, little is known about the frequency and fix effort of failures that occur in Docker builds of open-source projects. This paper provides a first attempt to present a preliminary study on 857,086 Docker builds from 3,828 open-source projects hosted on GitHub. Using the Docker builds data, we measure the frequency of broken builds and report their fix time. Furthermore, we explore the evolution of Docker build failures across time. Our findings help to characterize and understand Docker build failures and motivate the need for collecting more empirical evidence."
AIMMX: Artificial Intelligence Model Metadata ExtractorMSR - Technical Paper,"Despite all of the power that machine learning and artificial intelligence (AI) models bring to applications, much of AI development is currently a fairly ad hoc process. Software engineering and AI development share many of the same languages and tools, but AI development as an engineering practice is still in early stages. Mining software repositories of AI models enables insight into the current state of AI development. However, much of the relevant metadata around models are not easily extractable directly from repositories and require deduction or domain knowledge. This paper presents a library called AIMMX that enables simplified AI Model Metadata eXtraction from software repositories. The extractors have five modules for extracting AI model-specific metadata: model name, associated datasets, references, AI frameworks used, and model domain. We evaluated AIMMX against 7,998 open source models from three sources: model zoos, arXiv AI papers, and state-of-the-art AI papers. AIMMX extracted metadata with 87% precision and 83% recall. As preliminary examples of how AI model metadata extraction enables studies and tools to advance engineering support for AI development, this paper presents an exploratory analysis for data and method reproducibility over the models in the evaluation dataset and a catalog tool for discovering and managing models. Our analysis suggests that while data reproducibility may be relatively poor with 42% of models in our sample citing their datasets, method reproducibility is more common at 72% of models in our sample, particularly state-of-the-art models. Our collected models are searchable in a catalog that uses existing metadata to enable advanced discovery features for efficiently finding models."
An Empirical Study of Method Chaining in JavaMSR - Technical Paper,"While some promote method chaining as a good practice for improving code readability, others refer to it as a bad practice that worsens code quality. In this paper, we first investigate whether method chaining is a programming style accepted by real-world programmers. To answer this question, we collected 2,814 Java repositories on GitHub and analyzed historical trends in the frequency of method chaining. The results of our analysis revealed the increasing use of method chaining; 23.1% of method invocations were part of method chains in 2018, whereas only 16.0% were such invocations in 2010. We then explore language features that are helpful to the method-chaining style but have not been supported yet in Java. For this aim, we conducted manual inspections of method chains that are randomly sampled from the collected repositories. We also estimated how effective they are to encourage the method-chaining style if they are adopted in Java."
An Empirical Study on Regular Expression BugsMSR - Technical Paper,"Understanding the nature of regular expression (regex) issues is important to tackle practical issues developers face in regular expression usage. Knowledge about the nature and frequency of various types of regular expression issues, such as those related to performance, API misuse, and code smells, for example, can guide testing, inform documentation writers, and motivate refactoring efforts. However, beyond ReDoS (Regular expression Denial of Service), little is known about to what extent regular expression issues affect software development and how these issues are addressed in practice."
Automatically Granted Permissions in Android appsMSR - Technical Paper,"Developers continuously update their Android apps to keep up with competitors in the market. Such constant updates do not bother end users, since by default the Android platform automatically pushes the most recent compatible release on the device, unless there are major changes in the list of requested permissions that users have to explicitly grant. The lack of explicit user’s approval for each application update, however, may lead to significant risks for the end user, as the new release may include new subtle behaviors which may be privacy-invasive. The introduction of permission groups in the Android permission model makes this problem even worse: if a user gives a single permission within a group, the application can silently request further permissions in this group with each update—without having to ask the user."
Behind the Intents: An In-depth Empirical Study  on Software Refactoring in Modern Code ReviewMSR - Technical Paper,"Code refactorings are of pivotal importance in modern code review. Developers may preserve, revisit, add or undo refactorings through changes’ revisions. Their goal is to certify that the driving intent of a code change is properly achieved. Developers’ intents behind refactorings may vary from pure structural improvement to facilitating feature additions and bug fixes. However, there is little understanding of the refactoring practices performed by developers during the code review process. It is also unclear whether the developers’ intents influence the selection, composition, and evolution of refactorings during the review of a code change. Through mining 1,780 reviewed code changes from 6 systems pertaining to two large open-source communities, we report the first in-depth empirical study on software refactoring during code review. We inspected and classified the developers’ intents behind each code change into 7 distinct categories. By analyzing data generated during the complete reviewing process, we observe: (i) how refactorings are selected, composed and evolved throughout each code change, and (ii) how developers’ intents are related to these decisions. For instance, our analysis shows developers regularly apply non-trivial sequences of refactorings that crosscut multiple code elements (i.e., widely scattered in the program) to support a single feature addition. Moreover, we observed that new developers’ intents commonly emerge during the code review process, influencing how developers select and compose their refactorings to achieve the new and adapted goals. Finally, we provide an enriched dataset that allows researchers to investigate the context and motivations behind refactoring operations during the code review process."
Beyond the Code: Mining Self-Admitted Technical Debt in Issue Tracker SystemsMSR - Technical Paper,"Self-admitted technical debt (SATD) is a particular case of Technical Debt (TD) where developers explicitly acknowledge their sub-optimal implementation decisions. Previous studies mine SATD by searching for specific TD-related terms in source code comments. By contrast, in this paper we argue that developers can admit technical debt by other means, e.g., by creating issues in tracking systems and labelling them as referring to TD. We refer to this type of SATD as issue-based SATD or just SATD-I. We study a sample of 286 SATD-I instances collected from five open source projects, including Microsoft Visual Studio and GitLab Community Edition. We show that only 29% of the studied SATD-I instances can be tracked to source code comments. We also show that SATD-I issues take more time to be closed, compared to other issues, although they are not more complex in terms of code churn. Besides, in 45% of the studied issues TD was introduced to ship earlier, and in almost 60% it refers to Design flaws. Finally, we report that most developers pay SATD-I to reduce its costs or interests (66%). Our findings suggest that there is space for designing novel tools to support technical debt management, particularly tools that encourage developers to create and label issues containing TD concerns."
Boa Views: Easy Modularization and Sharing of MSR AnalysesMSR - Technical Paper,"Mining Software Repositories (MSR) has recently seen a focus toward ultra-large-scale datasets. Several tools exist to support these efforts, such as the Boa language and infrastructure. While Boa has seen extensive use, in its current form it is not always possible to perform the entire analysis task within the infrastructure, often requiring some post-processing in another language. This limits end-to-end reproducibility and limits sharing/re-use of MSR queries. To address this problem, we use the notion of views from the relational database field and designed a query language and runtime infrastructure extension for Boa that we call materialized views. Materialized views provide output reuse to Boa users, so that the results of prior Boa queries can be easily reused by others. This allows for computing results not previously possible within Boa and provides for increased sharing and reuse of MSR queries. To evaluate views, we performed two partial reproductions of prior MSR studies utilizing Boa’s dataset and infrastructure with Boa and compare our results to the prior studies. This shows the usability of the new infrastructure, allowing analyses in Boa that were not previously possible as well as providing a previously hand created gold dataset for identifier splitting as a reusable view for other MSR researchers. We also verified the caching behavior using the queries from one of the case studies. The results show that caching works as expected and can drastically improve the runtime performance."
Can We Use SE-specific Sentiment Analysis Tools in a Cross-Platform Setting?MSR - Technical Paper,"We address the problem of using sentiment analysis tools ‘off-the-shelf’, that is when a gold standard is not available for re-training. We evaluate the performance of SE-specific tools in a cross-platform setting, i.e., on a test set collected from data sources different from the one used for training. We find that (i) the lexicon-based tools outperform the supervised approaches retrained in a cross-platform setting and (ii) retraining can be beneficial in within-platform settings in the presence of robust gold standard datasets, even using a minimal training set. Based on our empirical findings, we derive guidelines for reliable use of sentiment analysis tools in software engineering."
Capture the Feature Flag: Detecting Feature Flags in Open-SourceMSR - Technical Paper,"Feature flags (a.k.a feature toggles) are a mechanism to keep new features hidden behind a boolean option during development. Flags are used for many purposes, such as A/B testing and turning off a feature more easily in case of failures. While software engineering feature flags research is burgeoning, examples of software projects using flags rarely come from outside commercial and private projects, stifling academic progress. To address this gap, in this paper we present a novel mining software repositories approach to detect feature flagging open-source projects, based on analyzing the projects’ commit messages. We apply our approach to all open-source GitHub projects, identifying 231,223 candidate feature flagging projects, and manually validating 100. We also report on an initial analysis of feature flags in the validated sample of 100 projects, investigating practices that correlate with shorter flag lifespans (typically desirable to reduce technical debt), such as using the issue tracker and having the flag owner (the developer introducing a flag) also be the one removing it."
Challenges in Chatbot Development: A Study of Stack Overflow PostsMSR - Technical Paper,"Software chatbots are flourishing these days in different domains and fields due to their benefits in saving costs, time, and effort. This is due to their capability of allowing users to communicate and control different services easily through natural language. The chatbot development requires special expertise (e.g., machine learning and conversation design) that differ from the traditional software systems. However, to date, the challenges that chatbot developers face remain fuzzy and unclear as most of the studies focused on proposing chatbots to perform particular tasks."
"Characterizing and Identifying Composite Refactorings: Concepts, Heuristics and PatternsMSR - Technical Paper","Refactoring consists of a program transformation applied to improve the internal structure of a program, for instance, by contributing to remove code smells. Developers often apply multiple interrelated refactorings called composite refactoring. Even though composite refactoring is a common practice, an investigation from different points of view on how composite refactoring manifests in practice is missing. Previous empirical studies also neglect how different kinds of composite refactorings affect the removal, prevalence or introduction of smells. To address these matters, we provide a conceptual framework and two heuristics to identify composite refactorings within and across commits. Then, we mined the commit history of 48 GitHub software projects, in which we identified and analyzed 24,911 composite refactorings involving 104,505 single refactorings. Amongst several findings, we observed that most composite refactorings occur in the same commit and have the same refactoring type. We also found that several refactorings are semantically related to each other, which occur in different parts of the system but are still related to the same task. Many smells are introduced in a program due to “incomplete” composite refactorings. Additionally, we found 111 patterns of composite refactorings that frequently introduce or remove certain smell types. They can be used as guidelines for developers to improve their refactoring practices as well as for designers of recommender systems."
Detecting Video Game-Specific Bad Smells in Unity ProjectsMSR - Technical Paper,"The growth of the video game market, the large proportion of games targeting mobile devices or streaming services, and the increasing complexity of video games trigger the availability of video game-specific tools to assess performance and maintainability problems. This paper proposes UnityLinter, a static analysis tool that aids Unity video game developers to identify seven types of bad smells we have identified as relevant in video game development. Such smell types pertain to performance, maintainability and incorrect behavior problems. After having defined the smells by analyzing the existing literature and discussion forums, we have assessed their relevance with a survey involving 68 participants. Then, we have analyzed the occurrence of the studied smells in 100 open-source Unity projects, and also assessed UnityLinter’s accuracy. Results of our empirical investigation indicate that developers well-received performance- and behavior-related issues, while some maintainability issues are more controversial. UnityLinter is, in general, accurate enough in detecting smells (86%-100% precision and 50%-100% recall), and our study shows that the studied smell types occur in 39%-97% of the analyzed projects."
Detecting and Characterizing Bots that Commit CodeMSR - Technical Paper,"Background: Some developer activity traditionally performed manually, such as making code commits, opening, managing, or closing issues is increasingly subject to automation in many OSS projects. Specifically, such activity is often performed by tools that react to events or run at specific times. We refer to such automation tools as bots and, in many software mining scenarios related to developer productivity or code quality it is desirable to identify bots in order to separate their actions from actions of individuals. Aim: Find an automated way of identifying bots and code committed by these bots, and to characterize the types of bots based on their activity patterns. Method and Result: We propose BIMAN, a systematic approach to detect bots using author names, commit messages, files modified by the commit, and projects associated with the commits. For our test data, the value for AUC-ROC was 0.9. We also characterized these bots based on the time patterns of their code commits and the types of files modified, and found that they primarily work with documentation files and web pages, and these files are most prevalent in HTML and JavaScript ecosystems. We have compiled a shareable dataset containing detailed information about 461 bots we found (all of whom have more than 1000 commits) and 14,678,222 commits they created."
