title,abstract
Safety Practices in Requirements Engineering: The Uni-REPM Safety Module,"Abstract Context: Software is an important part in safety-critical system (SCS) development since it is becoming a major source of hazards. Requirements-related hazards have been associated with many accidents and safety incidents. Requirements issues tend to be mitigated in companies with high processes maturity levels since they do their business in a systematic, consistent and proactive approach. However, requirements engineers need systematic guidance to consider safety concerns early in the development process. Goal: the paper investigates which safety practices are suitable to be used in the Requirements Engineering (RE) process for SCS and how to design a safety maturity model for this area. Method: we followed the design science methodology to propose Uni-REPM SCS, a safety module for Unified Requirements Engineering Process Maturity Model (Uni-REPM). We also conducted a static validation with two practitioners and nine academic experts to evaluate its coverage, correctness, usefulness, and applicability. Results: The module has seven main processes, fourteen sub-processes and 148 practices that form the basis of safety processes maturity. Moreover, we describe its usage through a tool. Conclusions: The validation indicates a good coverage of practices and well receptivity by the experts. Finally, the module can help companies in evaluating their current practices.Keywords DP Industry, Safety Critical Software, Systems Analysis, Design Science Methodology, Uni REPM SCS, Unified Requirements Engineering Process Maturity Model, Safety Processes Maturity, Safety Practices, Uni REPM Safety Module, Safety Critical System Development, Requirements Related Hazards, High Processes Maturity Levels, Safety Maturity Model, Safety, Companies, Software, Capability Maturity Model, Requirements Engineering, Systematics, Standards, Safety Critical Systems, Requirements Engineering, Maturity Models, Uni REPM, Safety Engineering"
Automated Selection of Optimal Model Transformation Chains via Shortest-Path Algorithms,"Abstract Conventional wisdom on model transformations in Model-Driven Engineering (MDE) suggests that they are crucial components in modeling environments to achieve superior automation, whether it be refactoring, simulation, or code generation. While their relevance is well-accepted, model transformations are challenging to design, implement, and verify because of the inherent complexity that they must encode. Thus, defining transformations by chaining existing ones is key to success for enhancing their reusability. This paper proposes an approach, based on well-established algorithms, to support modellers when multiple transformation chains are available to bridge a source metamodel with a target one. The all-important goal of selecting the optimal chain has been based on the quality criteria of coverage and information loss. The feasibility of the approach has been demonstrated by means of experiments operated on chains obtained from transformations borrowed from a publicly available repository.Keywords Graph Theory, Program Processors, Software Maintenance, Software Quality, Model Driven Engineering, Optimal Chain, Optimal Model Transformation Chains, Automated Selection, Shortest Path Algorithms, Quality Criteria, Unified Modeling Language, Adaptation Models, Bridges, Analytical Models, Model Driven Engineering, Ecosystems, Model Driven Engineering, Model Transformation Composition, Graph Algorithms, Shortest Paths"
Analyzing the Effects of Bugs on Software Interfaces,"Abstract Critical systems that integrate software components (e.g., from third-parties) need to address the risk of residual software defects in these components. Software fault injection is an experimental solution to gauge such risk. Many error models have been proposed for emulating faulty components, such as by injecting error codes and exceptions, or by corrupting data with bit-flips, boundary values, and random values. Even if these error models have been able to find breaches in fragile systems, it is unclear whether these errors are in fact representative of software faults. To pursue this open question, we propose a methodology to analyze how software faults in C/C++ software components turn into errors at components' interfaces (interface error propagation), and present an experimental analysis on what, where, and when to inject interface errors. The results point out that the traditional error models, as used so far, do not accurately emulate software faults, but that richer interface errors need to be injected, by: injecting both fail-stop behaviors and data corruptions; targeting larger amounts of corrupted data structures; emulating silent data corruptions not signaled by the component; combining bit-flips, boundary values, and data perturbations.Keywords C Language, Data Structures, Program Debugging, Software Fault Tolerance, Source Code Software, User Interfaces, Software Faults, Boundary Values, Software Interfaces, Critical Systems, Residual Software Defects, Software Fault Injection, Error Codes, Bug Effects, C C Software Components, Interface Error Propagation, Data Structure, Bit Flips, Data Perturbations, Software, Unified Modeling Language, Computer Bugs, Perturbation Methods, Testing, Fault Tolerance, Dependability, Fault Injection, Software Components, Error Propagation, Error Modeling, Error Handling"
A Framework for Quantitative Modeling and Analysis of Highly (Re)configurable Systems,"Abstract This paper presents our approach to the quantitative modeling and analysis of highly (re)configurable systems, such as software product lines. Different combinations of the optional features of such a system give rise to combinatorially many individual system variants. We use a formal modeling language that allows us to model systems with probabilistic behavior, possibly subject to quantitative feature constraints, and able to dynamically install, remove or replace features. More precisely, our models are defined in the probabilistic feature-oriented language QFLan, a rich domain specific language (DSL) for systems with variability defined in terms of features. QFLan specifications are automatically encoded in terms of a process algebra whose operational behavior interacts with a store of constraints, and hence allows to separate system configuration from system behavior. The resulting probabilistic configurations and behavior converge seamlessly in a semantics based on discrete-time Markov chains, thus enabling quantitative analysis. Our analysis is based on statistical model checking techniques, which allow us to scale to larger models with respect to precise probabilistic analysis techniques. The analyses we can conduct range from the likelihood of specific behavior to the expected average cost, in terms of feature attributes, of specific system variants. Our approach is supported by a novel Eclipse-based tool which includes state-of-the-art DSL utilities for QFLan based on the Xtext framework as well as analysis plug-ins to seamlessly run statistical model checking analyses. We provide a number of case studies that have driven and validated the development of our framework.Keywords Formal Specification, Formal Verification, Markov Processes, Probability, Process Algebra, Specification Languages, Statistical Analysis, System Configuration, System Behavior, Resulting Probabilistic Configurations, Quantitative Analysis, Statistical Model Checking Techniques, Larger Models, Precise Probabilistic Analysis Techniques, Specific Behavior, Feature Attributes, Specific System Variants, Analysis Plug Ins, Statistical Model Checking Analyses, Highlyconfigurable Systems, Quantitative Modeling, Software Product Lines, Optional Features, Combinatorially Many Individual System Variants, Formal Modeling Language, Probabilistic Behavior, Quantitative Feature Constraints, Probabilistic Feature Oriented Language QF Lan, Rich Domain Specific Language, QF Lan Specifications, Process Algebra, Probabilistic Logic, Model Checking, Tools, Analytical Models, Runtime, Computational Modeling, DSL, Software Product Lines, Probabilistic Modeling, Quantitative Constraints, Statistical Model Checking, Formal Methods"
