title,abstract
A Multiple Case Study of Artificial Intelligent System Development in Industry,"There is a rapidly increasing amount of Artificial Intelligence (AI) systems developed in recent years, with much expectation on its capacity of innovation and business value generation. However, the promised value of AI systems in specific business ..."
A Bigram-based Inference Model for Retrieving Abbreviated Phrases in Source Code,"Expanding abbreviations in source code to their full meanings is very useful for software maintainers to comprehend the source code. The existing approaches, however, focus on expanding an abbreviation to a single word, i.e., unigram. They do not ..."
An Experimental Evaluation of Imbalanced Learning and Time-Series Validation in the Context of CI/CD Prediction,Background: Machine Learning (ML) has been widely used as a powerful tool to support Software Engineering (SE). The fundamental assumptions of data characteristics required for specific ML methods have to be carefully considered prior to their ...
Agile Islands in a Waterfall Environment: Challenges and Strategies in Automotive,"Driven by the need for faster time-to-market and reduced development lead-time, large-scale systems engineering companies are adopting agile methods in their organizations. This agile transformation is challenging and it is common that adoption starts ..."
Mining Questions Asked about Continuous Software Engineering: A Case Study of Stack Overflow,"Context: With the growing popularity of rapid software delivery and deployment, the methods, practices and technologies of Continuous Software Engineering (CSE) are evolving steadily. This creates the need for understanding the recent trends of the ..."
Automatic Identification of Decisions from the Hibernate Developer Mailing List,"Decisions run through the whole software development and maintenance processes. Explicitly documenting these decisions helps to organize development knowledge and to reduce its vaporization, thereby controlling the development process and maintenance ..."
Combining Network Analysis with Structural Matching for Design Pattern Detection,"Context: Design pattern detection is a very important research on software reuse, which can greatly help software maintenance and reconstruction. At present, many researchers have invested in this work and proposed a variety of methods for detection. ..."
A Multinomial Naïve Bayesian (MNB) Network to Automatically Recommend Topics for GitHub Repositories,"GitHub has become a precious service for storing and managing software source code. Over the last year, 10M new developers have joined the GitHub community, contributing to more than 44M repositories. In order to help developers increase the ..."
Observations on the Linear Order of Program Code Reading Patterns in Programmers with Dyslexia,The software engineering industry is increasingly aware of the role and value of neurodiverse engineers within the workforce. One motivation is the alignment between skills needed for software development and the processing strengths of individuals with ...
Feature Terms Prediction: A Feasible Way to Indicate the Notion of Features in Software Product Line,"In Software Product Lines (SPL), feature extraction from software requirements specifications has been subject to intense research in order to assist domain analysis in a time-saving way. Although various approaches are proposed to extract features, ..."
Exploring the Characteristics of Spectra Distribution and Their Impacts on Fault Localization,"Spectrum-Based Fault Localization (SBFL) follows the basic intuitions that the faulty parts are more likely to be covered by failure-revealing test cases and less likely to be covered by passed test cases. However, due to the diversity of programs and ..."
Using the Lexicon from Source Code to Determine Application Domain,"Context: The vast majority of software engineering research is reported independently of the application domain: techniques and tools usage is reported without any domain context. As reported in previous research, this has not always been so: early in ..."
Assessing software defection prediction performance: why using the Matthews correlation coefficient matters,"Context: There is considerable diversity in the range and design of computational experiments to assess classifiers for software defect prediction. This is particularly so, regarding the choice of classifier performance metrics. Unfortunately some ..."
Publication Bias: A Detailed Analysis of Experiments Published in ESEM,Background: Publication bias is the failure to publish the results of a study based on the direction or strength of the study findings. The existence of publication bias is firmly established in areas like medical research. Recent research suggests the ...
Reasoning about Uncertainty in Empirical Results,"Conclusions that are drawn from experiments are subject to varying degrees of uncertainty. For example, they might rely on small data sets, employ statistical techniques that make assumptions that are hard to verify, or there may be unknown confounding ..."
Studying Onboarding in Distributed Software Teams: A Case Study and Guidelines,"Many companies have turned towards globally distributed software development in their quest for access to more development capacity. This paper investigates how a company onboarded distributed teams in a global project, and report experience on how to ..."
Which Software Faults Are Tests Not Detecting?,Context: Software testing plays an important role in assuring the reliability of systems. Assessing the efficacy of testing remains challenging with few established test effectiveness metrics. Those metrics that have been used (e.g. coverage and ...
Is Exceptional Behavior Testing an Exception?: An Empirical Assessment Using Java Automated Tests,"Software testing is a crucial activity to check the internal quality of a software. During testing, developers often create tests for the normal behavior of a particular functionality (e.g., was this file properly uploaded to the cloud?). However, ..."
Caveats in Eliciting Mobile App Requirements,Factors such as app stores or platform choices heavily affect functional and non-functional mobile app requirements. We surveyed 45 companies and interviewed ten experts to explore how factors that impact mobile app requirements are understood by ...
Investigating the Correlation between Performance Scores and Energy Consumption of Mobile Web Apps,"Context. Developers have access to tools like Google Lighthouse to assess the performance of web apps and to guide the adoption of development best practices. However, when it comes to energy consumption of mobile web apps, these tools seem to be ..."
Mining Decision-Making Processes in Open Source Software Development: A Study of Python Enhancement Proposals (PEPs) using Email Repositories,"Open source software (OSS) communities are often able to produce high quality software comparable to proprietary software. The success of an open source software development (OSSD) community is often attributed to the underlying governance model, and a ..."
Surveying Software Practitioners on Technical Debt Payment Practices and Reasons for not Paying off Debt Items,"Background: Little is known about the practices used for technical debt (TD) payment. The study of payment practices, as well as the reasons for not applying them, can help practitioners to control and manage TD items. Aims: To investigate, from the ..."
How Do FOSS Communities Decide to Accept Pull Requests?,"Pull requests are a method to facilitate review and management of contribution in distributed software development. Software developers author commits, and present them in a pull request to be inspected by maintainers and reviewers. The success and ..."
A Better Set of Object-Oriented Design Metrics for Within-Project Defect Prediction,"Background: Using design metrics to predict fault-prone elements of a software design can help to focus attention on classes that need redesign and more extensive testing. However, some design metrics have been pointed out to be theoretically invalid, ..."
Actionable Software Metrics: An Industrial Perspective,"Background: Practitioners would like to take action based on software metrics, as long as they find them reliable. Existing literature explores how metrics can be made reliable, but remains unclear if there are other conditions necessary for a metric to ..."
Documentation of Quality Requirements in Agile Software Development,"Context: Quality requirements (QRs) have a significant role in the success of software projects. In agile software development (ASD), where working software is valued over comprehensive documentation, QRs are often under-specified or not documented. ..."
Collaborative Modelling: Chatbots or On-Line Tools? An Experimental Study,"Modelling is a fundamental activity in software engineering, which is often performed in collaboration. For this purpose, on-line tools running on the cloud are frequently used. However, recent advances in Natural Language Processing have fostered the ..."
