title,abstract
Comparing and experimenting machine learning techniques for code smell detection,"Several code smell detection tools have been developed providing different results, because smells can be subjectively interpreted, and hence detected, in different ways. In this paper, we perform the largest experiment of applying machine learning algorithms to code smells to the best of our knowledge. We experiment 16 different machine-learning algorithms on four code smells (Data Class, Large Class, Feature Envy, Long Method) and 74 software systems, with 1986 manually validated code smell samples. We found that all algorithms achieved high performances in the cross-validation data set, yet the highest performances were obtained by J48 and Random Forest, while the worst performance were achieved by support vector machines. However, the lower prevalence of code smells, i.e., imbalanced data, in the entire data set caused varying performances that need to be addressed in the future studies. We conclude that the application of machine learning to the detection of these code smells can provide high accuracy (>96 %), and only a hundred training examples are needed to reach at least 95 % accuracy."
On the detection of custom memory allocators in C binaries,"Many reverse engineering techniques for data structures rely on the knowledge of memory allocation routines. Typically, they interpose on the system’s malloc and free functions, and track each chunk of memory thus allocated as a data structure. However, many performance-critical applications implement their own custom memory allocators. Examples include webservers, database management systems, and compilers like gcc and clang. As a result, current binary analysis techniques for tracking data structures fail on such binaries. We present MemBrush, a new tool to detect memory allocation and deallocation functions in stripped binaries with high accuracy. We evaluated the technique on a large number of real world applications that use custom memory allocators. We demonstrate that MemBrush can detect allocators/deallocators with a high accuracy which is 52 out of 59 for allocators, and 29 out of 31 for deallocators in SPECINT 2006. As we show, we can furnish existing reverse engineering tools with detailed information about the memory management API, and as a result perform an analysis of the actual application specific data structures designed by the programmer. Our system uses dynamic analysis and detects memory allocation and deallocation routines by searching for functions that comply with a set of generic characteristics of allocators and deallocators."
Scalable data structure detection and classification for C/C++ binaries,"Many existing techniques for reversing data structures in C/C ++ binaries are limited to low-level programming constructs, such as individual variables or structs. Unfortunately, without detailed information about a program's pointer structures, forensics and reverse engineering are exceedingly hard. To fill this gap, we propose MemPick, a tool that detects and classifies high-level data structures used in stripped binaries. By analyzing how links between memory objects evolve throughout the program execution, it distinguishes between many commonly used data structures, such as singly- or doubly-linked lists, many types of trees (e.g., AVL, red-black trees, B-trees), and graphs. We evaluate the technique on 10 real world applications, 4 file system implementations and 16 popular libraries. The results show that MemPick can identify the data structures with high accuracy."
Investigating technical and non-technical factors influencing modern code review,"When submitting patches for code review, individual developers are primarily interested in maximizing the chances of their patch being accepted in the least time possible. In principle, code review is a transparent process in which reviewers aim to assess the qualities of the patch on its technical merits in a timely manner; however, in practice the execution of this process can be affected by a variety of factors, some of which are external to the technical content of the patch itself. In this paper, we describe empirical studies of the code review processes for large, open source projects such as WebKit and Google Blink. We first consider factors that have been examined in previous studies — patch size, priority, and component — and then extend our enquiries to explore the effects of organization (which company is involved) and developer profile (review load and activity, patch writer experience) on code review response time and eventual outcome. Our approach uses a reverse engineered model of the patch submission process, and extracts key information from the issue-tracking and code review systems. Our findings suggest that these non-technical factors can significantly impact code review outcomes."
Inferring extended finite state machine models from software executions,"The ability to reverse-engineer models of software behaviour is valuable for a wide range of software maintenance, validation and verification tasks. Current reverse-engineering techniques focus either on control-specific behaviour (e.g., in the form of Finite State Machines), or data-specific behaviour (e.g., as pre / post-conditions or invariants). However, typical software behaviour is usually a product of the two; models must combine both aspects to fully represent the software’s operation. Extended Finite State Machines (EFSMs) provide such a model. Although attempts have been made to infer EFSMs, these have been problematic. The models inferred by these techniques can be non-deterministic, the inference algorithms can be inflexible, and only applicable to traces with specific characteristics. This paper presents a novel EFSM inference technique that addresses the problems of inflexibility and non-determinism. It also adapts an experimental technique from the field of Machine Learning to evaluate EFSM inference techniques, and applies it to three diverse software systems."
Mining architectural violations from version history,"Software architecture conformance is a key software quality control activity that aims to reveal the progressive gap normally observed between concrete and planned software architectures. However, formally specifying an architecture can be difficult, as it must be done by an expert of the system having a high level understanding of it. In this paper, we present a lightweighted approach for architecture conformance based on a combination of static and historical source code analysis. The proposed approach relies on four heuristics for detecting absences (something expected was not found) and divergences (something prohibited was found) in source code based architectures. We also present an architecture conformance process based on the proposed approach. We followed this process to evaluate the architecture of two industrial-strength information systems, achieving an overall precision of 62.7 % and 53.8 %. We also evaluated our approach in an open-source information retrieval library, achieving an overall precision of 59.2 %. We envision that an heuristic-based approach for architecture conformance can be used to rapidly raise architectural warnings, without deeply involving experts in the process."
Assessing the impact of real-time machine translation on multilingual meetings in global software projects,"Communication in global software development is hindered by language differences in countries with a lack of English speaking professionals. Machine translation is a technology that uses software to translate from one natural language to another. The progress of machine translation systems has been steady in the last decade. As for now, machine translation technology is particularly appealing because it might be used, in the form of cross-language chat services, in countries that are entering into global software projects. However, despite the recent progress of the technology, we still lack a thorough understanding of how real-time machine translation affects communication. In this paper, we present a set of empirical studies with the goal of assessing to what extent real-time machine translation can be used in distributed, multilingual requirements meetings instead of English. Results suggest that, despite far from 100 % accurate, real-time machine translation is not disruptive of the conversation flow and, therefore, is accepted with favor by participants. However, stronger effects can be expected to emerge when language barriers are more critical. Our findings add to the evidence about the recent advances of machine translation technology and provide some guidance to global software engineering practitioners in regarding the losses and gains of using English as a lingua franca in multilingual group communication, as in the case of computer-mediated requirements meetings."
Perspectives on refactoring planning and practice: an empirical study,"Iterative development increasingly seeks to incorporate design modification and continuous refactoring in order to maintain code quality even in highly dynamic environments. However, there does not appear to be consensus on how to do this, especially because research results seem to be inconsistent. This paper presents an empirical study based upon an industry survey of refactoring practices and attitudes. The study explored differences in attitudes about refactoring among participants who played roles in software development, and how these different attitudes affected actual practice. The study found strong agreement among all roles about the importance of refactoring, and agreement about the negative effects upon agility of deferring refactoring. Nevertheless, the survey found that roles had different perspectives on the different kinds of tasks in an agile process. Accordingly, there was no universally agreed-upon strategy for how to plan to carry out refactoring. Analysis of the survey results has raised many interesting questions suggesting the need for a considerable amount of future research."
An empirical study of integration activities in distributions of open source software,"Reuse of software components, either closed or open source, is considered to be one of the most important best practices in software engineering, since it reduces development cost and improves software quality. However, since reused components are (by definition) generic, they need to be customized and integrated into a specific system before they can be useful. Since this integration is system-specific, the integration effort is non-negligible and increases maintenance costs, especially if more than one component needs to be integrated. This paper performs an empirical study of multi-component integration in the context of three successful open source distributions (Debian, Ubuntu and FreeBSD). Such distributions integrate thousands of open source components with an operating system kernel to deliver a coherent software product to millions of users worldwide. We empirically identified seven major integration activities performed by the maintainers of these distributions, documented how these activities are being performed by the maintainers, then evaluated and refined the identified activities with input from six maintainers of the three studied distributions. The documented activities provide a common vocabulary for component integration in open source distributions and outline a roadmap for future research on software integration."
Analyzing and automatically labelling the types of user issues that are raised in mobile app reviews,"Mobile app reviews by users contain a wealth of information on the issues that users are experiencing. For example, a review might contain a feature request, a bug report, and/or a privacy complaint. Developers, users and app store owners (e.g. Apple, Blackberry, Google, Microsoft) can benefit from a better understanding of these issues – developers can better understand users’ concerns, app store owners can spot anomalous apps, and users can compare similar apps to decide which ones to download or purchase. However, user reviews are not labelled, e.g. we do not know which types of issues are raised in a review. Hence, one must sift through potentially thousands of reviews with slang and abbreviations to understand the various types of issues. Moreover, the unstructured and informal nature of reviews complicates the automated labelling of such reviews. In this paper, we study the multi-labelled nature of reviews from 20 mobile apps in the Google Play Store and Apple App Store. We find that up to 30 % of the reviews raise various types of issues in a single review (e.g. a review might contain a feature request and a bug report). We then propose an approach that can automatically assign multiple labels to reviews based on the raised issues with a precision of 66 % and recall of 65 %. Finally, we apply our approach to address three  proof-of-concept analytics use case scenarios: (i) we compare competing apps to assist developers and users, (ii) we provide an overview of 601,221 reviews from 12,000 apps in the Google Play Store to assist app store owners and developers and (iii) we detect anomalous apps in the Google Play Store to assist app store owners and users."
An empirical examination of the prevalence of inhibitors to the parallelizability of open source software systems,"An empirical study is presented that examines the potential to parallelize general-purpose software systems. The study is conducted on 13 open source systems comprising over 14 MLOC. Each for-loop is statically analyzed to determine if it can be parallelized or not. A for-loop that can be parallelized is termed a free-loop. Free-loops can be easily parallelized using tools such as OpenMP. For the loops that cannot be parallelized, the various inhibitors to parallelization are determined and tabulated. The data shows that the most prevalent inhibitor by far, is functions called within for-loops that have side effects. This single inhibitor poses the greatest challenge in adapting and re-engineering systems to better utilize modern multi-core architectures. This fact is somewhat contradictory to the literature, which is primarily focused on the removal of data dependencies within loops. Results of this paper also show that function calls via function pointers and virtual methods have very little impact on the for-loop parallelization process. Historical data over a 10-year period of inhibitor counts for the set of systems studied is also presented. It shows that there is little change in the potential for parallelization of loops over time."
Evaluating the impact of design pattern and anti-pattern dependencies on changes and faults,"On the one hand, design patterns are solutions to recurring design problems, aimed at increasing reuse, flexibility, and maintainability. However, much prior work found that some patterns, such as the Observer and Singleton, are correlated with large code structures and argued that they are more likely to be fault prone. On the other hand, anti-patterns describe poor solutions to design and implementation problems that highlight weaknesses in the design of software systems and that may slow down maintenance and increase the risk of faults. They have been found to negatively impact change and fault-proneness. Classes participating in design patterns and anti-patterns have dependencies with other classes, e.g., static and co-change dependencies, that may propagate problems to other classes. We investigate the impact of such dependencies in object-oriented systems by studying the relations between the presence of static and co-change dependencies and (1) the fault-proneness, (2) the types of changes, and (3) the types of faults that these classes exhibit. We analyze six design patterns and 10 anti-patterns in 39 releases of ArgoUML, JFreeChart, and XercesJ, and investigate to what extent classes having dependencies with design patterns or anti-patterns have higher odds of faults than other classes. We show that in almost all releases of the three systems, classes having dependencies with anti-patterns are more fault-prone than others while this is not always true for classes with dependencies with design patterns. We also observe that structural changes are the most common changes impacting classes having dependencies with anti-patterns. Software developers could use this knowledge about the impact of design pattern and anti-pattern dependencies to better focus their testing and reviewing activities towards the most risky classes and to propagate changes adequately."
An experiment on the impact of transparency on the effectiveness of requirements documents,"Effective communication is important to successful software development, but it is difficult to achieve. We believe transparency — the visibility of information to stakeholders — is an important factor in the effectiveness of communication in software projects. We theorise that more effective communication results from more transparent requirements documents. To test our theory, we conducted an experiment. We developed an operational definition of transparency with three attributes: accessibility, understandability, and relevance. We had students and software practitioners use requirements documents of differing levels of transparency based on these attributes to answer questions. We found that participants with the more transparent document spent less time, answered more questions correctly, and were more confident about their answers, than participants with the less transparent document. The results of our experiment provide evidence that our view of transparency may help evaluate the effectiveness of documents as a form of communication. Further work is needed to reproduce our results, and to determine whether they are generalizable to other types of stakeholders and forms of communication."
Assessing refactorings for usability in e-commerce applications,"Refactoring has been reported as a helpful technique to systematically improve non-functional attributes of software. This paper evaluates the relevance of refactoring for improving usability on web applications. We conducted an experiment with two replications at different locations, with subjects of different profiles. Objects chosen for the experiment were two e-commerce applications that exhibit common business processes in today’s web usage. Through the experiment we found that half of the studied refactorings cause a significant improvement in usability. The rest of the refactorings required a post-hoc analysis in which we considered aspects like user expertise in the interaction with web applications or type of application. We conclude that, when improving quality in use, the success of the refactoring process depends on several factors, including the type of software system, context and users. We have analyzed all these aspects, which developers must consider for a better decision support at the time of prioritizing improvements and outweighing effort."
What are mobile developers asking about? A large scale study using stack overflow,"The popularity of mobile devices has been steadily growing in recent years. These devices heavily depend on software from the underlying operating systems to the applications they run. Prior research showed that mobile software is different than traditional, large software systems. However, to date most of our research has been conducted on traditional software systems. Very little work has focused on the issues that mobile developers face. Therefore, in this paper, we use data from the popular online Q&A site, Stack Overflow, and analyze 13,232,821 posts to examine what mobile developers ask about. We employ Latent Dirichlet allocation-based topic models to help us summarize the mobile-related questions. Our findings show that developers are asking about app distribution, mobile APIs, data management, sensors and context, mobile tools, and user interface development. We also determine what popular mobile-related issues are the most difficult, explore platform specific issues, and investigate the types (e.g., what, how, or why) of questions mobile developers ask. Our findings help highlight the challenges facing mobile developers that require more attention from the software engineering research and development communities in the future and establish a novel approach for analyzing questions asked on Q&A forums."
Fresh apps: an empirical study of frequently-updated mobile apps in the Google play store,"Mobile app stores provide a unique platform for developers to rapidly deploy new updates of their apps. We studied the frequency of updates of 10,713 mobile apps (the top free 400 apps at the start of 2014 in each of the 30 categories in the Google Play store). We find that a small subset of these apps (98 apps representing ˜1 % of the studied apps) are updated at a very frequent rate — more than one update per week and 14 % of the studied apps are updated on a bi-weekly basis (or more frequently). We observed that 45 % of the frequently-updated apps do not provide the users with any information about the rationale for the new updates and updates exhibit a median growth in size of 6 %. This paper provides information regarding the update strategies employed by the top mobile apps. The results of our study show that 1) developers should not shy away from updating their apps very frequently, however the frequency varies across store categories. 2) Developers do not need to be too concerned about detailing the content of new updates. It appears that users are not too concerned about such information. 3) Users highly rank frequently-updated apps instead of being annoyed about the high update frequency."
An empirical study of software release notes,"Release notes are an important source of information about a new software release. Such notes contain information regarding what is new, changed, and/or got fixed in a release. Despite the importance of release notes, they are rarely explored in the research literature. Little is known about the contained information, e.g., contents and structure, in release notes. To better understand the types of contained information in release notes, we manually analyzed 85 release notes across 15 different software systems. In our manual analysis, we identify six different types of information (e.g., caveats and addressed issues) that are contained in release notes. Addressed issues refer to new features, bugs, and improvements that were integrated in that particular release. We observe that most release notes list only a selected number of addressed issues (i.e., 6-26 % of all addressed issues in a release). We investigated nine different factors (e.g., issue priority and type) to better understand the likelihood of an issue being listed in release notes. The investigation is conducted on eight release notes of three software systems using four machine learning techniques. Results show that certain factors, e.g., issue type, have higher influence on the likelihood of an issue to be listed in release notes. We use machine learning techniques to automatically suggest the issues to be listed in release notes. Our results show that issues listed in all release notes can be automatically determined with an average precision of 84 % and an average recall of 90 %. To train and build the classification models, we also explored three scenarios: (a) having the user label some issues for a release and automatically suggest the remaining issues for that particular release, (b) using the previous release notes for the same software system, and (c) using prior releases for the current software system and the rest of the studied software systems. Our results show that the content of release notes vary between software systems and across the versions of the same software system. Nevertheless, automated techniques can provide reasonable support to the writers of such notes with little training data. Our study provides developers with empirically-supported advice about release notes instead of simply relying on adhoc advice from on-line inquiries."
"What Java developers know about compatibility, and why this matters","Real-world programs are neither monolithic nor static—they are constructed using platform and third party libraries, and both programs and libraries continuously evolve in response to change pressure. In case of the Java language, rules defined in the Java Language and Java Virtual Machine Specifications define when library evolution is safe. These rules distinguish between three types of compatibility—binary, source and behavioural. We claim that some of these rules are counter intuitive and not well-understood by many developers. We present the results of a survey where we quizzed developers about their understanding of the various types of compatibility. 414 developers responded to our survey. We find that while most programmers are familiar with the rules of source compatibility, they generally lack knowledge about the rules of binary and behavioural compatibility. This can be problematic when organisations switch from integration builds to technologies that require dynamic linking, such as OSGi. We have assessed the gravity of the problem by studying how often linkage-related problems are referenced in issue tracking systems, and find that they are common."
