title,abstract
Factors and actors leading to the adoption of a JavaScript framework,"The increasing popularity of JavaScript has led to a variety of JavaScript frameworks that aim to help developers to address programming tasks. However, the number of JavaScript frameworks has risen rapidly to thousands of versions. It is challenging for practitioners to identify the frameworks that best fit their needs and to develop new ones which fit such needs. Furthermore, there is a lack of knowledge regarding what drives developers toward the choice. This paper explores the factors and actors that lead to the choice of a JavaScript framework. We conducted a qualitative interpretive study of semi-structured interviews. We interviewed 18 decision makers regarding the JavaScript framework selection, up to reaching theoretical saturation. Through coding of the interview responses, we offer a model of desirable JavaScript framework adoption factors. The factors are grouped into categories that are derived via the Unified Theory of Acceptance and Use of Technology. The factors are performance expectancy (performance, size), effort expectancy (automatization, learnability, complexity, understandability), social influence (competitor analysis, collegial advice, community size, community responsiveness), facilitating conditions (suitability, updates, modularity, isolation, extensibility), and price value. A combination of four actors, which are customer, developer, team, and team leader, leads to the choice. Our model contributes to the body of knowledge related to the adoption of technology by software engineers. As a practical implication, our model is useful for decision makers when evaluating JavaScript frameworks, as well as for developers for producing desirable frameworks."
Supporting the analyzability of architectural component models - empirical findings and tool support,"This article discusses the understandability of component models that are frequently used as central views in architectural descriptions of software systems. We empirically examine how different component level metrics and the participants’ experience and expertise can be used to predict the understandability of those models. In addition, we develop a tool that supports applying the obtained empirical findings in practice. Our results show that the prediction models have a large effect size, which means that their prediction strength is of high practical significance. The participants’ experience plays an important role in the prediction but the obtained models are not as accurate as the models that use the component level metrics. The developed tools combine the DSL-based architecture abstraction approach with the obtained empirical findings. While the DSL-based architecture abstraction approach enables software architects to keep source code and architecture consistent, the metrics extensions enable them, while working with the DSL, to continuously judge and improve the analyzability of architectural component models based on the understandability of their individual components they create with the DSL. Provided metrics extensions can also help in assessing how much each architectural rule used to specify the DSL affects the understandability of a component which enables for instance finding the rules that contribute the most to a limited understandability. Finally, our approach supports change impact analysis, i.e., the identification of changes that affect different analyzability levels of the component models. We studied the applicability of our approach in a case study of an existing open source system."
Four commentaries on the use of students and professionals in empirical software engineering experiments,
RETRACTED ARTICLE: Facilitating debugging of web applications through recording reduction,
Early prediction of merged code changes to prioritize reviewing tasks,"Modern Code Review (MCR) has been widely used by open source and proprietary software projects. Inspecting code changes consumes reviewers much time and effort since they need to comprehend patches, and many reviewers are often assigned to review many code changes. Note that a code change might be eventually abandoned, which causes waste of time and effort. Thus, a tool that predicts early on whether a code change will be merged can help developers prioritize changes to inspect, accomplish more things given tight schedule, and not waste reviewing effort on low quality changes. In this paper, motivated by the above needs, we build a merged code change prediction tool. Our approach first extracts 34 features from code changes, which are grouped into 5 dimensions: code, file history, owner experience, collaboration network, and text. And then we leverage machine learning techniques such as random forest to build a prediction model. To evaluate the performance of our approach, we conduct experiments on three open source projects (i.e., Eclipse, LibreOffice, and OpenStack), containing a total of 166,215 code changes. Across three datasets, our approach statistically significantly improves random guess classifiers and two prediction models proposed by Jeong et al. (2009) and Gousios et al. (2014) in terms of several evaluation metrics. Besides, we also study the important features which distinguish merged code changes from abandoned ones."
Studying and detecting log-related issues,"Logs capture valuable information throughout the execution of software systems. The rich knowledge conveyed in logs is highly leveraged by researchers and practitioners in performing various tasks, both in software development and its operation. Log-related issues, such as missing or having outdated information, may have a large impact on the users who depend on these logs. In this paper, we first perform an empirical study on log-related issues in two large-scale, open source software systems. We find that the files with log-related issues have undergone statistically significantly more frequent prior changes, and bug fixes. We also find that developers fixing these log-related issues are often not the ones who introduced the logging statement nor the owner of the method containing the logging statement. Maintaining logs is more challenging without clear experts. Finally, we find that most of the defective logging statements remain unreported for a long period (median 320 days). Once reported, the issues are fixed quickly (median five days). Our empirical findings suggest the need for automated tools that can detect log-related issues promptly. We conducted a manual study and identified seven root-causes of the log-related issues. Based on these root causes, we developed an automated tool that detects four evident types of log-related issues. Our tool can detect 75 existing inappropriate logging statements reported in 40 log-related issues. We also reported new issues found by our tool to developers and 38 previously unknown issues in the latest release of the subject systems were accepted by developers."
A systematic approach for performance assessment using process mining,"Software performance engineering is a mature field that offers methods to assess system performance. Process mining is a promising research field applied to gain insight on system processes. The interplay of these two fields opens promising applications in the industry. In this work, we report our experience applying a methodology, based on process mining techniques, for the performance assessment of a commercial data-intensive software application. The methodology has successfully assessed the scalability of future versions of this system. Moreover, it has identified bottlenecks components and replication needs for fulfilling business rules. The system, an integrated port operations management system, has been developed by Prodevelop, a medium-sized software enterprise with high expertise in geospatial technologies. The performance assessment has been carried out by a team composed by practitioners and researchers. Finally, the paper offers a deep discussion on the lessons learned during the experience, that will be useful for practitioners to adopt the methodology and for researcher to find new routes."
Comparison of release engineering practices in a large mature company and a startup,"Modern release engineering practices provide multiple benefits for software companies, but organizations have struggled when trying to adopt the most advanced practices, such as continuous delivery. It is not known in which contexts the most advanced practices are applicable and what can be achieved by adopting them. In this study, we discuss the effect of the organizational context on adopted release engineering practices and what outcomes are achieved with the practices. We study two organizational contexts: the startup and the large mature company context. The effect of the product context is mitigated by studying two case organizations with similar products, a rare research opportunity. We performed 18 interviews with various roles in the case organizations. The number of production environments, the number of customers, the control over the production environment, the available resources, the organization size and the distribution of the organization affected the release engineering practices and the ability to release frequently. Having less internal verification and more customer verification enabled fast feedback and customer experimentation in the startup context, but increased the number of production defects. However, having more internal verification in the large mature company context surprisingly did not prevent production defects. The organizational context had a large effect on how achievable modern release engineering practices, such as continuous delivery, were. In the startup context, the lack of resources was the main factor hindering the improvement of release engineering practices, while in the large mature company context, the number of stakeholders and products were the main factors."
An industrial case study on the use of UML in software maintenance and its perceived benefits and hurdles,"UML is a commonly-used graphical language for the modelling of software. Works regarding UML’s effectiveness have studied projects that develop software systems from scratch. Yet the maintenance of software consumes a large share of the overall time and effort required to develop software systems. This study, therefore, focuses on the use of UML in software maintenance. We wish to elicit the practices of the software modelling used during maintenance in industry and understand what are perceived as hurdles and benefits when using modelling. In order to achieve a high level of realism, we performed a case study in a multinational company’s ICT department. The analysis is based on 31 interviews with employees who work on software maintenance projects. The interviewees played different roles and provided complementary views about the use, hurdles and benefits of software modelling and the use of UML. Our study uncovered a broad range of modelling-related practices, which are presented in a theoretical framework that illustrates how these practices are linked to the specific goals and context of software engineering projects. We present a list of recommended practices that contribute to the increased effectiveness of software modelling. The use of software modelling notations (like UML) is considered beneficial for software maintenance, but needs to be tailored to its context. Various practices that contribute to the effective use of modelling are commonly overlooked, suggesting that a more conscious holistic approach with which to integrate modelling practices into the overall software engineering approach is required."
Studying the consistency of star ratings and the complaints in 1 & 2-star user reviews for top free cross-platform Android and iOS apps,"How users rate a mobile app via star ratings and user reviews is of utmost importance for the success of an app. Recent studies and surveys show that users rely heavily on star ratings and user reviews that are provided by other users, for deciding which app to download. However, understanding star ratings and user reviews is a complicated matter, since they are influenced by many factors such as the actual quality of the app and how the user perceives such quality relative to their expectations, which are in turn influenced by their prior experiences and expectations relative to other apps on the platform (e.g., iOS versus Android). Nevertheless, star ratings and user reviews provide developers with valuable information for improving the overall impression of their app. In an effort to expand their revenue and reach more users, app developers commonly build cross-platform apps, i.e., apps that are available on multiple platforms. As star ratings and user reviews are of such importance in the mobile app industry, it is essential for developers of cross-platform apps to maintain a consistent level of star ratings and user reviews for their apps across the various platforms on which they are available. In this paper, we investigate whether cross-platform apps achieve a consistent level of star ratings and user reviews. We manually identify 19 cross-platform apps and conduct an empirical study on their star ratings and user reviews. By manually tagging 9,902 1 & 2-star reviews of the studied cross-platform apps, we discover that the distribution of the frequency of complaint types varies across platforms. Finally, we study the negative impact ratio of complaint types and find that for some apps, users have higher expectations on one platform. All our proposed techniques and our methodologies are generic and can be used for any app. Our findings show that at least 79% of the studied cross-platform apps do not have consistent star ratings, which suggests that different quality assurance efforts need to be considered by developers for the different platforms that they wish to support."
APIReal: an API recognition and linking approach for online developer forums,"When discussing programming issues on social platforms (e.g, Stack Overflow, Twitter), developers often mention APIs in natural language texts. Extracting API mentions from natural language texts serves as the prerequisite to effective indexing and searching for API-related information in software engineering social content. The task of extracting API mentions from natural language texts involves two steps: 1) distinguishing API mentions from other English words (i.e., API recognition), 2) disambiguating a recognized API mention to its unique fully qualified name (i.e., API linking). Software engineering social content lacks consistent API mentions and sentence writing format. As a result, API recognition and linking have to deal with the inherent ambiguity of API mentions in informal text, for example, due to the ambiguity between the API sense of a common word and the normal sense of the word (e.g., append, apply and merge), the simple name of an API can map to several APIs of the same library or of different libraries, or different writing forms of an API should be linked to the same API. In this paper, we propose a semi-supervised machine learning approach that exploits name synonyms and rich semantic context of API mentions for API recognition in informal text. Based on the results of our API recognition approach, we further propose an API linking approach leveraging a set of domain-specific heuristics, including mention-mention similarity, scope filtering, and mention-entry similarity, to determine which API in the knowledge base a recognized API actually refers to. To evaluate our API recognition approach, we use 1205 API mentions of three libraries (Pandas, Numpy, and Matplotlib) from Stack Overflow text. We also evaluate our API linking approach with 120 recognized API mentions of these three libraries."
An empirical study of Android Wear user complaints,"Wearable apps are becoming increasingly popular in recent years. Nevertheless, to date, very few studies have examined the issues that wearable apps face. Prior studies showed that user reviews contain a plethora of insights that can be used to understand quality issues and help developers build better quality mobile apps. Therefore, in this paper, we mine user reviews in order to understand the user complaints about wearable apps. We manually sample and categorize 2,667 reviews from 19 Android wearable apps. Additionally, we examine the replies posted by developers in response to user complaints. This allows us to determine the type of complaints that developers care about the most, and to identify problems that despite being important to users, do not receive a proper response from developers. Our findings indicate that the most frequent complaints are related to Functional Errors, Cost, and Lack of Functionality, whereas the most negatively impacting complaints are related to Installation Problems, Device Compatibility, and Privacy & Ethical Issues. We also find that developers mostly reply to complaints related to Privacy & Ethical Issues, Performance Issues, and notification related issues. Furthermore, we observe that when developers reply, they tend to provide a solution, request more details, or let the user know that they are working on a solution. Lastly, we compare our findings on wearable apps with the study done by Khalid et al. (2015) on handheld devices. From this, we find that some complaint types that appear in handheld apps also appear in wearable apps; though wearable apps have unique issues related to Lack of Functionality, Installation Problems, Connection & Sync, Spam Notifications, and Missing Notifications. Our results highlight the issues that users of wearable apps face the most, and the issues to which developers should pay additional attention to due to their negative impact."
Using human error information for error prevention,"Developing error-free software requirements is of critical importance to the success of a software project. Problems that occur during requirements collection and specification, if not fixed early, are costly to fix later. Therefore, it is important to develop techniques that help requirements engineers detect and prevent requirements problems. As a human-centric activity, requirements engineering can be influenced by psychological research about human errors, which are the failings of human cognition during the process of planning and executinge a task. We have employed human error research to describe the types of problems that occur during requirements engineering. The goals of this research are: (1) to evaluate whether understanding human errors contributes to the prevention of errors and concomitant faults during requirements engineering and (2) to identify error prevention techniques used in industrial practice. We conducted a controlled classroom experiment to evaluate the benefits that knowledge of errors has on error prevention. We then analyzed data from two industrial surveys to identify specific prevention and mitigation approaches employed in practice. The classroom study showed that the better a requirements engineer understands human errors, the fewer errors and concomitant faults that engineer makes when developing a new requirements document. Furthermore, different types of Human Errors have different impacts on fault prevention. The industry study results identified prevention and mitigation mechanisms for each error type. Human error information is useful for fault prevention during requirements engineering. There are practices that requirements engineers can employ to prevent or mitigate specific human errors."
On the challenges of open-sourcing proprietary software projects,"The open source software (OSS) movement has become widely recognized as an effective way to deliver software. Even big software companies, well-known for being restrictive when it comes to publishing their source code artifacts, have recently adopted open source initiatives and released for general use the source code of some of their most notable products. We conducted an exploratory study on merits of the widespread belief that open-sourcing a proprietary software project will attract external developers, like casual contributors, and therefore improve software quality (e.g., “given enough eyeballs, all bugs are shallow”). By examining the pre- and post-migration software history of eight active, popular, non-trivial proprietary projects that became open source, we characterize the phenomenon and identify some challenges. Contrary to what many believe, we found that only a few projects experienced a growth in newcomers, contributions, and popularity; furthermore, this growth does not last long. The results from the study can be useful for helping software companies to better understand the hidden challenges of open-sourcing their software projects to attract external developers."
System requirements-OSS components: matching and mismatch resolution practices – an empirical study,"Developing systems by integrating Open Source Software (OSS) is increasingly gaining importance in the software industry. Although the literature claims that this approach highly impacts Requirements Engineering (RE) practices, there is a lack of empirical evidence to demonstrate this statement. To explore and understand problems and challenges of current system requirement–OSS component matching and mismatches resolution practices in software development projects that integrate one or more OSS components into their software products. Semi-structured in-depth interviews with 25 respondents that have performed RE activities in software development projects that integrate OSS components in 25 different software development companies in Spain, Norway, Sweden, and Denmark. The study uncovers 15 observations regarding system requirements-OSS components matching and mismatch resolution practices used in industrial projects that integrate OSS components. The assessed projects focused mainly on pre-release stages of software applications that integrate OSS components in an opportunistic way. The results also provide details of a set of previously unexplored scenarios when solving system requirement–OSS component mismatches; and clarify some challenges and related problems. For instance, although licensing issues and the potential changes in OSS components by their corresponding communities and/or changes in system requirements have been greatly discussed in the RE literature as problems for OSS component integration, they did not appear to be relevant in our assessed projects. Instead, practitioners highlighted the problem of getting suitable OSS component documentation/information."
Foreword to the special issue on empirical research in requirements engineering,
Finding better active learners for faster literature reviews,"Literature reviews can be time-consuming and tedious to complete. By cataloging and refactoring three state-of-the-art active learning techniques from evidence-based medicine and legal electronic discovery, this paper finds and implements FASTREAD, a faster technique for studying a large corpus of documents, combining and parametrizing the most efficient active learning algorithms. This paper assesses FASTREAD using datasets generated from existing SE literature reviews (Hall, Wahono, Radjenović, Kitchenham et al.). Compared to manual methods, FASTREAD lets researchers find 95% relevant studies after reviewing an order of magnitude fewer papers. Compared to other state-of-the-art automatic methods, FASTREAD reviews 20–50% fewer studies while finding same number of relevant primary studies in a systematic literature review."
Detecting requirements defects with NLP patterns: an industrial experience in the railway domain,"In the railway safety-critical domain requirements documents have to abide to strict quality criteria. Rule-based natural language processing (NLP) techniques have been developed to automatically identify quality defects in natural language requirements. However, the literature is lacking empirical studies on the application of these techniques in industrial settings. Our goal is to investigate to which extent NLP can be practically applied to detect defects in the requirements documents of a railway signalling manufacturer. To address this goal, we first identified a set of typical defects classes, and, for each class, an engineer of the company implemented a set of defect-detection patterns by means of the GATE tool for text processing. After a preliminary analysis, we applied the patterns to a large set of 1866 requirements previously annotated for defects. The output of the patterns was further inspected by two domain experts to check the false positive cases. Additional discard-patterns were defined to automatically remove these cases. Finally, SREE, a tool that searches for typically ambiguous terms, was applied to the requirements. The experiments show that SREE and our patterns may play complementary roles in the detection of requirements defects. This is one of the first works in which defect detection NLP techniques are applied on a very large set of industrial requirements annotated by domain experts. We contribute with a comparison between traditional manual techniques used in industry for requirements analysis, and analysis performed with NLP. Our experience shows that several discrepancies can be observed between the two approaches. The analysis of the discrepancies offers hints to improve the capabilities of NLP techniques with company specific solutions, and suggests that also company practices need to be modified to effectively exploit NLP tools."
