title,abstract
A systemic framework for crowdsourced test report quality assessment,"In crowdsourced mobile application testing, crowd workers perform test tasks for developers and submit test reports to report the observed abnormal behaviors. These test reports usually provide important information to improve the quality of software. However, due to the poor expertise of workers and the inconvenience of editing on mobile devices, some test reports usually lack necessary information for understanding and reproducing the revealed bugs. Sometimes developers have to spend a significant part of available resources to handle the low-quality test reports, thus severely reducing the inspection efficiency. In this paper, to help developers determine whether a test report should be selected for inspection within limited resources, we issue a new problem of test report quality assessment. Aiming to model the quality of test reports, we propose a new framework named TERQAF. First, we systematically summarize some desirable properties to characterize expected test reports and define a set of measurable indicators to quantify these properties. Then, we determine the numerical values of indicators according to the contained contents of test reports. Finally, we train a classifier by using logistic regression to predict the quality of test reports. To validate the effectiveness of TERQAF, we conduct extensive experiments over five crowdsourced test report datasets. Experimental results show that TERQAF can achieve 85.18% in terms of Macro-average Precision (MacroP), 75.87% in terms of Macro-average Recall (MacroR), and 80.01% in terms of Macro-average F-measure (MacroF) on average in test report quality assessment. Meanwhile, the empirical results also demonstrate that test report quality assessment can help developers handle test reports more efficiently."
Guest Editorial: Special Issue on Predictive Models and Data Analytics in Software Engineering,
How developers engage with static analysis tools in different contexts,"Automatic static analysis tools (ASATs) are instruments that support code quality assessment by automatically detecting defects and design issues. Despite their popularity, they are characterized by (i) a high false positive rate and (ii) the low comprehensibility of the generated warnings. However, no prior studies have investigated the usage of ASATs in different development contexts (e.g., code reviews, regular development), nor how open source projects integrate ASATs into their workflows. These perspectives are paramount to improve the prioritization of the identified warnings. To shed light on the actual ASATs usage practices, in this paper we first survey 56 developers (66% from industry and 34% from open source projects) and interview 11 industrial experts leveraging ASATs in their workflow with the aim of understanding how they use ASATs in different contexts. Furthermore, to investigate how ASATs are being used in the workflows of open source projects, we manually inspect the contribution guidelines of 176 open-source systems and extract the ASATs’ configuration and build files from their corresponding GitHub repositories. Our study highlights that (i) 71% of developers do pay attention to different warning categories depending on the development context; (ii) 63% of our respondents rely on specific factors (e.g., team policies and composition) when prioritizing warnings to fix during their programming; and (iii) 66% of the projects define how to use specific ASATs, but only 37% enforce their usage for new contributions. The perceived relevance of ASATs varies between different projects and domains, which is a sign that ASATs use is still not a common practice. In conclusion, this study confirms previous findings on the unwillingness of developers to configure ASATs and it emphasizes the necessity to improve existing strategies for the selection and prioritization of ASATs warnings that are shown to developers."
An experimental scrutiny of visual design modelling: VCL up against UML+OCL,"The graphical nature of prominent modelling notations, such as the standards UML and SysML, enables them to tap into the cognitive benefits of diagrams. However, these notations hardly exploit the cognitive potential of diagrams and are only partially graphical with invariants and operations being expressed textually. The Visual Contract Language (VCL) aims at improving visual modelling; it tries to (a) maximise diagrammatic cognitive effectiveness, (b) increase visual expressivity, and (c) level of rigour and formality. It is an alternative to UML that does largely pictorially what is traditionally done textually. The paper presents the results of a controlled experiment carried out four times in different academic settings and involving 43 participants, which compares VCL against UML and OCL and whose goal is to provide insight on benefits and limitations of visual modelling. The paper’s hypotheses are evaluated using a crossover design with the following tasks: (i) modelling of state space, invariants and operations, (ii) comprehension of modelled problem, (iii) detection of model defects and (iv) comprehension of a given model. Although visual approaches have been used and advocated for decades, this is the first empirical investigation looking into the effects of graphical expression of invariants and operations on modelling and model usage tasks. Results suggest VCL benefits in defect detection, model comprehension, and modelling of operations, providing some empirical evidence on the benefits of graphical software design."
Predicting software defect type using concept-based classification,"Automatically predicting the defect type of a software defect from its description can significantly speed up and improve the software defect management process. A major challenge for the supervised learning based current approaches for this task is the need for labeled training data. Creating such data is an expensive and effort-intensive task requiring domain-specific expertise. In this paper, we propose to circumvent this problem by carrying out concept-based classification (CBC) of software defect reports with help of the Explicit Semantic Analysis (ESA) framework. We first create the concept-based representations of a software defect report and the defect types in the software defect classification scheme by projecting their textual descriptions into a concept-space spanned by the Wikipedia articles. Then, we compute the “semantic” similarity between these concept-based representations and assign the software defect type that has the highest similarity with the defect report. The proposed approach achieves accuracy comparable to the state-of-the-art semi-supervised and active learning approach for this task without requiring labeled training data. Additional advantages of the CBC approach are: (i) unlike the state-of-the-art, it does not need the source code used to fix a software defect, and (ii) it does not suffer from the class-imbalance problem faced by the supervised learning paradigm."
How bugs are born: a model to identify how bugs are introduced in software components,"When identifying the origin of software bugs, many studies assume that “a bug was introduced by the lines of code that were modified to fix it”. However, this assumption does not always hold and at least in some cases, these modified lines are not responsible for introducing the bug. For example, when the bug was caused by a change in an external API. The lack of empirical evidence makes it impossible to assess how important these cases are and therefore, to which extent the assumption is valid. To advance in this direction, and better understand how bugs “are born”, we propose a model for defining criteria to identify the first snapshot of an evolving software system that exhibits a bug. This model, based on the perfect test idea, decides whether a bug is observed after a change to the software. Furthermore, we studied the model’s criteria by carefully analyzing how 116 bugs were introduced in two different open source software projects. The manual analysis helped classify the root cause of those bugs and created manually curated datasets with bug-introducing changes and with bugs that were not introduced by any change in the source code. Finally, we used these datasets to evaluate the performance of four existing SZZ-based algorithms for detecting bug-introducing changes. We found that SZZ-based algorithms are not very accurate, especially when multiple commits are found; the F-Score varies from 0.44 to 0.77, while the percentage of true positives does not exceed 63%. Our results show empirical evidence that the prevalent assumption, “a bug was introduced by the lines of code that were modified to fix it”, is just one case of how bugs are introduced in a software system. Finding what introduced a bug is not trivial: bugs can be introduced by the developers and be in the code, or be created irrespective of the code. Thus, further research towards a better understanding of the origin of bugs in software projects could help to improve design integration tests and to design other procedures to make software development more robust."
CAPS: a supervised technique for classifying Stack Overflow posts concerning API issues,"The design and maintenance of APIs (Application Programming Interfaces) are complex tasks due to the constantly changing requirements of their users. Despite the efforts of their designers, APIs may suffer from a number of issues (such as incomplete or erroneous documentation, poor performance, and backward incompatibility). To maintain a healthy client base, API designers must learn these issues to fix them. Question answering sites, such as Stack Overflow (SO), have become a popular place for discussing API issues. These posts about API issues are invaluable to API designers, not only because they can help to learn more about the problem but also because they can facilitate learning the requirements of API users. However, the unstructured nature of posts and the abundance of non-issue posts make the task of detecting SO posts concerning API issues difficult and challenging. In this paper, we first develop a supervised learning approach using a Conditional Random Field (CRF), a statistical modeling method, to identify API issue-related sentences. We use the above information together with different features collected from posts, the experience of users, readability metrics and centrality measures of collaboration network to build a technique, called CAPS, that can classify SO posts concerning API issues. In total, we consider 34 features along eight different dimensions. Evaluation of CAPS using carefully curated SO posts on three popular API types reveals that the technique outperforms all three baseline approaches we consider in this study. We then conduct studies to find important features and also evaluate the performance of the CRF-based technique for classifying issue sentences. Comparison with two other baseline approaches shows that the technique has high potential. We also test the generalizability of CAPS results, evaluate the effectiveness of different classifiers, and identify the impact of different feature sets."
On the impact of using trivial packages: an empirical case study on npm and PyPI,"Code reuse has traditionally been encouraged since it enables one to avoid re-inventing the wheel. Due to the npm left-pad package incident where a trivial package led to the breakdown of some of the most popular web applications such as Facebook and Netflix, some questioned such reuse. Reuse of trivial packages is particularly prevalent in platforms such as npm. To date, there is no study that examines the reason why developers reuse trivial packages other than in npm. Therefore, in this paper, we study two large platforms npm and PyPI. We mine more than 500,000 npm packages and 38,000 JavaScript applications and more than 63,000 PyPI packages and 14,000 Python applications to study the prevalence of trivial packages. We found that trivial packages are common, making up between 16.0% to 10.5% of the studied platforms. We performed surveys with 125 developers who use trivial packages to understand the reasons and drawbacks of their use. Our surveys revealed that trivial packages are used because they are perceived to be well implemented and tested pieces of code. However, developers are concerned about maintaining and the risks of breakages due to the extra dependencies trivial packages introduce. To objectively verify the survey results, we validate the most cited reason and drawback. We find that contrary to developers’ beliefs only around 28% of npm and 49% PyPI trivial packages have tests. However, trivial packages appear to be ‘deployment tested’ and to have similar test, usage and community interest as non-trivial packages. On the other hand, we found that 18.4% and 2.9% of the studied trivial packages have more than 20 dependencies in npm and PyPI, respectively."
You broke my code: understanding the motivations for breaking changes in APIs,"As most software systems, libraries and frameworks also evolve, which may break existing clients. However, the main reasons to introduce breaking changes in APIs are unclear. Therefore, in this paper, we first report the results of an almost 4-month long field study with popular Java libraries and frameworks. We configured an infrastructure to observe all changes in these libraries and to detect breaking changes shortly after their introduction in the code. We detected possible breaking changes in 61 projects. After identifying breaking changes, we asked the developers to explain the reasons behind their decision to change the APIs. By analyzing the developers’ answers, we report that breaking changes are mostly motivated by the need to implement new features, by the desire to make the APIs simpler and with fewer elements, and to improve maintainability. To complement this first study, we describe a second study, including the analysis of 110 Stack Overflow posts related to breaking changes. We reveal that breaking changes have an important impact on clients, since 45% of the questions are from clients asking how to overcome specific breaking changes; they are also common in other ecosystems—JavaScript, .NET, etc. We conclude by providing suggestions to language designers, tool builders, software engineering researchers, and API developers."
Code Localization in Programming Screencasts,"Programming screencasts are growing in popularity and are often used by developers as a learning source. The source code shown in these screencasts is often not available for download or copy-pasting. Without having the code readily available, developers have to frequently pause a video to transcribe the code. This is time-consuming and reduces the effectiveness of learning from videos. Recent approaches have applied Optical Character Recognition (OCR) techniques to automatically extract source code from programming screencasts. One of their major limitations, however, is the extraction of noise such as the text information in the menu, package hierarchy, etc. due to the imprecise approximation of the code location on the screen. This leads to incorrect, unusable code. We aim to address this limitation and propose an approach to significantly improve the accuracy of code localization in programming screencasts, leading to a more precise code extraction. Our approach uses a Convolutional Neural Network to automatically predict the exact location of code in an image. We evaluated our approach on a set of frames extracted from 450 screencasts covering Java, C#, and Python programming topics. The results show that our approach is able to detect the area containing the code with 94% accuracy and that our approach significantly outperforms previous work. We also show that applying OCR on the code area identified by our approach leads to a 97% match with the ground truth on average, compared to only 31% when OCR is applied to the entire frame."
"Cross-version defect prediction: use historical data, cross-project data, or both?","ContextAlthough a long-running project has experienced many releases, removing defects from a product is still a challenge. Cross-version defect prediction (CVDP) regards project data of prior releases as a useful source for predicting fault-prone modules based on defect prediction techniques. Recent studies have explored cross-project defect prediction (CPDP) that uses the project data from outside a project for defect prediction. While CPDP techniques and CPDP data can be diverted to CVDP, its effectiveness has not been investigated.ObjectiveTo investigate whether CPDP approaches and CPDP data are useful for CVDP. The investigation also compared the usage of prior release data.MethodWe chose a style of replication of a previous comparative study on CPDP approaches.ResultsSome CPDP approaches could improve the performance of CVDP. The use of the latest prior release was the best choice. If one has no CVDP data, the use of CPDP data for CVDP was found to be effective.Conclusions1) Some CPDP approaches could improve CVDP, 2), if one can access project data from the latest release, project data from older releases would not bring clear benefit, and 3) even if one has no CVDP data, appropriate CPDP approaches would be able to deliver quality prediction with CPDP data."
ALFAA: Active Learning Fingerprint based Anti-Aliasing for correcting developer identity errors in version control systems,"An accurate determination of developer identities is important for software engineering research and practice. Without it, even simple questions such as “how many developers does a project have?” cannot be answered. The commonly used version control data from Git is full of identity errors and the existing approaches to correct these errors are difficult to validate on large scale and cannot be easily improved. We, therefore, aim to develop a scalable, highly accurate, easy to use and easy to improve approach to correct software developer identity errors. We first amalgamate developer identities from version control systems in open source software repositories and investigate the nature and prevalence of these errors, design corrective algorithms, and estimate the impact of the errors on networks inferred from this data. We investigate these questions using a collection of over 1B Git commits with over 23M recorded author identities. By inspecting the author strings that occur most frequently, we group identity errors into categories. We then augment the author strings with three behavioral fingerprints: time-zone frequencies, the set of files modified, and a vector embedding of the commit messages. We create a manually validated set of identities for a subset of OpenStack developers using an active learning approach and use it to fit supervised learning models to predict the identities for the remaining author strings in OpenStack. We then compare these predictions with a competing commercially available effort and a leading research method. Finally, we compare network measures for file-induced author networks based on corrected and raw data. We find commits done from different environments, misspellings, organizational ids, default values, and anonymous IDs to be the major sources of errors. We also find supervised learning methods to reduce errors by several times in comparison to existing research and commercial methods and the active learning approach to be an effective way to create validated datasets. Results also indicate that correction of developer identity has a large impact on the inference of the social network. We believe that our proposed Active Learning Fingerprint Based Anti-Aliasing (ALFAA) approach will expedite research progress in the software engineering domain for applications that involve developer identities."
"Guest editorial: special section on software analysis, evolution, and reengineering",
Meshing agile and plan-driven development in safety-critical software: a case study,"Organizations developing safety-critical software are increasingly seeking to create better practices by meshing agile and plan-driven development processes. Significant differences between the agile and the plan-driven processes make meshing difficult, and very little empirical evidence on using agile processes for safety-critical software development exists. There are four areas of concern, in particular, for meshing the development of safety-critical software concerning: documentation, requirements, life cycle and testing. We report on a case study of a pharmaceutical organization in which a Scrum process was implemented to support agile software development in a plan-driven safety-critical project. The purpose was to answer the following research question: For safety-critical software, what can a software team do to mesh agile and plan-driven processes effectively? The main contribution of the paper is an elaborated understanding of meshing in the four areas of concern and how the conditions for safety-critical software influence them. We discuss how meshing within the four areas of concern is a contribution to existing research."
Measuring the accuracy of software vulnerability assessments: experiments with students and professionals,"Assessing the risks of software vulnerabilities is a key process of software development and security management. This assessment requires to consider multiple factors (technical features, operational environment, involved assets, status of the vulnerability lifecycle, etc.) and may depend from the assessor’s knowledge and skills. In this work, we tackle with an important part of this problem by measuring the accuracy of technical vulnerability assessments by assessors with different level and type of knowledge. We report an experiment to compare how accurately students with different technical education and security professionals are able to assess the severity of software vulnerabilities with the Common Vulnerability Scoring System (v3) industry methodology. Our results could be useful for increasing awareness about the intrinsic subtleties of vulnerability risk assessment and possibly better compliance with regulations. With respect to academic education, professional training and human resources selections our work suggests that measuring the effects of knowledge and expertise on the accuracy of software security assessments is feasible albeit not easy."
2019 Reviewer Acknowledgment,
Deriving a usage-independent software quality metric,"ContextThe extent of post-release use of software affects the number of faults, thus biasing quality metrics and adversely affecting associated decisions. The proprietary nature of usage data limited deeper exploration of this subject in the past.ObjectiveTo determine how software faults and software use are related and how, based on that, an accurate quality measure can be designed.MethodVia Google Analytics we measure new users, usage intensity, usage frequency, exceptions, and release date and duration for complex proprietary mobile applications for Android and iOS. We utilize Bayesian Network and Random Forest models to explain the interrelationships and to derive the usage independent release quality measure. To increase external validity, we also investigate the interrelationship among various code complexity measures, usage (downloads), and number of issues for 520 NPM packages. We derived a usage-independent quality measure from these analyses, and applied it on 4430 popular NPM packages to construct timelines for comparing the perceived quality (number of issues) and our derived measure of quality during the lifetime of these packages.ResultsWe found the number of new users to be the primary factor determining the number of exceptions, and found no direct link between the intensity and frequency of software usage and software faults. Crashes increased with the power of 1.02-1.04 of new user for the Android app and power of 1.6 for the iOS app. Release quality expressed as crashes per user was independent of other usage-related predictors, thus serving as a usage independent measure of software quality. Usage also affected quality in NPM, where downloads were strongly associated with numbers of issues, even after taking the other code complexity measures into consideration. Unlike in mobile case where exceptions per user decrease over time, for 45.8% of the NPM packages the number of issues per download increase.ConclusionsWe expect our result and our proposed quality measure will help gauge release quality of a software more accurately and inspire further research in this area."
