title,abstract
Tracing distributed collaborative development in apache software foundation projects,"Developing and maintaining large software systems typically requires that developers collaborate on many tasks. During such collaborations, when multiple people work on the same chunk of code at the same time, they communicate with each other and employ safeguards in various ways. Recent studies have considered group co-development in OSS projects and found that it is an essential part of many projects. However, those studies were limited to groups of size two, i.e., pairs of developers. Here we go further and characterize co-development in larger groups. We develop an effective methodology for capturing distributed collaboration beyond groups of size two, based on synchronized commit activities among multiple developers, and apply it to data from 26 OSS projects from the Apache Software Foundation. We find that distributed collaborations is prevalent, but not as frequent as expected. We also find that while in distributed collaborative groups, developers’ behavior is different than when programming alone, e.g., high developer focus on specific code packages associates with lower team participation, while packages with higher ownership get less attention from groups than from individuals. Finally, we show that productivity effort during co-development is more often lower for developers while they co-develop in groups. To verify our results we use both quantitative and qualitative methods, including a developer survey. We conclude that these methods and results can be used to understand the effects of the collaborative dynamic in OSS teams on the software engineering process. Our code, along with our datasets and survey is available at http://www.gharehyazie.com/supplementary/teamwork/."
Will this localization tool be effective for this bug? Mitigating the impact of unreliability of information retrieval based bug localization tools,"Information retrieval (IR) based bug localization approaches process a textual bug report and a collection of source code files to find buggy files. They output a ranked list of files sorted by their likelihood to contain the bug. Recently, several IR-based bug localization tools have been proposed. However, there are no perfect tools that can successfully localize faults within a few number of most suspicious program elements for every single input bug report. Therefore, it is difficult for developers to decide which tool would be effective for a given bug report. Furthermore, for some bug reports, no bug localization tools would be useful. Even a state-of-the-art bug localization tool outputs many ranked lists where buggy files appear very low in the lists. This potentially causes developers to distrust bug localization tools. In this work, we build an oracle that can automatically predict whether a ranked list produced by an IR-based bug localization tool is likely to be effective or not. We consider a ranked list to be effective if a buggy file appears in the top-N position of the list. If a ranked list is unlikely to be effective, developers do not need to waste time in checking the recommended files one by one. In such cases, it is better for developers to use traditional debugging methods or request for further information to localize bugs. To build this oracle, our approach extracts features that can be divided into four categories: score features, textual features, topic model features, and metadata features. We build a separate prediction model for each category, and combine them to create a composite prediction model which is used as the oracle. We name this solution APRILE, which stands for Automated PRediction of IR-based Bug Localization’s Effectiveness. We further integrate APRILE with two other components that are learned using our bagging-based ensemble classification (BEC) method. We refer to the extension of APRILE as APRILE +. We have evaluated APRILE + to predict the effectiveness of three state-of-the-art IR-based bug localization tools on more than three thousands bug reports from AspectJ, Eclipse, SWT, and Tomcat. APRILE + can achieve an average precision, recall, and F-measure of 77.61 %, 88.94 %, and 82.09 %, respectively. Furthermore, APRILE + outperforms a baseline approach by Le and Lo and APRILE by up to a 17.43 % and 10.51 % increase in F-measure respectively."
Effectiveness and efficiency of a domain-specific language for high-performance marine ecosystem simulation: a controlled experiment,"It is a long-standing hypothesis that the concise and customized notation of a DSL improves the performance of developers when compared with a GPL. For non-technical domains—e.g., science—, this hypothesis lacks empirical evidence. Given this lack of empirical evidence, we evaluate a DSL for ecological modeling designed and implemented by us with regard to performance improvements of developers as compared to a GPL. We conduct an online survey with embedded controlled experiments among ecologists to assess the correctness and time spent of the participants when using a DSL for ecosystem simulation specifications compared with a GPL-based solution. We observe that (1) solving tasks with the DSL, the participants’ correctness point score was —depending on the task— on average 61 % up to 63 % higher than with the GPL-based solution and their average time spent per task was reduced by 31 % up to 56 %; (2) the participants subjectively find it easier to work with the DSL, and (3) more than 90 % of the subjects are able to carry out basic maintenance tasks concerning the infrastructure of the DSL used in our treatment, which is based on another internal DSL embedded into Java. The tasks of our experiments are simplified and our web-based editor components do not offer full IDE-support. Our findings indicate that the development of further DSL for the specific needs of the ecological modeling community should be a worthwhile investment to increase its members’ productivity and to enhance the reliability of their scientific results."
Evolutionary trends of developer coordination: a network approach,"Software evolution is a fundamental process that transcends the realm of technical artifacts and permeates the entire organizational structure of a software project. By means of a longitudinal empirical study of 18 large open-source projects, we examine and discuss the evolutionary principles that govern the coordination of developers. By applying a network-analytic approach, we found that the implicit and self-organizing structure of developer coordination is ubiquitously described by non-random organizational principles that defy conventional software-engineering wisdom. In particular, we found that: (a) developers form scale-free networks, in which the majority of coordination requirements arise among an extremely small number of developers, (b) developers tend to accumulate coordination requirements with more and more developers over time, presumably limited by an upper bound, and (c) initially developers are hierarchically arranged, but over time, form a hybrid structure, in which core developers are hierarchically arranged and peripheral developers are not. Our results suggest that the organizational structure of large projects is constrained to evolve towards a state that balances the costs and benefits of developer coordination, and the mechanisms used to achieve this state depend on the project’s scale."
Identifying the implied: Findings from three differentiated replications on the use of security requirements templates,"Identifying security requirements early on can lay the foundation for secure software development. Security requirements are often implied by existing functional requirements but are mostly left unspecified. The Security Discoverer (SD) process automatically identifies security implications of individual requirements sentences and suggests applicable security requirements templates. The objective of this research is to support requirements analysts in identifying security requirements by automating the suggestion of security requirements templates that are implied by existing functional requirements. We conducted a controlled experiment in a graduate-level security class at North Carolina State University (NCSU) to evaluate the SD process in eliciting implied security requirements in 2014. We have subsequently conducted three differentiated replications to evaluate the generalizability and applicability of the initial findings. The replications were conducted across three countries at the University of Trento, NCSU, and the University of Costa Rica. We evaluated the responses of the 205 total participants in terms of quality, coverage, relevance and efficiency. We also develop shared insights regarding the impact of context factors such as time, motivation and support, on the study outcomes and provide lessons learned in conducting the replications. Treatment group, using the SD process, performed significantly better than the control group (at p-value <0.05) in terms of the coverage of the identified security requirements and efficiency of the requirements elicitation process in two of the three replications, supporting the findings of the original study. Participants in the treatment group identified 84 % more security requirements in the oracle as compared to the control group on average. Overall, 80 % of the 111 participants in the treatment group were favorable towards the use of templates in identifying security requirements. Our qualitative findings indicate that participants may be able to differentiate between relevant and extraneous templates suggestions and be more inclined to fill in the templates with additional support. Security requirements templates capture the security knowledge of multiple experts and can support the security requirements elicitation process when automatically suggested, making the implied security requirements more evident. However, individual participants may still miss out on identifying a number of security requirements due to empirical constraints as well as potential limitations on knowledge and security expertise."
An initial analysis of software engineers’ attitudes towards organizational change,"Employees’ attitudes towards organizational change are a critical determinant in the change process. Researchers have therefore tried to determine what underlying concepts that affect them. These extensive efforts have resulted in the identification of several antecedents. However, no studies have been conducted in a software engineering context and the research has provided little information on the relative impact and importance of the identified concepts. In this study, we have combined results from previous social science research with results from software engineering research, and thereby identified three underlying concepts with an expected significant impact on software engineers’ attitudes towards organizational change, i.e. their knowledge about the intended change outcome, their understanding of the need for change, and their feelings of participation in the change process. The result of two separate multiple regression analysis, where we used industrial questionnaire data (N=56), showed that the attitude concept openness to change is predicted by all three concepts, while the attitude concept readiness for change is predicted by need for change and participation. Our research provides an empirical baseline to an important area of software engineering and the result can be a starting-point for future organizational change research. In addition, the proposed model prescribes practical directions for software engineering organizations to adopt in improving employees’ responses to change and, thus, increase the probability of a successful change."
Studying the urgent updates of popular games on the Steam platform,"The steadily increasing popularity of computer games has led to the rise of a multi-billion dollar industry. This increasing popularity is partly enabled by online digital distribution platforms for games, such as Steam. These platforms offer an insight into the development and test processes of game developers. In particular, we can extract the update cycle of a game and study what makes developers deviate from that cycle by releasing so-called urgent updates. An urgent update is a software update that fixes problems that are deemed critical enough to not be left unfixed until a regular-cycle update. Urgent updates are made in a state of emergency and outside the regular development and test timelines which causes unnecessary stress on the development team. Hence, avoiding the need for an urgent update is important for game developers. We define urgent updates as 0-day updates (updates that are released on the same day), updates that are released faster than the regular cycle, or self-admitted hotfixes. We conduct an empirical study of the urgent updates of the 50 most popular games from Steam, the dominant digital game delivery platform. As urgent updates are reflections of mistakes in the development and test processes, a better understanding of urgent updates can in turn stimulate the improvement of these processes, and eventually save resources for game developers. In this paper, we argue that the update strategy that is chosen by a game developer affects the number of urgent updates that are released. Although the choice of update strategy does not appear to have an impact on the percentage of updates that are released faster than the regular cycle or self-admitted hotfixes, games that use a frequent update strategy tend to have a higher proportion of 0-day updates than games that use a traditional update strategy."
Group versus individual use of power-only EPMcreate as a creativity enhancement technique for requirements elicitation,"Creativity is often needed in requirements elicitation, i.e., generating ideas for requirements, and therefore, techniques to enhance creativity are believed to be useful. How does the size of a group using the Power-Only EPMcreate (POEPMcreate) creativity enhancement technique affect the group’s and each member of the group’s effectiveness in generating requirement ideas? This paper describes an experiment in which individuals and two-person and four-person groups used POEPMcreate to generate ideas for requirements for enhancing a high school’s public Web site. The data of this experiment combined with the data of two previous experiments involving two-person and four-person groups using POEPMcreate show that, similar to what has been observed for brainstorming, the size of a group using POEPMcreate does affect the number of raw and new requirement ideas generated by the group and by the average member of the group. The data allow concluding that a two-person group using POEPMcreate generates more raw and new requirement ideas, both per group and per group member or individual, than does a four-person group and than does an individual. This conclusion is partially corroborated by qualitative data gathered from a survey of professional business or requirements analysts about group sizes and creativity enhancement techniques."
Semantic topic models for source code analysis,"Topic modeling techniques have been recently applied to analyze and model source code. Such techniques exploit the textual content of source code to provide automated support for several basic software engineering activities. Despite these advances, applications of topic modeling in software engineering are frequently suboptimal. This can be attributed to the fact that current state-of-the-art topic modeling techniques tend to be data intensive. However, the textual content of source code, embedded in its identifiers, comments, and string literals, tends to be sparse in nature. This prevents classical topic modeling techniques, typically used to model natural language texts, to generate proper models when applied to source code. Furthermore, the operational complexity and multi-parameter calibration often associated with conventional topic modeling techniques raise important concerns about their feasibility as data analysis models in software engineering. Motivated by these observations, in this paper we propose a novel approach for topic modeling designed for source code. The proposed approach exploits the basic assumptions of the cluster hypothesis and information theory to discover semantically coherent topics in software systems. Ten software systems from different application domains are used to empirically calibrate and configure the proposed approach. The usefulness of generated topics is empirically validated using human judgment. Furthermore, a case study that demonstrates thet operation of the proposed approach in analyzing code evolution is reported. The results show that our approach produces stable, more interpretable, and more expressive topics than classical topic modeling techniques without the necessity for extensive parameter calibration."
Which log level should developers choose for a new logging statement?,"Logging statements are used to record valuable runtime information about applications. Each logging statement is assigned a log level such that users can disable some verbose log messages while allowing the printing of other important ones. However, prior research finds that developers often have difficulties when determining the appropriate level for their logging statements. In this paper, we propose an approach to help developers determine the appropriate log level when they add a new logging statement. We analyze the development history of four open source projects (Hadoop, Directory Server, Hama, and Qpid), and leverage ordinal regression models to automatically suggest the most appropriate level for each newly-added logging statement. First, we find that our ordinal regression model can accurately suggest the levels of logging statements with an AUC (area under the curve; the higher the better) of 0.75 to 0.81 and a Brier score (the lower the better) of 0.44 to 0.66, which is better than randomly guessing the appropriate log level (with an AUC of 0.50 and a Brier score of 0.80 to 0.83) or naively guessing the log level based on the proportional distribution of each log level (with an AUC of 0.50 and a Brier score of 0.65 to 0.76). Second, we find that the characteristics of the containing block of a newly-added logging statement, the existing logging statements in the containing source code file, and the content of the newly-added logging statement play important roles in determining the appropriate log level for that logging statement."
Global vs. local models for cross-project defect prediction,"Although researchers invested significant effort, the performance of defect prediction in a cross-project setting, i.e., with data that does not come from the same project, is still unsatisfactory. A recent proposal for the improvement of defect prediction is using local models. With local models, the available data is first clustered into homogeneous regions and afterwards separate classifiers are trained for each homogeneous region. Since the main problem of cross-project defect prediction is data heterogeneity, the idea of local models is promising. Therefore, we perform a conceptual replication of the previous studies on local models with a focus on cross-project defect prediction. In a large case study, we evaluate the performance of local models and investigate their advantages and drawbacks for cross-project predictions. To this aim, we also compare the performance with a global model and a transfer learning technique designed for cross-project defect predictions. Our findings show that local models make only a minor difference in comparison to global models and transfer learning for cross-project defect prediction. While these results are negative, they provide valuable knowledge about the limitations of local models and increase the validity of previously gained research results."
Are delayed issues harder to resolve? Revisiting cost-to-fix of defects throughout the lifecycle,"Many practitioners and academics believe in a delayed issue effect (DIE); i.e. the longer an issue lingers in the system, the more effort it requires to resolve. This belief is often used to justify major investments in new development processes that promise to retire more issues sooner. This paper tests for the delayed issue effect in 171 software projects conducted around the world in the period from 2006–2014. To the best of our knowledge, this is the largest study yet published on this effect. We found no evidence for the delayed issue effect; i.e. the effort to resolve issues in a later phase was not consistently or substantially greater than when issues were resolved soon after their introduction. This paper documents the above study and explores reasons for this mismatch between this common rule of thumb and empirical data. In summary, DIE is not some constant across all projects. Rather, DIE might be an historical relic that occurs intermittently only in certain kinds of projects. This is a significant result since it predicts that new development processes that promise to faster retire more issues will not have a guaranteed return on investment (depending on the context where applied), and that a long-held truth in software engineering should not be considered a global truism."
Metric-based software reliability prediction approach and its application,This paper proposes a software reliability prediction approach based on software metrics. Metrics measurement results are connected to quantitative reliability predictions through defect information and consideration of the operational environments. An application of the proposed approach to a safety critical software deployed in a nuclear power plant is discussed. Results show that the proposed prediction approach could be applied using a variety of software metrics at different stages of the software development life cycle and could be used as an indicator of software quality. Therefore the approach could also guide the development process and help make design decisions. Experiences and lessons learned from the application are also discussed.
Automatic repair of real bugs in java: a large-scale experiment on the defects4j dataset,"Defects4J is a large, peer-reviewed, structured dataset of real-world Java bugs. Each bug in Defects4J comes with a test suite and at least one failing test case that triggers the bug. In this paper, we report on an experiment to explore the effectiveness of automatic test-suite based repair on Defects4J. The result of our experiment shows that the considered state-of-the-art repair methods can generate patches for 47 out of 224 bugs. However, those patches are only test-suite adequate, which means that they pass the test suite and may potentially be incorrect beyond the test-suite satisfaction correctness criterion. We have manually analyzed 84 different patches to assess their real correctness. In total, 9 real Java bugs can be correctly repaired with test-suite based repair. This analysis shows that test-suite based repair suffers from under-specified bugs, for which trivial or incorrect patches still pass the test suite. With respect to practical applicability, it takes on average 14.8 minutes to find a patch. The experiment was done on a scientific grid, totaling 17.6 days of computation time. All the repair systems and experimental results are publicly available on Github in order to facilitate future research on automatic repair."
Multi-objective reverse engineering of variability-safe feature models based on code dependencies of system variants,"Maintenance of many variants of a software system, developed to supply a wide range of customer-specific demands, is a complex endeavour. The consolidation of such variants into a Software Product Line is a way to effectively cope with this problem. A crucial step for this consolidation is to reverse engineer feature models that represent the desired combinations of features of all the available variants. Many approaches have been proposed for this reverse engineering task but they present two shortcomings. First, they use a single-objective perspective that does not allow software engineers to consider design trade-offs. Second, they do not exploit knowledge from implementation artifacts. To address these limitations, our work takes a multi-objective perspective and uses knowledge from source code dependencies to obtain feature models that not only represent the desired feature combinations but that also check that those combinations are indeed well-formed, i.e. variability safe. We performed an evaluation of our approach with twelve case studies using NSGA-II and SPEA2, and a single-objective algorithm. Our results indicate that the performance of the multi-objective algorithms is similar in most cases and that both clearly outperform the single-objective algorithm. Our work also unveils several avenues for further research."
