title,abstract
Pinpointing and repairing performance bottlenecks in concurrent programs,"Developing concurrent software that is both correct and efficient is challenging. Past research has proposed various techniques that support developers in finding, understanding, and repairing concurrency-related correctness problems, such as missing or incorrect synchronization. In contrast, existing work provides little support for dealing with concurrency-related performance problems, such as unnecessary or inefficient synchronization. This paper presents SyncProf, a profiling approach that helps in identifying, localizing, and repairing performance bottlenecks in concurrent programs. The approach consists of a sequence of dynamic analyses that reason about relevant code locations with increasing precision while narrowing down performance problems and gathering data for avoiding them. A key novelty is a graph-based representation of relations between critical sections, which is the basis for computing the performance impact of a critical section and for identifying the root cause of a bottleneck. Once a bottleneck is identified, SyncProf searches for a suitable optimization strategy to avoid the problem, increasing the level of automation when repairing performance bottlenecks over a traditional, manual approach. We evaluate SyncProf on 25 versions of eleven C/C++ projects with both known and previously unknown synchronization bottlenecks. The results show that SyncProf effectively localizes the root causes of these bottlenecks with higher precision than a state of the art lock contention profiler, and that it suggests valuable strategies to repair the bottlenecks."
Studying software logging using topic models,"Software developers insert logging statements in their source code to record important runtime information; such logged information is valuable for understanding system usage in production and debugging system failures. However, providing proper logging statements remains a manual and challenging task. Missing an important logging statement may increase the difficulty of debugging a system failure, while too much logging can increase system overhead and mask the truly important information. Intuitively, the actual functionality of a software component is one of the major drivers behind logging decisions. For instance, a method maintaining network communications is more likely to be logged than getters and setters. In this paper, we used automatically-computed topics of a code snippet to approximate the functionality of a code snippet. We studied the relationship between the topics of a code snippet and the likelihood of a code snippet being logged (i.e., to contain a logging statement). Our driving intuition is that certain topics in the source code are more likely to be logged than others. To validate our intuition, we conducted a case study on six open source systems, and we found that i) there exists a small number of “log-intensive” topics that are more likely to be logged than other topics; ii) each pair of the studied systems share 12% to 62% common topics, and the likelihood of logging such common topics has a statistically significant correlation of 0.35 to 0.62 among all the studied systems; and iii) our topic-based metrics help explain the likelihood of a code snippet being logged, providing an improvement of 3% to 13% on AUC and 6% to 16% on balanced accuracy over a set of baseline metrics that capture the structural information of a code snippet. Our findings highlight that topics contain valuable information that can help guide and drive developers’ logging decisions."
Large-scale agile transformation at Ericsson: a case study,"Many large organizations are adopting agile software development as part of their continuous push towards higher flexibility and shorter lead times, yet few reports on large-scale agile transformations are available in the literature. In this paper we report how Ericsson introduced agile in a new R&D product development program developing a XaaS platform and a related set of services, while simultaneously scaling it up aggressively. The overarching goal for the R&D organization, distributed to five sites at two continents, was to achieve continuous feature delivery. This single case study is based on 45 semi-structured interviews during visits at four sites, and five observation sessions at three sites. We describe how the organization experimented with different set-ups for their tens of agile teams aiming for rapid end-to-end development: from component-based virtual teams to totally cross-functional, cross-component, cross-site teams. Moreover, we discuss the challenges the organization faced and how they mitigated them on their journey towards continuous and rapid software engineering. We present four lessons learned for large-scale agile transformations: 1) consider using an experimental approach to transformation, 2) consider implementing the transformation step-wise in complex large-scale settings, 3) team inter-changeability can be limited in a complex large-scale product — specialization might be needed, and 4) not using a common agile framework for the whole organization, in combination with insufficient common trainings and coaching may lead to a lack of common direction in the agile implementation. Further in-depth case studies on large-scale agile transformations, on customizing agile to large-scale settings, as well as on the use of scaling frameworks are needed."
Towards reusing hints from past fixes,"With the usage of version control systems, many bug fixes have accumulated over the years. Researchers have proposed various automatic program repair (APR) approaches that reuse past fixes to fix new bugs. However, some fundamental questions, such as how new fixes overlap with old fixes, have not been investigated. Intuitively, the overlap between old and new fixes decides how APR approaches can construct new fixes with old ones. Based on this intuition, we systematically designed six overlap metrics, and performed an empirical study on 5,735 bug fixes to investigate the usefulness of past fixes when composing new fixes. For each bug fix, we created delta graphs (i.e., program dependency graphs for code changes), and identified how bug fixes overlap with each other in terms of the content, code structures, and identifier names of fixes. Our results show that if an APR approach knows all code name changes and composes new fixes by fully or partially reusing the content of past fixes, only 2.1% and 3.2% new fixes can be created from single or multiple past fixes in the same project, compared with 0.9% and 1.2% fixes created from past fixes across projects. However, if an APR approach knows all code name changes and composes new fixes by fully or partially reusing the code structures of past fixes, up to 41.3% and 29.7% new fixes can be created. By making the above observations and revealing other ten findings, we investigated the upper bound of reusable past fixes and composable new fixes, exploring the potential of existing and future APR approaches."
Revisiting the performance of automated approaches for the retrieval of duplicate reports in issue tracking systems that perform just-in-time duplicate retrieval,"Issue tracking systems (ITSs) allow software end-users and developers to file issue reports and change requests. Reports are frequently duplicately filed for the same software issue. The retrieval of these duplicate issue reports is a tedious manual task. Prior research proposed several automated approaches for the retrieval of duplicate issue reports. Recent versions of ITSs added a feature that does basic retrieval of duplicate issue reports at the filing time of an issue report in an effort to avoid the filing of duplicates as early as possible. This paper investigates the impact of this just-in-time duplicate retrieval on the duplicate reports that end up in the ITS of an open source project. In particular, we study the differences between duplicate reports for open source projects before and after the activation of this new feature. We show how the experimental results of prior research would vary given the new data after the activation of the just-in-time duplicate retrieval feature. We study duplicate issue reports from the Mozilla-Firefox, Mozilla-Core and Eclipse-Platform projects. In addition, we compare the performance of the state of the art of the automated retrieval of duplicate reports using two popular approaches (i.e., BM25F and REP). We find that duplicate issue reports after the activation of the just-in-time duplicate retrieval feature are less textually similar, have a greater identification delay and require more discussion to be retrieved as duplicate reports than duplicates before the activation of the feature. Prior work showed that REP outperforms BM25F in terms of Recall rate and Mean average precision. We observe that the performance gap between BM25F and REP becomes even larger after the activation of the just-in-time duplicate retrieval feature. We recommend that future studies focus on duplicates that were reported after the activation of the just-in-time duplicate retrieval feature as these duplicates are more representative of future incoming issue reports and therefore, give a better representation of the future performance of proposed approaches."
Editor’s Note: Special Issue on Automatic Software Repair,
Program comprehension of domain-specific and general-purpose languages: replication of a family of experiments using integrated development environments,"Domain-specific languages (DSLs) allow developers to write code at a higher level of abstraction compared with general-purpose languages (GPLs). Developers often use DSLs to reduce the complexity of GPLs. Our previous study found that developers performed program comprehension tasks more accurately and efficiently with DSLs than with corresponding APIs in GPLs. This study replicates our previous study to validate and extend the results when developers use IDEs to perform program comprehension tasks. We performed a dependent replication of a family of experiments. We made two specific changes to the original study: (1) participants used IDEs to perform the program comprehension tasks, to address a threat to validity in the original experiment and (2) each participant performed program comprehension tasks on either DSLs or GPLs, not both as in the original experiment. The results of the replication are consistent with and expanded the results of the original study. Developers are significantly more effective and efficient in tool-based program comprehension when using a DSL than when using a corresponding API in a GPL. The results indicate that, where a DSL is available, developers will perform program comprehension better using the DSL than when using the corresponding API in a GPL."
Augmenting and structuring user queries to support efficient free-form code search,"Source code terms such as method names and variable types are often different from conceptual words mentioned in a search query. This vocabulary mismatch problem can make code search inefficient. In this paper, we present COde voCABUlary (CoCaBu), an approach to resolving the vocabulary mismatch problem when dealing with free-form code search queries. Our approach leverages common developer questions and the associated expert answers to augment user queries with the relevant, but missing, structural code entities in order to improve the performance of matching relevant code examples within large code repositories. To instantiate this approach, we build GitSearch, a code search engine, on top of GitHub and Stack Overflow Q&A data. We evaluate GitSearch in several dimensions to demonstrate that (1) its code search results are correct with respect to user-accepted answers; (2) the results are qualitatively better than those of existing Internet-scale code search engines; (3) our engine is competitive against web search engines, such as Google, in helping users solve programming tasks; and (4) GitSearch provides code examples that are acceptable or interesting to the community as answers for Stack Overflow questions."
Does syntax highlighting help programming novices?,"Program comprehension is an important skill for programmers – extending and debugging existing source code is part of the daily routine. Syntax highlighting is one of the most common tools used to support developers in understanding algorithms. However, most research in this area originates from a time when programmers used a completely different tool chain. We examined the influence of syntax highlighting on novices’ ability to comprehend source code. Additional analyses cover the influence of task type and programming experience on the code comprehension ability itself and its relation to syntax highlighting. We conducted a controlled experiment with 390 undergraduate students in an introductory Java programming course. We measured the correctness with which they solved small coding tasks. Each test subject received some tasks with syntax highlighting and some without. The data provided no evidence that syntax highlighting improves novices’ ability to comprehend source code. There are very few similar experiments and it is unclear as of yet which factors impact the effectiveness of syntax highlighting. One major limitation may be the types of tasks chosen for this experiment. The results suggest that syntax highlighting squanders a feedback channel from the IDE to the programmer that can be used more effectively."
Getting the most from map data structures in Android,"A map is a data structure that is commonly used to store data as key–value pairs and retrieve data as keys, values, or key–value pairs. Although Java offers different map implementation classes, Android SDK offers other implementations supposed to be more efficient than HashMap: ArrayMap and SparseArray variants (SparseArray, LongSparseArray, SparseIntArray, SparseLongArray, and SparseBooleanArray). Yet, the performance of these implementations in terms of CPU time, memory usage, and energy consumption is lacking in the official Android documentation; although saving CPU, memory, and energy is a major concern of users wanting to increase battery life. Consequently, we study the use of map implementations by Android developers in two ways. First, we perform an observational study of 5713 Android apps in GitHub. Second, we conduct a survey to assess developers’ perspective on Java and Android map implementations. Then, we perform an experimental study comparing HashMap, ArrayMap, and SparseArray variants map implementations in terms of CPU time, memory usage, and energy consumption. We conclude with guidelines for choosing among the map implementations: HashMap is preferable over ArrayMap to improve energy efficiency of apps, and SparseArray variants should be used instead of HashMap and ArrayMap when keys are primitive types."
App store mining is not enough for app improvement,"The rise in popularity of mobile devices has led to a parallel growth in the size of the app store market, intriguing several research studies and commercial platforms on mining app stores. App store reviews are used to analyze different aspects of app development and evolution. However, app users’ feedback does not only exist on the app store. In fact, despite the large quantity of posts that are made daily on social media, the importance and value that these discussions provide remain mostly unused in the context of mobile app development. In this paper, we study how Twitter can provide complementary information to support mobile app development. By analyzing a total of 30,793 apps over a period of six weeks, we found strong correlations between the number of reviews and tweets for most apps. Moreover, through applying machine learning classifiers, topic modeling and subsequent crowd-sourcing, we successfully mined 22.4% additional feature requests and 12.89% additional bug reports from Twitter. We also found that 52.1% of all feature requests and bug reports were discussed on both tweets and reviews. In addition to finding common and unique information from Twitter and the app store, sentiment and content analysis were also performed for 70 randomly selected apps. From this, we found that tweets provided more critical and objective views on apps than reviews from the app store. These results show that app store review mining is indeed not enough; other information sources ultimately provide added value and information for app developers."
Do software models based on the UML aid in source-code comprehensibility? Aggregating evidence from 12 controlled experiments,"In this paper, we present the results of long-term research conducted in order to study the contribution made by software models based on the Unified Modeling Language (UML) to the comprehensibility of Java source-code deprived of comments. We have conducted 12 controlled experiments in different experimental contexts and on different sites with participants with different levels of expertise (i.e., Bachelor’s, Master’s, and PhD students and software practitioners from Italy and Spain). A total of 333 observations were obtained from these experiments. The UML models in our experiments were those produced in the analysis and design phases. The models produced in the analysis phase were created with the objective of abstracting the environment in which the software will work (i.e., the problem domain), while those produced in the design phase were created with the goal of abstracting implementation aspects of the software (i.e., the solution/application domain). Source-code comprehensibility was assessed with regard to correctness of understanding, time taken to accomplish the comprehension tasks, and efficiency as regards accomplishing those tasks. In order to study the global effect of UML models on source-code comprehensibility, we aggregated results from the individual experiments using a meta-analysis. We made every effort to account for the heterogeneity of our experiments when aggregating the results obtained from them. The overall results suggest that the use of UML models affects the comprehensibility of source-code, when it is deprived of comments. Indeed, models produced in the analysis phase might reduce source-code comprehensibility, while increasing the time taken to complete comprehension tasks. That is, browsing source code and this kind of models together negatively impacts on the time taken to complete comprehension tasks without having a positive effect on the comprehensibility of source code. One plausible justification for this is that the UML models produced in the analysis phase focus on the problem domain. That is, models produced in the analysis phase say nothing about source code and there should be no expectation that they would, in any way, be beneficial to comprehensibility. On the other hand, UML models produced in the design phase improve source-code comprehensibility. One possible justification for this result is that models produced in the design phase are more focused on implementation details. Therefore, although the participants had more material to read and browse, this additional effort was paid back in the form of an improved comprehension of source code."
Do automated program repair techniques repair hard and important bugs?,"Existing evaluations of automated repair techniques focus on the fraction of the defects for which the technique can produce a patch, the time needed to produce patches, and how well patches generalize to the intended specification. However, these evaluations have not focused on the applicability of repair techniques and the characteristics of the defects that these techniques can repair. Questions such as “Can automated repair techniques repair defects that are hard for developers to repair?” and “Are automated repair techniques less likely to repair defects that involve loops?” have not, as of yet, been answered. To address such questions, we annotate two large benchmarks totaling 409 C and Java defects in real-world software, ranging from 22K to 2.8M lines of code, with measures of the defect’s importance, the developer-written patch’s complexity, and the quality of the test suite. We then analyze relationships between these measures and the ability to produce patches for the defects of seven automated repair techniques —AE, GenProg, Kali, Nopol, Prophet, SPR, and TrpAutoRepair. We find that automated repair techniques are less likely to produce patches for defects that required developers to write a lot of code or edit many files, or that have many tests relevant to the defect. Java techniques are more likely to produce patches for high-priority defects. Neither the time it took developers to fix a defect nor the test suite’s coverage correlate with the automated repair techniques’ ability to produce patches. Finally, automated repair techniques are less capable of fixing defects that require developers to add loops and new function calls, or to change method signatures. These findings identify strengths and shortcomings of the state-of-the-art of automated program repair along new dimensions. The presented methodology can drive research toward improving the applicability of automated repair techniques to hard and important bugs."
Overfitting in semantics-based automated program repair,"The primary goal of Automated Program Repair (APR) is to automatically fix buggy software, to reduce the manual bug-fix burden that presently rests on human developers. Existing APR techniques can be generally divided into two families: semantics- vs. heuristics-based. Semantics-based APR uses symbolic execution and test suites to extract semantic constraints, and uses program synthesis to synthesize repairs that satisfy the extracted constraints. Heuristic-based APR generates large populations of repair candidates via source manipulation, and searches for the best among them. Both families largely rely on a primary assumption that a program is correctly patched if the generated patch leads the program to pass all provided test cases. Patch correctness is thus an especially pressing concern. A repair technique may generate overfitting patches, which lead a program to pass all existing test cases, but fails to generalize beyond them. In this work, we revisit the overfitting problem with a focus on semantics-based APR techniques, complementing previous studies of the overfitting problem in heuristics-based APR. We perform our study using IntroClass and Codeflaws benchmarks, two datasets well-suited for assessing repair quality, to systematically characterize and understand the nature of overfitting in semantics-based APR. We find that similar to heuristics-based APR, overfitting also occurs in semantics-based APR in various different ways."
Improved representation and genetic operators for linear genetic programming for automated program repair,"Genetic improvement for program repair can fix bugs or otherwise improve software via patch evolution. Consider GenProg, a prototypical technique of this type. GenProg’s crossover and mutation operators manipulate individuals represented as patches. A patch is composed of high-granularity edits that indivisibly comprise an edit operation, a faulty location, and a fix statement used in replacement or insertions. We observe that recombination and mutation of such high-level units limits the technique’s ability to effectively traverse and recombine the repair search spaces. We propose a reformulation of program repair representation, crossover, and mutation operators such that they explicitly traverse the three subspaces that underlie the search problem: the Operator, Fault and Fix Spaces. We provide experimental evidence validating our insight, showing that the operators provide considerable improvement over the baseline repair algorithm in terms of search success rate and efficiency. We also conduct a genotypic distance analysis over the various types of search, providing insight as to the influence of the operators on the program repair search problem."
ChangeLocator: locate crash-inducing changes based on crash reports,"Software crashes are severe manifestations of software bugs. Debugging crashing bugs is tedious and time-consuming. Understanding software changes that induce a crashing bug can provide useful contextual information for bug fixing and is highly demanded by developers. Locating the bug inducing changes is also useful for automatic program repair, since it narrows down the root causes and reduces the search space of bug fix location. However, currently there are no systematic studies on locating the software changes to a source code repository that induce a crashing bug reflected by a bucket of crash reports. To tackle this problem, we first conducted an empirical study on characterizing the bug inducing changes for crashing bugs (denoted as crash-inducing changes). We also propose ChangeLocator, a method to automatically locate crash-inducing changes for a given bucket of crash reports. We base our approach on a learning model that uses features originated from our empirical study and train the model using the data from the historical fixed crashes. We evaluated ChangeLocator with six release versions of Netbeans project. The results show that it can locate the crash-inducing changes for 44.7%, 68.5%, and 74.5% of the bugs by examining only top 1, 5 and 10 changes in the recommended list, respectively. It significantly outperforms the existing state-of-the-art approach."
