title,abstract
An approach and benchmark to detect behavioral changes of commits in continuous integration,"When a developer pushes a change to an application’s codebase, a good practice is to have a test case specifying this behavioral change. Thanks to continuous integration (CI), the test is run on subsequent commits to check that they do no introduce a regression for that behavior. In this paper, we propose an approach that detects behavioral changes in commits. As input, it takes a program, its test suite, and a commit. Its output is a set of test methods that capture the behavioral difference between the pre-commit and post-commit versions of the program. We call our approach DCI (Detecting behavioral changes in CI). It works by generating variations of the existing test cases through (i) assertion amplification and (ii) a search-based exploration of the input space. We evaluate our approach on a curated set of 60 commits from 6 open source Java projects. To our knowledge, this is the first ever curated dataset of real-world behavioral changes. Our evaluation shows that DCI is able to generate test methods that detect behavioral changes. Our approach is fully automated and can be integrated into current development processes. The main limitations are that it targets unit tests and works on a relatively small fraction of commits. More specifically, DCI works on commits that have a unit test that already executes the modified code. In practice, from our benchmark projects, we found 15.29% of commits to meet the conditions required by DCI."
How software engineering research aligns with design science: a review,"BackgroundAssessing and communicating software engineering research can be challenging. Design science is recognized as an appropriate research paradigm for applied research, but is rarely explicitly used as a way to present planned or achieved research contributions in software engineering. Applying the design science lens to software engineering research may improve the assessment and communication of research contributions.AimThe aim of this study is 1) to understand whether the design science lens helps summarize and assess software engineering research contributions, and 2) to characterize different types of design science contributions in the software engineering literature.MethodIn previous research, we developed a visual abstract template, summarizing the core constructs of the design science paradigm. In this study, we use this template in a review of a set of 38 award winning software engineering publications to extract, analyze and characterize their design science contributions.ResultsWe identified five clusters of papers, classifying them according to their different types of design science contributions.ConclusionsThe design science lens helps emphasize the theoretical contribution of research output—in terms of technological rules—and reflect on the practical relevance, novelty and rigor of the rules proposed by the research."
An empirical analysis of error propagation in critical software systems,"Error propagation analysis is a consolidated practice to gain insights into error modes and effects that pertain to the activation of faults in software systems. A variety of approaches, such as architecture-based, source code instrumentation and variable tracing, have been proposed so far to address software error propagation analysis. Although valuable, existing approaches entail a substantial degree of system internals’ knowledge, visibility and code manipulation that is not well-suited for real-life production environments. This paper proposes an empirical analysis of error propagation. We specifically address the challenges in using fault data and error events in the logs, which are a convenient byproduct of the system’s execution. The approach puts forth the construction of error reporting graphs. We apply the approach to 2,042 failure data points from two real-world critical systems from the Air Traffic Control domain by a top industry provider. The approach contributes to develop a deep understanding on error modes and propagation paths, which can be leveraged by practitioners to make informed decisions on the placement of error detection mechanisms."
Explicit programming strategies,"Software developers solve a diverse and wide range of problems. While software engineering research often focuses on tools to support this problem solving, the strategies that developers use to solve problems are at least as important. In this paper, we offer a novel approach for enabling developers to follow explicit programming strategies that describe how an expert tackles a common programming problem. We define explicit programming strategies, grounding our definition in prior work both within software engineering and in other professions which have adopted more explicit procedures for problem solving. We then present a novel notation called Roboto and a novel strategy tracker tool that explicitly represent programming strategies and frame executing strategies as a collaborative effort between human abilities to make decisions and computer abilities to structure process and persist information. In a formative evaluation, 28 software developers of varying expertise completed a design task and a debugging task. We found that, compared to developers who are free to choose their own strategies, developers given explicit strategies experienced their work as more organized, systematic, and predictable, but also more constrained. Developers using explicit strategies were objectively more successful at the design and debugging tasks. We discuss the implications of Roboto and these findings, envisioning a thriving ecosystem of explicit strategies that accelerate and improve developers’ programming problem solving."
Using machine learning to assist with the selection of security controls during security assessment,"ContextIn many domains such as healthcare and banking, IT systems need to fulfill various requirements related to security. The elaboration of security requirements for a given system is in part guided by the controls envisaged by the applicable security standards and best practices. An important difficulty that analysts have to contend with during security requirements elaboration is sifting through a large number of security controls and determining which ones have a bearing on the security requirements for a given system. This challenge is often exacerbated by the scarce security expertise available in most organizations.ObjectiveIn this article, we develop automated decision support for the identification of security controls that are relevant to a specific system in a particular context.Method and ResultsOur approach, which is based on machine learning, leverages historical data from security assessments performed over past systems in order to recommend security controls for a new system. We operationalize and empirically evaluate our approach using real historical data from the banking domain. Our results show that, when one excludes security controls that are rare in the historical data, our approach has an average recall of ≈ 94% and average precision of ≈ 63%. We further examine through a survey the perceptions of security analysts about the usefulness of the classification models derived from historical data.ConclusionsThe high recall – indicating only a few relevant security controls are missed – combined with the reasonable level of precision – indicating that the effort required to confirm recommendations is not excessive – suggests that our approach is a useful aid to analysts for more efficiently identifying the relevant security controls, and also for decreasing the likelihood that important controls would be overlooked. Further, our survey results suggest that the generated classification models help provide a documented and explicit rationale for choosing the applicable security controls."
What am I testing and where? Comparing testing procedures based on lightweight requirements annotations,"ContextThe testing of software-intensive systems is performed in different test stages each having a large number of test cases. These test cases are commonly derived from requirements. Each test stages exhibits specific demands and constraints with respect to their degree of detail and what can be tested. Therefore, specific test suites are defined for each test stage. In this paper, the focus is on the domain of embedded systems, where, among others, typical test stages are Software- and Hardware-in-the-loop.ObjectiveMonitoring and controlling which requirements are verified in which detail and in which test stage is a challenge for engineers. However, this information is necessary to assure a certain test coverage, to minimize redundant testing procedures, and to avoid inconsistencies between test stages. In addition, engineers are reluctant to state their requirements in terms of structured languages or models that would facilitate the relation of requirements to test executions.MethodWith our approach, we close the gap between requirements specifications and test executions. Previously, we have proposed a lightweight markup language for requirements which provides a set of annotations that can be applied to natural language requirements. The annotations are mapped to events and signals in test executions. As a result, meaningful insights from a set of test executions can be directly related to artifacts in the requirements specification. In this paper, we use the markup language to compare different test stages with one another.ResultsWe annotate 443 natural language requirements of a driver assistance system with the means of our lightweight markup language. The annotations are then linked to 1300 test executions from a simulation environment and 53 test executions from test drives with human drivers. Based on the annotations, we are able to analyze how similar the test stages are and how well test stages and test cases are aligned with the requirements. Further, we highlight the general applicability of our approach through this extensive experimental evaluation.ConclusionWith our approach, the results of several test levels are linked to the requirements and enable the evaluation of complex test executions. By this means, practitioners can easily evaluate how well a systems performs with regards to its specification and, additionally, can reason about the expressiveness of the applied test stage."
Building the perfect game – an empirical study of game modifications,"Prior work has shown that gamer loyalty is important for the sales of a developer’s future games. Therefore, it is important for game developers to increase the longevity of their games. However, game developers cannot always meet the growing and changing needs of the gaming community, due to the often already overloaded schedules of developers. So-called modders can potentially assist game developers with addressing gamers’ needs. Modders are enthusiasts who provide modifications or completely new content for a game. By supporting modders, game developers can meet the rapidly growing and varying needs of their gamer base. Modders have the potential to play a role in extending the life expectancy of a game, thereby saving game developers time and money, and leading to a better overall gaming experience for their gamer base. In this paper, we empirically study the metadata of 9,521 mods that were extracted from the Nexus Mods distribution platform. The Nexus Mods distribution platform is one of the largest mod distribution platforms for PC games at the time of our study. The goal of our paper is to provide useful insights about mods on the Nexus Mods distribution platform from a quantitative perspective, and to provide researchers a solid foundation to further explore game mods. To better understand the potential of mods to extend the longevity of a game we study their characteristics, and we study their release schedules and post-release support (in terms of bug reports) as a proxy for the willingness of the modding community to contribute to a game. We find that providing official support for mods can be beneficial for the perceived quality of the mods of a game: games for which a modding tool is provided by the original game developer have a higher median endorsement ratio than mods for games that do not have such a tool. In addition, mod users are willing to submit bug reports for a mod. However, they often fail to do this in a systematic manner using the bug reporting tool of the Nexus Mods platform, resulting in low-quality bug reports which are difficult to resolve. Our findings give the first insights into the characteristics, release schedule and post-release support of game mods. Our findings show that some games have a very active modding community, which contributes to those games through mods. Based on our findings, we recommend that game developers who desire an active modding community for their own games provide the modding community with an officially-supported modding tool. In addition, we recommend that mod distribution platforms, such as Nexus Mods, improve their bug reporting system to receive higher quality bug reports."
How does combinatorial testing perform in the real world: an empirical study,"Studies have shown that combinatorial testing (CT) can be effective for detecting faults in software systems. By focusing on the interactions between different factors of a system, CT shows its potential for detecting faults, especially those that can be revealed only by the specific combinations of values of multiple factors (multi-factor faults). However, is CT practical enough to be applied in the industry? Can it be more effective than other industry-favored techniques? Are there any challenges when applying CT in practice? These research questions remain in the context of industrial settings. In this paper, we present an empirical study of CT on five industrial systems with real faults. The details of the input space model (ISM) construction, such as factor identification and value assignment, are included. We compared the faults detected by CT with those detected by the in-house testing teams using other methods, and the results suggest that despite some challenges, CT is an effective technique to detect real faults, especially multi-factor faults, of software systems in industrial settings. Observations and lessons learned are provided to further improve the fault detection effectiveness and overcome various challenges."
PHANTOM: Curating GitHub for engineered software projects using time-series clustering,"ContextWithin the field of Mining Software Repositories, there are numerous methods employed to filter datasets in order to avoid analysing low-quality projects. Unfortunately, the existing filtering methods have not kept up with the growth of existing data sources, such as GitHub, and researchers often rely on quick and dirty techniques to curate datasets.ObjectiveThe objective of this study is to develop a method capable of filtering large quantities of software projects in a resource-efficient way.MethodThis study follows the Design Science Research (DSR) methodology. The proposed method, PHANTOM, extracts five measures from Git logs. Each measure is transformed into a time-series, which is represented as a feature vector for clustering using the k-means algorithm.ResultsUsing the ground truth from a previous study, PHANTOM was shown to be able to rediscover the ground truth on the training dataset, and was able to identify “engineered” projects with up to 0.87 Precision and 0.94 Recall on the validation dataset. PHANTOM downloaded and processed the metadata of 1,786,601 GitHub repositories in 21.5 days using a single personal computer, which is over 33% faster than the previous study which used a computer cluster of 200 nodes. The possibility of applying the method outside of the open-source community was investigated by curating 100 repositories owned by two companies.ConclusionsIt is possible to use an unsupervised approach to identify engineered projects. PHANTOM was shown to be competitive compared to the existing supervised approaches while reducing the hardware requirements by two orders of magnitude."
Code and commit metrics of developer productivity: a study on team leaders perceptions,"ContextDeveloper productivity is essential to the success of software development organizations. Team leaders use developer productivity information for managing tasks in a software project. Developer productivity metrics can be computed from software repositories data to support leaders’ decisions. We can classify these metrics in code-based metrics, which rely on the amount of produced code, and commit-based metrics, which rely on commit activity. Although metrics can assist a leader, organizations usually neglect their usage and end up sticking to the leaders’ subjective perceptions only.ObjectiveWe aim to understand whether productivity metrics can complement the leaders’ perceptions. We also aim to capture leaders’ impressions about relevance and adoption of productivity metrics in practice.MethodThis paper presents a multi-case empirical study performed in two organizations active for more than 18 years. Eight leaders of nine projects have ranked the developers of their teams by productivity. We quantitatively assessed the correlation of leaders’ rankings versus metric-based rankings. As a complement, we interviewed leaders for qualitatively understanding the leaders’ impressions about relevance and adoption of productivity metrics given the computed correlations.ResultsOur quantitative data suggest a greater correlation of the leaders’ perceptions with code-based metrics when compared to commit-based metrics. Our qualitative data reveal that leaders have positive impressions of code-based metrics and potentially would adopt them.ConclusionsData triangulation of productivity metrics and leaders’ perceptions can strengthen the organization conviction about productive developers and can reveal productive developers not yet perceived by team leaders and probably underestimated in the organization."
RePOR: Mimicking humans on refactoring tasks. Are we there yet?,"Refactoring is a maintenance activity that aims to improve design quality while preserving the behavior of a system. Several (semi)automated approaches have been proposed to support developers in this maintenance activity, based on the correction of anti-patterns, which are “poor” solutions to recurring design problems. However, little quantitative evidence exists about the impact of automatically refactored code on program comprehension, and in which context automated refactoring can be as effective as manual refactoring. Leveraging RePOR, an automated refactoring approach based on partial order reduction techniques, we performed an empirical study to investigate whether automated refactoring code structure affects the understandability of systems during comprehension tasks. (1) We surveyed 80 developers, asking them to identify from a set of 20 refactoring changes if they were generated by developers or by a tool, and to rate the refactoring changes according to their design quality; (2) we asked 30 developers to complete code comprehension tasks on 10 systems that were refactored by either a freelancer or an automated refactoring tool. To make comparison fair, for a subset of refactoring actions that introduce new code entities, only synthetic identifiers were presented to practitioners. We measured developers’ performance using the NASA task load index for their effort, the time that they spent performing the tasks, and their percentages of correct answers. Our findings, despite current technology limitations, show that it is reasonable to expect a refactoring tools to match developer code. Indeed, results show that for 3 out of the 5 anti-pattern types studied, developers could not recognize the origin of the refactoring (i.e., whether it was performed by a human or an automatic tool). We also observed that developers do not prefer human refactorings over automated refactorings, except when refactoring Blob classes; and that there is no statistically significant difference between the impact on code understandability of human refactorings and automated refactorings. We conclude that automated refactorings can be as effective as manual refactorings. However, for complex anti-patterns types like the Blob, the perceived quality achieved by developers is slightly higher."
What do Programmers Discuss about Deep Learning Frameworks,"Deep learning has gained tremendous traction from the developer and researcher communities. It plays an increasingly significant role in a number of application domains. Deep learning frameworks are proposed to help developers and researchers easily leverage deep learning technologies, and they attract a great number of discussions on popular platforms, i.e., Stack Overflow and GitHub. To understand and compare the insights from these two platforms, we mine the topics of interests from these two platforms. Specifically, we apply Latent Dirichlet Allocation (LDA) topic modeling techniques to derive the discussion topics related to three popular deep learning frameworks, namely, Tensorflow, PyTorch and Theano. Within each platform, we compare the topics across the three deep learning frameworks. Moreover, we make a comparison of topics between the two platforms. Our observations include 1) a wide range of topics that are discussed about the three deep learning frameworks on both platforms, and the most popular workflow stages are Model Training and Preliminary Preparation. 2) the topic distributions at the workflow level and topic category level on Tensorflow and PyTorch are always similar while the topic distribution pattern on Theano is quite different. In addition, the topic trends at the workflow level and topic category level of the three deep learning frameworks are quite different. 3) the topics at the workflow level show different trends across the two platforms. e.g., the trend of the Preliminary Preparation stage topic on Stack Overflow comes to be relatively stable after 2016, while the trend of it on GitHub shows a stronger upward trend after 2016. Besides, the Model Training stage topic still achieves the highest impact scores across two platforms. Based on the findings, we also discuss implications for practitioners and researchers."
Retraction Note: Retraction note to: The smell of fear: on the relation between test smells and flaky tests,
On (Mis)perceptions of testing effectiveness: an empirical study,"A recurring problem in software development is incorrect decision making on the techniques, methods and tools to be used. Mostly, these decisions are based on developers’ perceptions about them. A factor influencing people’s perceptions is past experience, but it is not the only one. In this research, we aim to discover how well the perceptions of the defect detection effectiveness of different techniques match their real effectiveness in the absence of prior experience. To do this, we conduct an empirical study plus a replication. During the original study, we conduct a controlled experiment with students applying two testing techniques and a code review technique. At the end of the experiment, they take a survey to find out which technique they perceive to be most effective. The results show that participants’ perceptions are wrong and that this mismatch is costly in terms of quality. In order to gain further insight into the results, we replicate the controlled experiment and extend the survey to include questions about participants’ opinions on the techniques and programs. The results of the replicated study confirm the findings of the original study and suggest that participants’ perceptions might be based not on their opinions about complexity or preferences for techniques but on how well they think that they have applied the techniques."
Characterizing the evolution of statically-detectable performance issues of Android apps,"Mobile apps are playing a major role in our everyday life, and they are tending to become more and more complex and resource demanding. Because of that, performance issues may occur, disrupting the user experience or, even worse, preventing an effective use of the app. Ultimately, such problems can cause bad reviews and influence the app success. Developers deal with performance issues thorough dynamic analysis, i.e., performance testing and profiler tools, albeit static analysis tools can be a valid, relatively inexpensive complement for the early detection of some such issues. This paper empirically investigates how potential performance issues identified by a popular static analysis tool — Android Lint — are actually resolved in 316 open source Android apps among 724 apps we analyzed. More specifically, the study traces the issues detected by Android Lint since their introduction until they resolved, with the aim of studying (i) the overall evolution of performance issues in apps, (ii) the proportion of issues being resolved, as well as (iii) the distribution of their survival time, and (iv) the extent to which issue resolution are documented by developers in commit messages. Results indicate how some issues, especially related to the lack of resource recycle, tend to be more frequent than others. Also, while some issues, primarily of algorithmic nature, tend to be resolved quickly through well-known patterns, others tend to stay in the app longer, or not to be resolved at all. Finally, we found how only 10% of the issue resolution is documented in commit messages."
